twitter_id,date,tweet
1187007698233020417,2019-10-23 14:07:43+00:00,b'\xe0\xae\xb5\xe0\xae\xa3\xe0\xae\x95\xe0\xaf\x8d\xe0\xae\x95\xe0\xae\xae\xe0\xaf\x8d \xe0\xae\x89\xe0\xae\x99\xe0\xaf\x8d\xe0\xae\x95\xe0\xae\xb3\xe0\xaf\x8d \xe0\xae\xaa\xe0\xaf\x8a\xe0\xae\xa9\xe0\xaf\x8d\xe0\xae\xa9\xe0\xae\xbe\xe0\xae\xa9 \xe0\xae\xa8\xe0\xaf\x87\xe0\xae\xb0\xe0\xae\xa4\xe0\xaf\x8d\xe0\xae\xa4\xe0\xae\xbf\xe0\xae\xb2\xe0\xae\xbf\xe0\xae\xb0\xe0\xaf\x81\xe0\xae\xa8\xe0\xaf\x8d\xe0\xae\xa4\xe0\xaf\x81 \xe0\xae\x92\xe0\xae\xb0\xe0\xaf\x81 3 \xe0\xae\xa8\xe0\xae\xbf\xe0\xae\xae\xe0\xae\xbf\xe0\xae\x9f\xe0\xae\x99\xe0\xaf\x8d\xe0\xae\x95\xe0\xae\xb3\xe0\xaf\x8d \xe0\xae\x92\xe0\xae\xa4\xe0\xaf\x81\xe0\xae\x95\xe0\xaf\x8d\xe0\xae\x95\xe0\xae\xbf \xe0\xae\xa4\xe0\xae\xaa\xe0\xae\x99\xe0\xaf\x8d 3 -\xe0\xae\x9f\xe0\xae\xbf\xe0\xae\xb0\xe0\xaf\x88\xe0\xae\xb2\xe0\xae\xb0\xe0\xaf\x88 \xe0\xae\xaa\xe0\xae\xbe\xe0\xae\xb0\xe0\xaf\x81\xe0\xae\x99\xe0\xaf\x8d\xe0\xae\x95\xe0\xae\xb3\xe0\xaf\x8d \n#Dabangg3TamilTrailer\n\nhttps://t.co/5fm1NDHU3a\n\n@arbaazSkhan @sonakshisinha @saieemmanjrekar @PDdancing @KicchaSudeep @nikhil_dwivedi @SKFilmsOfficial @saffronbrdmedia @kjr_studios'
1187002644356685826,2019-10-23 13:47:38+00:00,"b'\xe0\xb2\xa6\xe0\xb2\xaf\xe0\xb2\xb5\xe0\xb2\xbf\xe0\xb2\x9f\xe0\xb3\x8d\xe0\xb2\x9f\xe0\xb3\x81, \xe0\xb2\xa6\xe0\xb2\xac\xe0\xb2\xbe\xe0\xb2\x82\xe0\xb2\x97\xe0\xb3\x8d3 \xe0\xb2\x95\xe0\xb2\xa8\xe0\xb3\x8d\xe0\xb2\xa8\xe0\xb2\xa1 \xe0\xb2\x9f\xe0\xb3\x8d\xe0\xb2\xb0\xe0\xb3\x88\xe0\xb2\xb2\xe0\xb2\xb0\xe0\xb3\x8d \xe0\xb2\xa8\xe0\xb3\x8b\xe0\xb2\xa1\xe0\xb3\x81\xe0\xb2\xb5\xe0\xb2\xa6\xe0\xb2\x95\xe0\xb3\x8d\xe0\xb2\x95\xe0\xb2\xbe\xe0\xb2\x97\xe0\xb2\xbf \xe0\xb2\xa8\xe0\xb2\xbf\xe0\xb2\xae\xe0\xb3\x8d\xe0\xb2\xae \xe0\xb2\x85\xe0\xb2\xae\xe0\xb3\x82\xe0\xb2\xb2\xe0\xb3\x8d\xe0\xb2\xaf \xe0\xb2\xb8\xe0\xb2\xae\xe0\xb2\xaf\xe0\xb2\xa6\xe0\xb2\xb2\xe0\xb3\x8d\xe0\xb2\xb2\xe0\xb2\xbf 3 \xe0\xb2\xa8\xe0\xb2\xbf\xe0\xb2\xae\xe0\xb2\xbf\xe0\xb2\xb7\xe0\xb2\x97\xe0\xb2\xb3\xe0\xb2\xa8\xe0\xb3\x8d\xe0\xb2\xa8\xe0\xb3\x81 \xe0\xb2\xa8\xe0\xb2\xae\xe0\xb2\x97\xe0\xb2\xbe\xe0\xb2\x97\xe0\xb2\xbf \xe0\xb2\x95\xe0\xb3\x8a\xe0\xb2\xa1\xe0\xb2\xac\xe0\xb2\xb9\xe0\xb3\x81\xe0\xb2\xa6\xe0\xb2\xbe #Dabangg3KannadaTrailer\n\nhttps://t.co/lLI9Gsk630\n\n@arbaazSkhan @sonakshisinha @saieemmanjrekar @PDdancing @KicchaSudeep @nikhil_dwivedi @SKFilmsOfficial @saffronbrdmedia @AChowksey'"
1186983224947294209,2019-10-23 12:30:28+00:00,"b""Here it is...Pls take out time from your busy schedule and watch 3 mins of 'Dabangg 3' #Dabangg3Trailer\n\nhttps://t.co/BZRJWWSIPG\n\n@arbaazSkhan @sonakshisinha @saieemmanjrekar @PDdancing @KicchaSudeep @nikhil_dwivedi @SKFilmsOfficial @saffronbrdmedia"""
1186564446778380288,2019-10-22 08:46:24+00:00,b'Hamari pure innocent masoom Khushi...#Dabangg3TrailerOutTomorrow\n\n@saieemmanjrekar @arbaazSkhan @sonakshisinha @PDdancing @KicchaSudeep @nikhil_dwivedi @SKFilmsOfficial @saffronbrdmedia https://t.co/xrg1oYbjbQ'
1186560656754917381,2019-10-22 08:31:20+00:00,b'#Dabangg3TrailerOutTomorrow\n\nhttps://t.co/Wuq5Y0mJtd\n\n@saieemmanjrekar @arbaazSkhan @sonakshisinha @PDdancing @KicchaSudeep @nikhil_dwivedi @SKFilmsOfficial @saffronbrdmedia'
1186242319663521792,2019-10-21 11:26:22+00:00,b'Aaj boss buss vote karo . . #VoteKarMaharashtra https://t.co/bMuzaZOoYP'
1186171572886724608,2019-10-21 06:45:15+00:00,b'Hindustani sabhyata ki chakki se bani hamaari super sexy Rajjo... #2DaysToDabangg3Trailer\n\n@sonakshisinha @arbaazSkhan @saieemmanjrekar @PDdancing @KicchaSudeep @nikhil_dwivedi @SKFilmsOfficial @saffronbrdmedia https://t.co/ljtBp53K3E'
1186167923926339584,2019-10-21 06:30:45+00:00,b'#2DaysToDabangg3Trailer\n\nhttps://t.co/5TbvkXkm5I\n\n@sonakshisinha @arbaazSkhan @saieemmanjrekar @PDdancing @KicchaSudeep @nikhil_dwivedi @SKFilmsOfficial @saffronbrdmedia'
1185865976379666433,2019-10-20 10:30:55+00:00,b'Too much fun is on its way #Dubai on 8 Nov at Coca-Cola Arena. See you all there! Book your tickets: https://t.co/k6bMGYwsep @gmcarabia @splashfashions @hayatvacations @city1016 @khaleejtimes @ZeeTVME \n@dyl3r @thejaevents\n@Sohailkhanofficial @aadu_adil @jordy_patel #bhaiindubai https://t.co/UaURTgpSKT'
1185791086905757696,2019-10-20 05:33:20+00:00,"b'World TV Premiere of #Bharat, tonight at 8PM on @zeecinema\n#KatrinaKaif @bindasbhidu @WhoSunilGrover @atulreellife @nikhilnamit @SKFilmsOfficial @reellifeprodn @TSeries #BharatOnZeeCinema #SeeneMeinCinema #ZeeCinema https://t.co/gi39zjTxCs'"
1185577326240661510,2019-10-19 15:23:56+00:00,"b'One man changed our entire nation. His thoughts, his legacy will forever live on. Honouring 150 years of Gandhiji - https://t.co/06qDtgWrQc #ChangeWithin\n@RajkumarHirani @RHFilmsOfficial'"
1185173812662259713,2019-10-18 12:40:31+00:00,"b""Aap he ne poocha tha 'Dabangg 3' ke baad kya? What and when? Yeh lo answer #EidRadheKi \n\nhttps://t.co/mKp4gYsoUz\n\n@arbaazSkhan @SohailKhan @sonakshisinha @saieemmanjrekar @PDdancing @KicchaSudeep @atulreellife @nikhil_dwivedi @SKFilmsOfficial @saffronbrdmedia @ReelLifeProdn"""
1184737090044452864,2019-10-17 07:45:08+00:00,"b'Mazza aa gaya trailer dekh ke! Chaa gaya hai humara Satellite, @Sooraj9pancholi\n#SatelliteShankar trailer: \nhttps://t.co/Uofjye9HrX \n@MuradKhetani @ashwinvarde #IrfanKamal @Cine1Studios @SatelliteSMovie'"
1182976173896126465,2019-10-12 11:07:53+00:00,b'Trailer kaafi kamaal h @theathiyashetty @Nawazuddin_S !\nBhai ne bola aapko best wishes dene ko! All the best!\n\nhttps://t.co/UocNB9R3Gq'
1181838399818190848,2019-10-09 07:46:46+00:00,"b'Paani k gote lagaye aapke Bhai ne kal, kaaafi cool baccho k saath! Dharti maa ka aadar sammaan hamesha sar aankhon pe... https://t.co/2MUsbbHIbs'"
1181456967648399360,2019-10-08 06:31:06+00:00,"b""Villain jitna bada ho, usse bhidne mein utna hi mazaa aata hai.\nIntroducing Sudeep Kiccha as Balli in 'Dabangg 3'.\n\n#KicchaSudeepInDabangg3\n\n@KicchaSudeep @arbaazSkhan @sonakshisinha @saieemmanjrekar @PDdancing @nikhil_dwivedi @SKFilmsOfficial @saffronbrdmedia https://t.co/vvZYvroHYF"""
1180889345710055425,2019-10-06 16:55:34+00:00,b'#Dabangg3 https://t.co/VZecKOtaYD'
1180733662167552006,2019-10-06 06:36:56+00:00,b'Hyderabad!! Taiyaar ho jao #DabanggTheTour k liye.. aapke sheher me 2nd Nov ko L.B Stadium! Bhai ko dekhna mat bhoolna #DabanggTheTourHyderabad #Babaelaichi #FarhathHussain #SigmaInfratech #TelanganaTourism #Lunettes #Eventsnow #9thElementEntertainments \n@theJAEvents @SohailKhan https://t.co/cf9yVF4gpD'
1180105002628435969,2019-10-04 12:58:52+00:00,"b'Nagpur vasiyoon! @bebeinghuman ka ek aur store aapke sheher me khul raha h, at Trilium mall. Bhai ki baat maano, jao, Dussehra aur Diwali dhoomdhaam se manao! https://t.co/v37duSk4WQ'"
1179101842170474496,2019-10-01 18:32:40+00:00,"b'#GandhiJayanti k is mauke pe, Bhai ne bola aapko message dene ko... \naur Chulbul Pandey is ready! \n@PMOIndia @KirenRijiju https://t.co/qmL1WpflK2'"
1178919911248269312,2019-10-01 06:29:44+00:00,b'Hello! My name is Chulbul Pandey.\nNice to meet you! \n\n#Dabangg3WithChulbulPandey\n\nhttps://t.co/veZjWKAwyp \n\n@arbaazSkhan @sonakshisinha @saieemmanjrekar @PDdancing @KicchaSudeep @nikhil_dwivedi @SKFilmsOfficial @saffronbrdmedia'
1178767000602103808,2019-09-30 20:22:08+00:00,"b""My half brother of PRDP's brother, again a man of 3 names, has made a movie with my half brother of PRDP. Saw the trailer.. v interesting! Best of luck to @NamanNMukesh n @NeilNMukesh\nMay u make your father n grand father proud n win lots of hearts https://t.co/UvbnEmtvBa"""
1178661955508129792,2019-09-30 13:24:43+00:00,b'Yeh \xe0\xa4\xad\xe0\xa4\x82\xe0\xa4\x97\xe0\xa4\xa1\xe0\xa4\xbc\xe0\xa4\xbe hai janaab! India te \xe0\xa4\x87\xe0\xa4\x82\xe0\xa4\xa1\xe0\xa4\xbf\xe0\xa4\xaf\xe0\xa4\xbe waalon di shaan hai! \xf0\x9f\x95\xba\xf0\x9f\x8f\xbb\nPresenting the official trailer of #BhangraPaaLe: https://t.co/2yOPvP7eTy  \n@sunnykaushal89 @RuksharDhillon @ShriyaP @SnehaTaurani @RonnieScrewvala @RSVPMovies @ipritamofficial @jam8studio @tipsofficial'
1177173330345857024,2019-09-26 10:49:27+00:00,b'Many congrats Farhath on winning the Dada Saheb Phalke award south for excellence in live events. https://t.co/c0tBy4G0tl'
1175834093549834240,2019-09-22 18:07:48+00:00,b'Way to go PM Modi and Prez Trump for a great association between the 2 nations. . . @narendramodi @realDonaldTrump https://t.co/FNqhkB4UyG'
1174719092101718018,2019-09-19 16:17:11+00:00,b'Congrats on becoming aspiring shot yet again! Now thoda medal ko target karo. @ShahDaisy25 https://t.co/BcB6bSUnWC'
1174590883070713857,2019-09-19 07:47:44+00:00,b'Wishing Charan and Chiranjeevi all the best for the movie!\n#Chiranjeevi #RamCharan #SyeRaa  \nhttps://t.co/QV4vOiGNw0'
1174562008634548230,2019-09-19 05:52:59+00:00,b'#iifa2019 https://t.co/NC1BKrtLws'
1173909388848844801,2019-09-17 10:39:43+00:00,b'Dabangg Dhamaka on 8th Nov!\nC u all there! Book your tkts on . . \nhttps://t.co/SFnCEH9y2n \n#bhaiindubai @cocacolaarena @GMCarabia @SplashFashions  @HayatVacations @City1016 @khaleejtimes  @BookMyShowUAE @ZeeTVME @rsbelhasa_ @official_s1 @theJAEvents @SohailKhan @patel_jordy https://t.co/oKcxklbykv'
1173521078108532736,2019-09-16 08:56:42+00:00,"b""Please vote for my friends and favourite musicians 'Dimitri Vegas &amp; Like Mike\xe2\x80\x99 (as 1 artist/group) as your #1 DJ on: https://t.co/4NAIxslt16 @dimitrivegas @likemike https://t.co/xYTNZ8lCeV"""
1172130253508108289,2019-09-12 12:50:04+00:00,b'Yeh do pehlwaan Sahi bol rahe hai..  @SunielVShetty @KicchaSudeep https://t.co/YqZKL4o7Z6'
1171665013515411457,2019-09-11 06:01:22+00:00,b'Dabangg 3 ki deewaangi chaayegi ab Kannada mein bhi.\nSwagat Toh Karo Humara! #100DaystoDabangg3\n\nhttps://t.co/XWN0YNKEoY\n\n@arbaazSkhan @sonakshisinha @saieemmanjrekar @PDdancing @KicchaSudeep @nikhil_dwivedi @SKFilmsOfficial @saffronbrdmedia @AChowksey'
1171662380864065536,2019-09-11 05:50:54+00:00,"b'Dabangg 3 ab hogi aur bhi terrific, Telugu mein. Swagat Toh Karo Humara! #100DaystoDabangg3\n\nhttps://t.co/WkOV2aiyOc\n\n@arbaazSkhan @sonakshisinha @saieemmanjrekar @PDdancing @KicchaSudeep @nikhil_dwivedi @SKFilmsOfficial @saffronbrdmedia @AChowksey @SureshProdns #GlobalCinemasLLP'"
1171660260161052672,2019-09-11 05:42:29+00:00,b'Chulbul Pandey ke saath lijiye maza Dabangg 3 ka ab Tamil mein.\nSwagat Toh Karo Humara! #100DaystoDabangg3\n\nhttps://t.co/Vp30lD6zPC\n\n@arbaazSkhan @sonakshisinha @saieemmanjrekar @PDdancing @KicchaSudeep @nikhil_dwivedi @SKFilmsOfficial @saffronbrdmedia @kjr_studios @AChowksey'
1171657171953770496,2019-09-11 05:30:12+00:00,b'Aa Rahe Hain! Chulbul Robinhood Pandey. Theek 100 din baad. Swagat Toh Karo Humara! #100DaystoDabangg3\n\nhttps://t.co/MVGLceqIez\n\n@arbaazSkhan @sonakshisinha @PDdancing @KicchaSudeep @nikhil_dwivedi @SKFilmsOfficial @kjr_studios @AChowksey @SureshProdns #GlobalCinemasLLP'
1169993071154683906,2019-09-06 15:17:40+00:00,b'Mumbai city in d rains . . Off to the location to shoot for #dabangg3 https://t.co/sVY9Sa3Zdq'
1169654374424924160,2019-09-05 16:51:48+00:00,b'Witness the biggest love story of this generation. All the best!\nPresenting the trailer of #PalPalDilKePaas: https://t.co/v48TObEhA1\n\n#KaranDeol #SahherBambba @aapkadharam @iamsunnydeol @shariqpatel @ZeeStudios_ @SunnySuperSound @ZeeMusicCompany #PalPalDilKePaasTrailer'
1169605047828832256,2019-09-05 13:35:48+00:00,b'To all my teachers who have taught me in school and to my guru at home. . Sorry I couldn\xe2\x80\x99t b the best student ha ha ha. . . Have a long healthy life. Happy teacher\xe2\x80\x99s day https://t.co/FDVr2uM3cN'
1168962227027742727,2019-09-03 19:01:27+00:00,"b'The Up, Close &amp; Personal event in US n Canada has been postponed to Spring 2020 . . C u all then . . @beingbhav @sahilpromotions'"
1168411457513381888,2019-09-02 06:32:54+00:00,b'https://t.co/WkuRbeap8N'
1166357621328293888,2019-08-27 14:31:41+00:00,b'A bigg thank u to the Indian film industry n to every 1 who has been a part of this 31 year journey specially all my fans and well wishers who have made this amazing journey possible . . https://t.co/w4XJ31FNT1'
1165963886874415106,2019-08-26 12:27:07+00:00,"b'Itna mat sochna mere baare mein, Dil mein aata hoon.. aur Eid pe bhi \xf0\x9f\x98\x89'"
1165670694908309508,2019-08-25 17:02:05+00:00,"b'The film with Sanjay Leela Bhansali is pushed but I will still see you all on Eid, 2020. Insha-Allah!!'"
1165286091114668032,2019-08-24 15:33:48+00:00,b'Wishing the couple a happy married life. . Wish I cud hv been there in person to wish u guys. . #Shikha #vinit @patel_jordy https://t.co/i7MBjRoAEC'
1164047602754580480,2019-08-21 05:32:30+00:00,"b'Chulbul Pandey coming to you on 20th Dec in hindi, kannada, tamil and telugu! #Dabangg3 @arbaazSkhan @sonakshisinha @saieemmanjrekar @PDdancing  @KicchaSudeep @nikhil_dwivedi @SKFilmsOfficial @saffronbrdmedia @kjr_studios @SureshProdns #GlobalCinemasLLP @AChowksey https://t.co/LHJ68DWEUd'"
1163440820072009730,2019-08-19 13:21:21+00:00,b'Hyderabad see u on 2nd Nov . .\n#DabanggTheTourHyderabad #Babaelaichi #FarhathHussain #SigmaInfratech #TelanganaTourism  #Eventsnow #Fever943Fm #SohailKhanEntertainments #JAEvents https://t.co/gSDQbP9Yoj'
1162970641697406976,2019-08-18 06:13:02+00:00,b'Yaad hai hum sab ka IIFA 2017 performance in Madrid? Fond memories . . #MyIIFAMoment #iifa20 #IIFAhomecoming https://t.co/Z7olWbC2QR'
1162445359022350336,2019-08-16 19:25:45+00:00,b'The best entertaining director who has given me the maximum films and hits . . Happy birthday! #DavidDhawan https://t.co/Am8UPWUFIb'
1162398539277852672,2019-08-16 16:19:42+00:00,b'Happy birthday majha bhau... all the happiness! @manjrekarmahesh https://t.co/spuIhvKaRp'
1161905577498464256,2019-08-15 07:40:51+00:00,b'Happy #IndependenceDayIndia \nMay you prosper and grow forever. https://t.co/iE5dnwNS2V'
1160875656818974720,2019-08-12 11:28:19+00:00,"b'On this Eid, sending my best wishes to everyone. Have a blessed Eid Ul Adha! #EidMubarak'"
1158700672897781760,2019-08-06 11:25:42+00:00,"b'Saare tweets bharat ki devotion mein,\nslow motion mein, stream now: https://t.co/Qm7Wys2ec4'"
1158318985613496320,2019-08-05 10:09:01+00:00,b'Best wishes Karan. . Welcome to the Indian film industry with \xe2\x80\x98pal pal dil ke paas\xe2\x80\x99 @iamsunnydeol #KaranDeol \nhttps://t.co/lR1r31tUhG'
1157516051455729664,2019-08-03 04:58:26+00:00,b'#IsabelleKaif and @aaysharma to star in a film inspired by true events involving the Indian army in #Kwatha @karanlbutani https://t.co/GW2bOlW5Yi'
1157163192214142976,2019-08-02 05:36:18+00:00,"b'Dukandar Bhaiyon, Poore Market Me Danka Bajao!\nBharatPe Lagao, Dhandha Badhao \n\n#BharatPe #IskoLagaoDhandhaBadhao #AbSeDukandarIsKing #SirfDukandarKiye https://t.co/sUGEwvuyqi'"
1156987814891802624,2019-08-01 17:59:25+00:00,b'See me up close and personal this month..... @imkamaalkhan @beingbhav @sahilpromotions https://t.co/SCUOHcO0Qy'
1156110663900528641,2019-07-30 07:53:56+00:00,b'https://t.co/AOdgjFzODw https://t.co/EMWxqR31xx'
1155891895295533056,2019-07-29 17:24:37+00:00,b'Happy birthday baba... @duttsanjay https://t.co/XSckDs5sj5'
1152575432790642688,2019-07-20 13:46:11+00:00,b'Posting the old fashioned way... https://t.co/yITahGNA3s'
1151224501071278080,2019-07-16 20:18:04+00:00,b'God bless... can\xe2\x80\x99t reciprocate the love but prayers and much love !!! https://t.co/lL5wmfVg7a'
1151224303058206720,2019-07-16 20:17:17+00:00,b'Happy birthday Katrinaaa... https://t.co/azEvQccGDw'
1151045904465575941,2019-07-16 08:28:23+00:00,b'Are waa himesh\nhttps://t.co/veOqF4oL2r'
1150441860663525377,2019-07-14 16:28:08+00:00,b'Being strong gym set up for #dabangg3 @beingstrongind https://t.co/8XGDObd53z'
1150382907518644224,2019-07-14 12:33:52+00:00,b'Don\xe2\x80\x99t thakao paani bachao https://t.co/PjfdGxdTJg'
1150092566450196480,2019-07-13 17:20:10+00:00,"b'Life used to be black-and-white, yes or no, truth or lies, it was crystal clear now perhaps it\xe2\x80\x99s grey, it\xe2\x80\x99s maybe. Who the hell cares, is that true? Hope not for god\xe2\x80\x99s sake. Long live morals nd principles and ethics. https://t.co/kQxTqHrOHI'"
1149547633003728897,2019-07-12 05:14:47+00:00,b'#thuptentsering https://t.co/dxb7NeeR88'
1148678020351365120,2019-07-09 19:39:16+00:00,b'Dance class from the master himself . . @PDdancing @KicchaSudeep #WardakhanNadiadwala https://t.co/fiQiNDmQEG'
1147478791003889664,2019-07-06 12:13:57+00:00,b'Being strong equipment displayed in delhi at the pragati maidan agar aas pass ho aur time ho toh go check it out n feed back de Dena #beingstrong @realstrongin @beingstrongind https://t.co/XFK3aoq4b2'
1147145509519314944,2019-07-05 14:09:37+00:00,b'My superstar Sitara . . https://t.co/8wpwp2MnZZ'
1146778554811600899,2019-07-04 13:51:28+00:00,"b'Aaj being human foundation ne 12 yrs complete kar liya hai app sab ki kripa or support services ke saath . Long n healthy life to all of u n may being human always be there.\nThank u all, god bless! https://t.co/rBU1gAgjeM'"
1146767886788096001,2019-07-04 13:09:04+00:00,b'Starting #SK27 gyms! Go have a look at the Pragati maidan exhibition from 5-7 July. #HumFitTohIndiaFit @beingstrongind  @JeraiFitness247'
1145793247945605120,2019-07-01 20:36:12+00:00,b'While sketching a song of har dil played n this dialogue was written by my friend Sajid Nadiadwala grandson n at that point in time I thought it was complete but .... https://t.co/6bU2ykSlCu'
1145686228756361218,2019-07-01 13:30:57+00:00,"b'Agar dikhana hai, beat Karna hai, maarna hai, toh mehnat kar ke apna level badha ke kaam se maaro... nothing better than working hard... https://t.co/qPugA8MxTW'"
1145049637553922049,2019-06-29 19:21:22+00:00,b'Hamara bajrangi bhaijaan plastic ki bottle se paani nahi peeta ... https://t.co/uojM8w7IJX'
1144960521461878785,2019-06-29 13:27:15+00:00,b'Bacche bacche mein hai #Bharat https://t.co/fkuoygVJNV'
1144221842741182464,2019-06-27 12:32:00+00:00,b'Introducing Pramod Khanna . . #Dabangg3 @sonakshisinha @PDdancing https://t.co/wYDvcsQWw7'
1143908601188114433,2019-06-26 15:47:17+00:00,"b'Spending time with the most loving, loyal and selfless species. https://t.co/a5itvUEGwV'"
1143866627298979841,2019-06-26 13:00:30+00:00,b'Time flies v fast. . Learn how to appreciate it https://t.co/cpcrF2YDVf'
1143535382656704514,2019-06-25 15:04:15+00:00,"b'The Sultan, Tiger, Bharat of our family . . Singing @luvsalimkhan https://t.co/Hy0HeakztR'"
1142844750719926272,2019-06-23 17:19:56+00:00,b'In splits .. ha ha ha ha https://t.co/57aCVrpWHU'
1142511967933874176,2019-06-22 19:17:34+00:00,b'Ayaan vs me .. https://t.co/AADL1zvd3Z'
1142511713989742592,2019-06-22 19:16:34+00:00,b'Arhaan vs me .. https://t.co/7680mRRi7h'
1142510762742599680,2019-06-22 19:12:47+00:00,b'Nirvaan vs Arhaan ... https://t.co/GZMFnY129w'
1142440790767099904,2019-06-22 14:34:44+00:00,b'Overpower horse power ... fun run with @iamzahero https://t.co/32trp8v0ih'
1142128824194256896,2019-06-21 17:55:06+00:00,b'Ahil n his mamu ... https://t.co/ymp5OzeRGf'
1142093525070123008,2019-06-21 15:34:50+00:00,b'I am @beingstrongind and he is @realstrongin https://t.co/CrpJXBFnAy'
1142047006942085120,2019-06-21 12:29:59+00:00,b'https://t.co/gzp7toFoub'
1141062940948217856,2019-06-18 19:19:39+00:00,b'Woh mere peche wire kis cheez ka hai . . Can u guess pls? https://t.co/21i7qvBshs'
1141012881720446976,2019-06-18 16:00:44+00:00,b'It\xe2\x80\x99s not only about being strong but being flexible too . . Being strong equipment now installed in  over 100 gyms in last 2 months https://t.co/YnbWPHZlUO'
1140674094544801792,2019-06-17 17:34:31+00:00,b'After experiencing the highs and lows my security has finally realised how secure dey r wid me .. ha ha https://t.co/DVAG0dbjzy'
1140643218138079233,2019-06-17 15:31:49+00:00,"b'Flying jets yohan khan, mohan grover and mr bean bag https://t.co/AqwOmtCHwa'"
1140478124645212160,2019-06-17 04:35:48+00:00,b'Happy bday Yohan... dad\xe2\x80\x99s got ur back and I got ur front .... but don\xe2\x80\x99t fly too high https://t.co/UNQqtQY4dk'
1140350039652356096,2019-06-16 20:06:50+00:00,b'Congratulations team Bharat... from #Bharat https://t.co/KV48tqHHvc'
1140212118500679680,2019-06-16 10:58:47+00:00,"b""Nobody like u dad. Happy father's day every day, every moment, every breath I take . https://t.co/yp9gBWGNmn"""
1140165179516190720,2019-06-16 07:52:16+00:00,b'Happy Father\xe2\x80\x99s Day daddy https://t.co/91jY9VnYmd'
1139438958448914432,2019-06-14 07:46:32+00:00,b'Thank you @1947Partition for getting us to meet so many families who shared their experiences and memories. @Bharat_TheFilm  #katrinakaif https://t.co/cqlD6ARAGp'
1139113537991823360,2019-06-13 10:13:25+00:00,"b""Thank you so much for all the love and support you have shown towards 'Bharat' #BharatAudienceReactions\n@Bharat_TheFilm @aliabbaszafar @atulreellife @itsBhushanKumar #KatrinaKaif #Tabu @bindasbhidu @DishPatani @WhoSunilGrover @nikhilnamit @reellifeprodn @SKFilmsOfficial @TSeries https://t.co/40vSiCeq0C"""
1138861036818247680,2019-06-12 17:30:04+00:00,b'To all the journalists who have interviewed me during #Bharat ... a big thank u to all...'
1138832853007863810,2019-06-12 15:38:05+00:00,b'Special screening of #Bharat for the real families who experienced the events of 1947 and the partition. Honoured to meet all of them! Salute to the real #Bharat families https://t.co/sThayWsMZr'
1138679819527311360,2019-06-12 05:29:59+00:00,"b'I always thought of him as my younger brother and today he proves it... #RohitShetty  \n\nSooryavanshi releasing on 27th March, 2020. https://t.co/KGHsej3Bow'"
1138668748829675521,2019-06-12 04:45:59+00:00,b'Thank you Bharat team for liking  Bharat... shukriya bhaiyon for watching #Bharat in England...best wishes for the upcoming matches... pura #Bharat apke sath hai... #BharatJeetega https://t.co/jusDppfvOc'
1138034162097577985,2019-06-10 10:44:22+00:00,"b'An unforgettable melody with powerful lyrics, #AayaNaTuSong OUT NOW! - https://t.co/Kfjb5CybP1\n\n@aliabbaszafar @atulreellife @itsBhushanKumar #KatrinaKaif @VishalDadlani @ShekharRavjiani #JyotiNooran @Irshad_Kamil @nikhilnamit @reellifeprodn @SKFilmsOfficial @TSeries'"
1137604922629808128,2019-06-09 06:18:43+00:00,b'Something new is coming up https://t.co/jgmLKl6x4y'
1136530378284359681,2019-06-06 07:08:52+00:00,b'Big thk u sabko fr giving sabse bada opening mere career ka par what made me the happiest &amp; proudest is ki during a scene in my film jab national anthem is recited ev1 stood up as a mark of respect. There could be no bigger respect for our country than this... Jai Hind\xf0\x9f\x99\x8f #Bharat'
1136275342979526657,2019-06-05 14:15:27+00:00,b'#EidMubarak https://t.co/nJSVP4Gzqa'
1135986582903648256,2019-06-04 19:08:01+00:00,b'Hum sab saath saath hain #Bharat https://t.co/RpJMr5PCzJ'
1135942126225674240,2019-06-04 16:11:22+00:00,b'#Bharat promotions #katrinakaif https://t.co/xfnnz0gOpo'
1135781225216454658,2019-06-04 05:32:00+00:00,"b""Kal shuru hoga 'Bharat' ka Safar! Book your tickets now on:\n\nPaytm - https://t.co/V14ZQiWRNs\nBMS - https://t.co/ZyWz8KWPeu\n#BharatReleasesTomorrow\n\n@Bharat_TheFilm @aliabbaszafar @atulreellife @itsBhushanKumar #KatrinaKaif @nikhilnamit @reellifeprodn @SKFilmsOfficial @TSeries https://t.co/GISRP5Kx3I"""
1135520751811944449,2019-06-03 12:16:58+00:00,b'Coming to a theatre near you in two days! #BharatWithFamily \n\n@Bharat_TheFilm @aliabbaszafar @atulreellife @itsBhushanKumar #KatrinaKaif @bindasbhidu @WhoSunilGrover @nikhilnamit @reellifeprodn @SKFilmsOfficial @tseries\n\nExplore more GIFs of Bharat - https://t.co/Ha7pCTeBmZ https://t.co/t1J14EsTC8'
1135183755746824192,2019-06-02 13:57:52+00:00,"b'Honourable Prime Minister, congratulations on a splendid team and all my best wishes to the entire cabinet in their endeavours to make a stronger and equal India. @PMOIndia'"
1134786293282398209,2019-06-01 11:38:30+00:00,b'RT @bookmyshow: #Bharat arrives to a cinema near you on the 5th of June but the wait for tickets is finally over!\n\nSecure your favourite se\xe2\x80\xa6'
1134504820293931008,2019-05-31 17:00:01+00:00,"b'\xe0\xa4\xb8\xe0\xa5\x80\xe0\xa4\xa2\xe0\xa4\xbc\xe0\xa5\x80 , \xe0\xa4\xb8\xe0\xa4\xbe\xe0\xa4\xa1\xe0\xa4\xbc\xe0\xa5\x80 , \xe0\xa4\xb2\xe0\xa4\xa1\xe0\xa4\xbc\xe0\xa4\x95\xe0\xa5\x80 #Bharat #Promotions https://t.co/3En4wbz9hg'"
1134462644046315525,2019-05-31 14:12:26+00:00,b'Father + son... #bharat #promotions https://t.co/X7ZP0i7YvU'
1134331364549877762,2019-05-31 05:30:46+00:00,"b""'Bharat' aur uske parivaar ko milne ke liye jaldi book karo apni tickets! #BharatWithFamily\n\nAdvance Booking now open on:\nBMS - https://t.co/ZyWz8KWPeu\nPaytm - https://t.co/V14ZQiWRNs \n\n@Bharat_TheFilm @aliabbaszafar @atulreellife @itsBhushanKumar #KatrinaKaif @nikhilnamit https://t.co/HCizat1O70"""
1133968957310824448,2019-05-30 05:30:42+00:00,b'When Bharat &amp; crew went aboard on an actual ship! #BharatInMalta - https://t.co/JVch9u8N5H\n\n@Bharat_TheFilm @aliabbaszafar @atulreellife @itsBhushanKumar #KatrinaKaif #Tabu @bindasbhidu @DishPatani @WhoSunilGrover @norafatehi @nikhilnamit @reellifeprodn @SKFilmsOfficial @TSeries'
1133758857606500353,2019-05-29 15:35:50+00:00,b'#Bharat Promotions https://t.co/ZnuzudwRXy'
1133289609650163712,2019-05-28 08:31:13+00:00,b'Bharat Ki Team #BharatThisEid - https://t.co/e9E6yE4qNl\n\n@Bharat_TheFilm @aliabbaszafar @atulreellife @itsBhushanKumar #KatrinaKaif #Tabu @bindasbhidu @sonalikulkarni @DishPatani @WhoSunilGrover @norafatehi @iaasifsheikh @nikhilnamit @reellifeprodn @SKFilmsOfficial @TSeries'
1133244045684236289,2019-05-28 05:30:09+00:00,b'Witness the filming of Turpeya and the people behind it! #TurpeyaMaking - https://t.co/KGxkpWDOE2\n\n@Bharat_TheFilm @aliabbaszafar @atulreellife @itsBhushanKumar #KatrinaKaif @Norafatehi @VishalDadlani @ShekharRavjiani @Sukhwindermusic @Irshad_Kamil @nikhilnamit'
