twitter_id,date,tweet
1494670540375793664,2022-02-18 13:50:01+00:00,"b'El coraz\xc3\xb3n es mucho m\xc3\xa1s que un m\xc3\xbasculo que bombea sangre a todo el cuerpo. De hecho, \xc2\xbfsab\xc3\xadas que se puede morir por un coraz\xc3\xb3n roto? \n\nEscucha 5 curiosidades del coraz\xc3\xb3n \xe2\x9d\xa4\xef\xb8\x8f \xe2\x9d\xa4\xef\xb8\x8f  que quiz\xc3\xa1s no conoc\xc3\xadas en este podcast de #CalaAcademy https://t.co/eTMb6h6FXr'"
1494451599271501830,2022-02-17 23:20:01+00:00,"b'La tecnolog\xc3\xada o las redes sociales son un plus en nuestras vidas, no es algo que nos resta. Ahora, todo depende del uso que nosotros le demos a esta ventana digital. \n\n\xc2\xbfCrees estarlas usando de forma positiva? \xf0\x9f\xa4\x94'"
1494405806011338754,2022-02-17 20:18:03+00:00,b'#Mindfulness es la t\xc3\xa9cnica de base que soluciona el problema n.\xc2\xba 1 de todas las personas \xf0\x9f\x8d\x83\xf0\x9f\xa7\x98\xe2\x80\x8d\xe2\x99\x82\xef\xb8\x8f https://t.co/qhV7ZB7nU7'
1494336061194924033,2022-02-17 15:40:55+00:00,b'Asumir que hemos fallado es esencial para generar un verdadero cambio en nuestras vidas. \xc2\xbfEstamos dispuestos a ello? \xf0\x9f\xa7\x90'
1494336058913222663,2022-02-17 15:40:54+00:00,"b'Podemos trabajar duramente en algo, y simplemente fracasar. \xc2\xbfEntonces qu\xc3\xa9 hacer? Nuestra disposici\xc3\xb3n al cambio es esencial, porque el empe\xc3\xb1o terco en querer ir contra nuestra propia realidad es la que nos hace dar de bruces contra la pared.'"
1494336056770007043,2022-02-17 15:40:54+00:00,"b'El fracaso sucede. Es parte del proceso natural de nuestra vida. Puede ser un proceso muy doloroso, y a veces injusto. De \xc3\xa9l podemos aprender duras lecciones para hacer ajustes y continuar, otras tantas; nos tocar\xc3\xa1 entender que lo m\xc3\xa1s sano es abandonar el camino, y avanzar.'"
1494332814149308420,2022-02-17 15:28:00+00:00,"b'Buscar la paz no es pretender alcanzar la perfecci\xc3\xb3n, sino la armon\xc3\xada.'"
1494305635671883776,2022-02-17 13:40:01+00:00,"b'Exponer parte de nuestras vidas en redes sociales no necesariamente es algo superficial, sino que creas una conexi\xc3\xb3n con una comunidad\xe2\x80\xa6 \n\nAqu\xc3\xad te cuento un poco m\xc3\xa1s \xf0\x9f\x91\x87  https://t.co/Xps592RP54'"
1494293052877332480,2022-02-17 12:50:01+00:00,"b'El coraz\xc3\xb3n es mucho m\xc3\xa1s que un m\xc3\xbasculo que bombea sangre a todo el cuerpo. De hecho, \xc2\xbfsab\xc3\xadas que se puede morir por un coraz\xc3\xb3n roto? \n\nEscucha 5 curiosidades del coraz\xc3\xb3n \xe2\x9d\xa4\xef\xb8\x8f \xe2\x9d\xa4\xef\xb8\x8f  que quiz\xc3\xa1s no conoc\xc3\xadas en este podcast de #CalaAcademy https://t.co/eTMb6h6FXr'"
1494105062523686915,2022-02-17 00:23:00+00:00,"b'Si est\xc3\xa1 en tu mente, puede estar en tu vida \xf0\x9f\x92\xab'"
1494032840022966273,2022-02-16 19:36:01+00:00,"b'La verdadera grandeza del ser humano est\xc3\xa1 en que mientras m\xc3\xa1s alto y m\xc3\xa1s lejos llegues, lo hagas desde el pedestal de la HUMILDAD.'"
1493999370160668673,2022-02-16 17:23:01+00:00,"b'Hagamos una lluvia de pensamientos y expresiones positivas: Soy una persona feliz \xe2\x9d\xa4\xef\xb8\x8f, ahora sigue t\xc3\xba \xf0\x9f\x91\x87'"
1493946266119811077,2022-02-16 13:52:00+00:00,b'\xc2\xa1Vivir desde el agradecimiento! RT o \xe2\x9d\xa4\xef\xb8\x8f'
1493914557957484547,2022-02-16 11:46:00+00:00,"b'La felicidad no es una casualidad, es una elecci\xc3\xb3n que debemos tomar cada d\xc3\xada con determinaci\xc3\xb3n. \xc2\xbfT\xc3\xba ya decidiste ser feliz hoy?'"
1493771614906949633,2022-02-16 02:18:00+00:00,b'Haz esto todos los d\xc3\xadas por una semana seguida y cu\xc3\xa9ntame luego c\xc3\xb3mo te va:\n\n- Agradece por algo al despertar y antes de dormir.\n- Lee 10 p\xc3\xa1ginas de un libro que te ense\xc3\xb1e algo que puedas implementar. \n- Haz al menos una tarea que hayas estado postergando.'
1493718516436021255,2022-02-15 22:47:00+00:00,"b'\xc2\xa1No hay excusas! \xf0\x9f\x92\xaa Los peque\xc3\xb1os de la casa, tambi\xc3\xa9n pueden meditar \xf0\x9f\x98\x81\xf0\x9f\x99\x8c https://t.co/brxyiDbvyZ'"
1493668952261730309,2022-02-15 19:30:03+00:00,"b'Me he unido al programa Journey to Well-being \xf0\x9f\x99\x8f\xf0\x9f\x8d\x83. \n\nEl viaje al bienestar con mi maestro, mentor y amigo @DeepakChopra. Reg\xc3\xadstrate gratis aqu\xc3\xad si quieres asistir https://t.co/znicWDsl0U'"
1493630184955826180,2022-02-15 16:56:01+00:00,"b'El coraz\xc3\xb3n es mucho m\xc3\xa1s que un m\xc3\xbasculo que bombea sangre a todo el cuerpo. De hecho, \xc2\xbfsab\xc3\xadas que se puede morir por un coraz\xc3\xb3n roto? \n\nEscucha 5 curiosidades del coraz\xc3\xb3n \xe2\x9d\xa4\xef\xb8\x8f \xe2\x9d\xa4\xef\xb8\x8f  que quiz\xc3\xa1s no conoc\xc3\xadas en este podcast de #CalaAcademy https://t.co/eTMb6h6FXr'"
1493589670462214149,2022-02-15 14:15:01+00:00,b'Toma consciencia del desapego. El primer paso siempre es ACEPTAR que debemos y queremos desapegarnos de alguien o de algo \xe2\x9d\xa4\xef\xb8\x8f'
1493352101187104768,2022-02-14 22:31:00+00:00,"b'El amor puede ser conocido como un lenguaje universal. \xe2\x9d\xa4\xef\xb8\x8f Pero no todos expresamos ese bello sentir de la misma forma. \n\n\xf0\x9f\x91\x89 Hoy 14 de febrero, llenemos Twitter de maneras de expresar amor, comienzo yo: Compartiendo mis conocimientos y ayudando a otros a crecer espiritualmente.'"
1493322058616520704,2022-02-14 20:31:38+00:00,b'Da el paso que necesitas para aprender a comunicarte de manera intuitiva y efectiva. Haz clic en el enlace \xe2\x9e\xa1\xef\xb8\x8f https://t.co/gHVR9TJS8H https://t.co/dMRSdbh9Ge'
1493272832624967681,2022-02-14 17:16:01+00:00,"b'Muchas veces nosotros somos los t\xc3\xb3xicos y no nos damos cuenta, lo digo por experiencia. He tenido que revisar mi punto de vista para entender que el t\xc3\xb3xico no era el otro, sino que era yo.\n\n\xc2\xbfTe haces una evaluaci\xc3\xb3n para revisar si lo t\xc3\xb3xico viene de tu lado?\xf0\x9f\xa4\x94'"
1493222249721118722,2022-02-14 13:55:01+00:00,"b'Exponer parte de nuestras vidas en redes sociales no necesariamente es algo superficial, sino que creas una conexi\xc3\xb3n con una comunidad\xe2\x80\xa6 \n\nAqu\xc3\xad te cuento un poco m\xc3\xa1s \xf0\x9f\x91\x87  https://t.co/Xps592RP54'"
1492858095755747333,2022-02-13 13:48:00+00:00,"b'Cuando no hay un comparativo donde nos sentimos superiores a otros por simples t\xc3\xadtulos, all\xc3\xad es cuando se es realmente HUMILDE.'"
1492833433948766214,2022-02-13 12:10:00+00:00,b'Suelta esa mochila pesada del ayer y decide dar otra mirada al ahora.'
1492605683157635072,2022-02-12 21:05:00+00:00,"b'\xc2\xbfQuieres meditar \xf0\x9f\xa7\x98\xe2\x80\x8d\xe2\x99\x82\xef\xb8\x8f, pero no sabes por d\xc3\xb3nde empezar? \xf0\x9f\x98\x8c Este video es para ti \xf0\x9f\x91\x87  https://t.co/K6Luo6F7KU'"
1492547049853706248,2022-02-12 17:12:01+00:00,"b'Al buscar la paz no pretendemos alcanzar la perfecci\xc3\xb3n, sino la armon\xc3\xada de la vida.'"
1492491681060560898,2022-02-12 13:32:00+00:00,b'Ten presente esto hoy:\n\n\xe2\x9c\x94\xef\xb8\x8f  Vive el presente \n\xe2\x9c\x94\xef\xb8\x8f  Agradece por lo que tienes\n\xe2\x9c\x94\xef\xb8\x8f  Manifiesta lo que quieres\n\xe2\x9c\x94\xef\xb8\x8f  Toma conciencia de tu ser'
1492195987712098306,2022-02-11 17:57:01+00:00,"b'Si est\xc3\xa1 en tu mente, puede estar en tu vida \xf0\x9f\x92\xab'"
1492171359123824644,2022-02-11 16:19:09+00:00,"b'RT @yarixandra_ch: @cala Yo soy saludable, yo soy abundante, yo soy feliz, yo soy inteligente.'"
1492171148091609088,2022-02-11 16:18:19+00:00,b'RT @DariaMPP: @cala Soy feliz y quiero que mi felicidad contin\xc3\xbae a pesar de que el mundo est\xc3\xa9 de cabeza \xf0\x9f\x99\x83.'
1492171089425879041,2022-02-11 16:18:05+00:00,"b'RT @TitiAbby: @cala Soy luz,salud,amor,soy m\xc3\xbasica,soy alegria,soy energ\xc3\xada divina que penetra a los corazones \xf0\x9f\xa6\x8b'"
1492161005601935364,2022-02-11 15:38:01+00:00,"b'Hay que ser perseverantes con los sue\xc3\xb1os, pero hay que ser flexibles con la ejecuci\xc3\xb3n de ese sue\xc3\xb1o.'"
1492109917381140481,2022-02-11 12:15:01+00:00,b'Toma consciencia del desapego. El primer paso siempre es ACEPTAR que debemos y queremos desapegarnos de alguien o de algo \xe2\x9d\xa4\xef\xb8\x8f'
1492083501763596293,2022-02-11 10:30:03+00:00,"b'El amor propio, merece siempre estar en primer lugar \xf0\x9f\x8f\x86\xe2\x9d\xa4\xef\xb8\x8f https://t.co/LS7EcRLn2W'"
1491920417346498560,2022-02-10 23:42:00+00:00,"b'La tecnolog\xc3\xada o las redes sociales son un plus en nuestras vidas, no es algo que nos resta. Ahora, todo depende del uso que nosotros le demos a esta ventana digital. \n\n\xc2\xbfCrees estarlas usando de forma positiva? \xf0\x9f\xa4\x94'"
1491879300513030153,2022-02-10 20:58:37+00:00,"b'Amar tambi\xc3\xa9n es brindar espacio personal y aceptar al otro como individuo. Aprendamos a respetar la privacidad y a otorgarla como algo com\xc3\xban, un acto libre y lleno de amor.'"
1491820768015048705,2022-02-10 17:06:02+00:00,"b'Las quejas y los lamentos no llevan a nada, presta atenci\xc3\xb3n a tu consciencia. Eres el \xc3\xbanico responsable de cambiar lo que est\xc3\xa9 pasando, tienes el poder de elegir.'"
1491778987688873984,2022-02-10 14:20:01+00:00,"b'Cuidemos la salud mental de los m\xc3\xa1s peque\xc3\xb1os con comunicaci\xc3\xb3n asertiva y positiva. En vez de reprochar porque se equivoc\xc3\xb3, puedes decirle: \xe2\x80\x9c\xc2\xa1Vamos! Lo volvemos a intentar y esta vez te ayudo\xe2\x80\x9d.'"
1491751315864793092,2022-02-10 12:30:03+00:00,"b'Exponer parte de nuestras vidas en redes sociales no necesariamente es algo superficial, sino que creas una conexi\xc3\xb3n con una comunidad\xe2\x80\xa6 \n\nAqu\xc3\xad te cuento un poco m\xc3\xa1s \xf0\x9f\x91\x87  https://t.co/Xps592RP54'"
1491578918322778118,2022-02-10 01:05:00+00:00,"b'El coraz\xc3\xb3n es mucho m\xc3\xa1s que un m\xc3\xbasculo que bombea sangre a todo el cuerpo. De hecho, \xc2\xbfsab\xc3\xadas que se puede morir por un coraz\xc3\xb3n roto? \n\nEscucha 5 curiosidades del coraz\xc3\xb3n \xe2\x9d\xa4\xef\xb8\x8f \xe2\x9d\xa4\xef\xb8\x8f  que quiz\xc3\xa1s no conoc\xc3\xadas en este podcast de #CalaAcademy https://t.co/eTMb6h6FXr'"
1491566350569029632,2022-02-10 00:15:04+00:00,"b'Muchas veces nosotros somos los t\xc3\xb3xicos y no nos damos cuenta, lo digo por experiencia. He tenido que revisar mi punto de vista para entender que el t\xc3\xb3xico no era el otro, sino que era yo.\n\n\xc2\xbfTe haces una evaluaci\xc3\xb3n para revisar si lo t\xc3\xb3xico viene de tu lado?\xf0\x9f\xa4\x94'"
1491405273881264129,2022-02-09 13:35:00+00:00,b'\xc2\xbfSab\xc3\xadas que la meditaci\xc3\xb3n puede evitar enfermedades?\n\n \xf0\x9f\x98\xb1 \xf0\x9f\x92\xaa  Aqu\xc3\xad te cuento todo \xf0\x9f\x91\x87 \xf0\x9f\x8d\x83  https://t.co/cHikLhVYec'
1491374318084833283,2022-02-09 11:32:00+00:00,b'No esperes al viernes para ser feliz. Todos los d\xc3\xadas son un buen motivo para comenzar a hacer aquello que realmente nos deja sonre\xc3\xadr y estar en paz con nuestro ser.'
1491177026706939904,2022-02-08 22:28:02+00:00,b'#Mindfulness es la t\xc3\xa9cnica de base que soluciona el problema n.\xc2\xba 1 de todas las personas \xf0\x9f\x8d\x83\xf0\x9f\xa7\x98\xe2\x80\x8d\xe2\x99\x82\xef\xb8\x8f https://t.co/QY68IZOZnn'
1491056751432589312,2022-02-08 14:30:06+00:00,"b'Recuerda que en esta vida todo es c\xc3\xadclico, todo pasa y tambi\xc3\xa9n se transforma \xe2\x9d\xa4\xef\xb8\x8f\xf0\x9f\x92\xab https://t.co/4bs3DodPJl'"
1491026542251675649,2022-02-08 12:30:04+00:00,"b'El miedo a lo desconocido y sentir que no disponemos del control sobre determinadas situaciones, es lo que nos aleja de querer salir de nuestra zona de confort.'"
1491003913721589762,2022-02-08 11:00:09+00:00,b'Equilibra tu cuerpo  \xf0\x9f\xa7\x98\xe2\x80\x8d\xe2\x99\x82\xef\xb8\x8f\xf0\x9f\x8d\x83\nDesintoxica tu mente \xf0\x9f\xa7\xa0\xf0\x9f\xa4\x95\nLibera tu alma \xf0\x9f\x92\xab\xe2\x9d\xa4\xef\xb8\x8f\n  https://t.co/AMlE02oq0h'
1490813877822631941,2022-02-07 22:25:01+00:00,"b'No te subestimes, porque no existen acciones peque\xc3\xb1as. Cada paso que das en tu d\xc3\xada a d\xc3\xada te acerca un poco m\xc3\xa1s a la meta. \xc2\xa1COMIENZA HOY! \xe2\x9d\xa4\xef\xb8\x8f'"
1490785642300723201,2022-02-07 20:32:49+00:00,b'\xc2\xbfQu\xc3\xa9 sabes t\xc3\xba acerca del IKIGAI? Conversemos en este hilo.'
1490785637888413696,2022-02-07 20:32:48+00:00,"b'De acuerdo con la cultura japonesa, todos deber\xc3\xadamos tener un #IKIGAI. Encontrarlo requiere una b\xc3\xbasqueda en uno mismo y es de vital importancia, ya que su descubrimiento te da una raz\xc3\xb3n concreta y especifica para levantarte todos los d\xc3\xadas. https://t.co/3l41EKU464'"
1490770592869625864,2022-02-07 19:33:01+00:00,b'Cometen el error de decirnos que la \xc3\xa9poca de estudiantes en la vida son los primeros a\xc3\xb1os; lo que nos deber\xc3\xadan ense\xc3\xb1ar es que el aprendizaje es continuo \xf0\x9f\x93\x96'
1490750515659128833,2022-02-07 18:13:14+00:00,"b'As\xc3\xad que por favor escucha hoy y siempre a tu coraz\xc3\xb3n \xe2\x9d\xa4\xef\xb8\x8f \n\nParece ser un m\xc3\xbasculo m\xc3\xa1s, pero es fascinante y esconde muchas curiosidades. https://t.co/xqYjJEkSq1'"
1490750510202249220,2022-02-07 18:13:13+00:00,"b'\xc2\xbfSab\xc3\xadas que es posible morir por un coraz\xc3\xb3n roto?\n\nViene provocado por un abrupto estr\xc3\xa9s hormonal a ra\xc3\xadz de un impacto emocional muy fuerte, puede tener s\xc3\xadntomas similares a los de un infarto pese a que el coraz\xc3\xb3n este sano, y la muerte si bien es extremadamente rara, es posible.'"
1490748950353219586,2022-02-07 18:07:01+00:00,b'Equilibra tu cuerpo  \xf0\x9f\xa7\x98\xe2\x80\x8d\xe2\x99\x82\xef\xb8\x8f\xf0\x9f\x8d\x83\nDesintoxica tu mente \xf0\x9f\xa7\xa0\xf0\x9f\xa4\x95\nLibera tu alma \xf0\x9f\x92\xab\xe2\x9d\xa4\xef\xb8\x8f\n  https://t.co/AMlE02oq0h'
1490659106553802759,2022-02-07 12:10:00+00:00,"b'\xc2\xbfQuieres mejorar tu vida, pero no sabes c\xc3\xb3mo mejorar ni qu\xc3\xa9 pasos seguir? \xf0\x9f\x91\x87 https://t.co/AMlE02oq0h'"
1490645266562752512,2022-02-07 11:15:01+00:00,b'Toma consciencia del desapego. El primer paso siempre es ACEPTAR que debemos y queremos desapegarnos de alguien o de algo \xe2\x9d\xa4\xef\xb8\x8f'
1490454759320567817,2022-02-06 22:38:00+00:00,b'Equilibra tu cuerpo  \xf0\x9f\xa7\x98\xe2\x80\x8d\xe2\x99\x82\xef\xb8\x8f\xf0\x9f\x8d\x83\nDesintoxica tu mente \xf0\x9f\xa7\xa0\xf0\x9f\xa4\x95\nLibera tu alma \xf0\x9f\x92\xab\xe2\x9d\xa4\xef\xb8\x8f\n  https://t.co/AMlE02oq0h'
1490386314231001097,2022-02-06 18:06:02+00:00,"b'Hay que ser perseverantes con los sue\xc3\xb1os, pero hay que ser flexibles con la ejecuci\xc3\xb3n de ese sue\xc3\xb1o.'"
1490325910628749312,2022-02-06 14:06:00+00:00,"b'\xc2\xa1Faltan pocos d\xc3\xadas para que arranque el retiro de CONCIENCIA DIVINA! Conoce todos los detalles de este evento presencial por 4 d\xc3\xadas en las monta\xc3\xb1as, haciendo clic aqu\xc3\xad \xf0\x9f\x91\x87  https://t.co/AMlE02oq0h'"
1490321130502213633,2022-02-06 13:47:00+00:00,"b'\xc2\xbfQuieres meditar \xf0\x9f\xa7\x98\xe2\x80\x8d\xe2\x99\x82\xef\xb8\x8f, pero no sabes por d\xc3\xb3nde empezar? \xf0\x9f\x98\x8c Este video es para ti \xf0\x9f\x91\x87  https://t.co/K6Luo6F7KU'"
1490103444237131776,2022-02-05 23:22:00+00:00,"b'\xc2\xa1No hay excusas! \xf0\x9f\x92\xaa Los peque\xc3\xb1os de la casa, tambi\xc3\xa9n pueden meditar \xf0\x9f\x98\x81\xf0\x9f\x99\x8c https://t.co/brxyiDbvyZ'"
1490092875341783041,2022-02-05 22:40:00+00:00,"b'La tecnolog\xc3\xada o las redes sociales son un plus en nuestras vidas, no es algo que nos resta. Ahora, todo depende del uso que nosotros le demos a esta ventana digital. \n\n\xc2\xbfCrees estarlas usando de forma positiva? \xf0\x9f\xa4\x94'"
1489982144986419204,2022-02-05 15:20:00+00:00,"b'\xc2\xa1Faltan pocos d\xc3\xadas para que arranque el retiro de CONCIENCIA DIVINA! Conoce todos los detalles de este evento presencial por 4 d\xc3\xadas en las monta\xc3\xb1as, haciendo clic aqu\xc3\xad \xf0\x9f\x91\x87  https://t.co/AMlE02oq0h'"
1489963524843622401,2022-02-05 14:06:01+00:00,b'\xc2\xbfPara ti qu\xc3\xa9 es el optimismo t\xc3\xb3xico? Te leo.'
1489754415095504900,2022-02-05 00:15:05+00:00,"b'""Decreto que algo maravilloso est\xc3\xa1 por sucederme"". Decretar lo que queremos que ocurra es el primer paso para que el universo nos escuche y comience a actuar a nuestro favor. \xf0\x9f\x99\x8c \xf0\x9f\x92\xab \n\n\xc2\xbfQu\xc3\xa9 decretas hoy para ti? \xf0\x9f\x91\x87'"
1489690351120093184,2022-02-04 20:00:31+00:00,"b'\xc2\xbfQuieres mejorar tu vida, pero no sabes c\xc3\xb3mo mejorar ni qu\xc3\xa9 pasos seguir? \xf0\x9f\x91\x87 https://t.co/AMlE02oq0h'"
1489654534083391494,2022-02-04 17:38:12+00:00,b'@pan_dulce_305 \xf0\x9f\x91\x8f'
1489654468375453700,2022-02-04 17:37:56+00:00,b'@irisita_d \xf0\x9f\x91\x8f\xf0\x9f\x91\x8f'
1489654199080132609,2022-02-04 17:36:52+00:00,b'@isidrocm \xf0\x9f\x91\x8f'
1489654158542180357,2022-02-04 17:36:42+00:00,b'@DaiserG excelente!!'
1489654110743900166,2022-02-04 17:36:31+00:00,b'@jesusbecerra82 \xf0\x9f\x91\x8f'
1489653883202850818,2022-02-04 17:35:36+00:00,b'@guarich \xf0\x9f\x91\x8f\xf0\x9f\x91\x8f'
1489653824084230146,2022-02-04 17:35:22+00:00,b'@garcia_jonhy \xf0\x9f\x91\x8f\xf0\x9f\x91\x8f'
1489620513081208844,2022-02-04 15:23:00+00:00,b'Equilibra tu cuerpo  \xf0\x9f\xa7\x98\xe2\x80\x8d\xe2\x99\x82\xef\xb8\x8f\xf0\x9f\x8d\x83\nDesintoxica tu mente \xf0\x9f\xa7\xa0\xf0\x9f\xa4\x95\nLibera tu alma \xf0\x9f\x92\xab\xe2\x9d\xa4\xef\xb8\x8f\n  https://t.co/AMlE02oq0h'
1489619083754713089,2022-02-04 15:17:20+00:00,"b'\xc2\xa1Hagamos un hilo de afirmaciones positivas!\n\nComienzo yo \xf0\x9f\xa4\x9a\xf0\x9f\x8f\xbc: Soy pr\xc3\xb3spero, tengo abundancia de todo lo bueno.\n\nAhora t\xc3\xba...\xf0\x9f\x91\x87\xf0\x9f\x8f\xbc'"
1489592578492313607,2022-02-04 13:32:00+00:00,"b'Cuando no hay un comparativo donde nos sentimos superiores a otros por simples t\xc3\xadtulos, all\xc3\xad es cuando se es realmente HUMILDE.'"
1489561886043557892,2022-02-04 11:30:03+00:00,"b'El miedo a lo desconocido y sentir que no disponemos del control sobre determinadas situaciones, es lo que nos aleja de querer salir de nuestra zona de confort.'"
1489396033205506051,2022-02-04 00:31:00+00:00,b'Cometen el error de decirnos que la \xc3\xa9poca de estudiantes en la vida son los primeros a\xc3\xb1os; lo que nos deber\xc3\xadan ense\xc3\xb1ar es que el aprendizaje es continuo \xf0\x9f\x93\x96'
1489333122596581383,2022-02-03 20:21:01+00:00,"b'Las quejas y los lamentos no llevan a nada, presta atenci\xc3\xb3n a tu consciencia. Eres el \xc3\xbanico responsable de cambiar lo que est\xc3\xa9 pasando, tienes el poder de elegir.'"
1489257372811890689,2022-02-03 15:20:01+00:00,"b'\xc2\xa1Faltan pocos d\xc3\xadas para que arranque el retiro de CONCIENCIA DIVINA! Conoce todos los detalles de este evento presencial por 4 d\xc3\xadas en las monta\xc3\xb1as, haciendo clic aqu\xc3\xad \xf0\x9f\x91\x87  https://t.co/AMlE026OBH'"
1489222277589831681,2022-02-03 13:00:34+00:00,"b'\xc2\xbfQuieres mejorar tu vida, pero no sabes c\xc3\xb3mo mejorar ni qu\xc3\xa9 pasos seguir? \xf0\x9f\x91\x87 https://t.co/AMlE02oq0h'"
1489210816184434694,2022-02-03 12:15:01+00:00,b'Toma consciencia del desapego. El primer paso siempre es ACEPTAR que debemos y queremos desapegarnos de alguien o de algo \xe2\x9d\xa4\xef\xb8\x8f'
1489030625512370180,2022-02-03 00:19:00+00:00,"b'Si est\xc3\xa1 en tu mente, puede estar en tu vida \xf0\x9f\x92\xab'"
1488996401266757633,2022-02-02 22:03:00+00:00,"b'\xc2\xbfQui\xc3\xa9nes necesitan invertir en mejorar sus habilidades de comunicaci\xc3\xb3n? \xf0\x9f\xa4\xa8  \n\nLos l\xc3\xadderes \xf0\x9f\x99\x8e\xe2\x80\x8d\xe2\x99\x82\xef\xb8\x8f \xf0\x9f\x99\x8d\xe2\x80\x8d\xe2\x99\x80\xef\xb8\x8f  La respuesta es simple, \xc2\xbfpor qu\xc3\xa9? Porque el liderazgo es influencia y la influencia se crea a trav\xc3\xa9s de la persuasi\xc3\xb3n y de la comunicaci\xc3\xb3n asertiva.'"
1488951613402357764,2022-02-02 19:05:02+00:00,"b'La verdadera grandeza del ser humano est\xc3\xa1 en que mientras m\xc3\xa1s alto y m\xc3\xa1s lejos llegues, lo hagas desde el pedestal de la HUMILDAD.'"
1488909076570456065,2022-02-02 16:16:01+00:00,"b'Cuidemos la salud mental de los m\xc3\xa1s peque\xc3\xb1os con comunicaci\xc3\xb3n asertiva y positiva. En vez de reprochar porque se equivoc\xc3\xb3, puedes decirle: \xe2\x80\x9c\xc2\xa1Vamos! Lo volvemos a intentar y esta vez te ayudo\xe2\x80\x9d.'"
1488882417142312971,2022-02-02 14:30:05+00:00,"b'Exponer parte de nuestras vidas en redes sociales no necesariamente es algo superficial, sino que creas una conexi\xc3\xb3n con una comunidad\xe2\x80\xa6 \n\nAqu\xc3\xad te cuento un poco m\xc3\xa1s \xf0\x9f\x91\x87  https://t.co/Xps592RP54'"
1488849684521230340,2022-02-02 12:20:00+00:00,"b'El coraz\xc3\xb3n es mucho m\xc3\xa1s que un m\xc3\xbasculo que bombea sangre a todo el cuerpo. De hecho, \xc2\xbfsab\xc3\xadas que se puede morir por un coraz\xc3\xb3n roto? \n\nEscucha 5 curiosidades del coraz\xc3\xb3n \xe2\x9d\xa4\xef\xb8\x8f \xe2\x9d\xa4\xef\xb8\x8f  que quiz\xc3\xa1s no conoc\xc3\xadas en este podcast de #CalaAcademy https://t.co/eTMb6h6FXr'"
1488640310792146946,2022-02-01 22:28:02+00:00,b'#Mindfulness es la t\xc3\xa9cnica de base que soluciona el problema n.\xc2\xba 1 de todas las personas \xf0\x9f\x8d\x83\xf0\x9f\xa7\x98\xe2\x80\x8d\xe2\x99\x82\xef\xb8\x8f https://t.co/CFHvWaaP8p'
1488573028254560260,2022-02-01 18:00:40+00:00,"b'Hay que ser perseverantes con los sue\xc3\xb1os, pero hay que ser flexibles con la ejecuci\xc3\xb3n de ese sue\xc3\xb1o.'"
1488548198213988352,2022-02-01 16:22:00+00:00,"b'\xc2\xbfQuieres mejorar tu vida, pero no sabes c\xc3\xb3mo mejorar ni qu\xc3\xa9 pasos seguir? \xf0\x9f\x91\x87 https://t.co/AMlE02oq0h'"
1488514474579570688,2022-02-01 14:08:00+00:00,"b'\xc2\xbfQuieres meditar \xf0\x9f\xa7\x98\xe2\x80\x8d\xe2\x99\x82\xef\xb8\x8f, pero no sabes por d\xc3\xb3nde empezar? \xf0\x9f\x98\x8c Este video es para ti \xf0\x9f\x91\x87  https://t.co/K6Luo6F7KU'"
1488482291089387525,2022-02-01 12:00:07+00:00,b'Equilibra tu cuerpo  \xf0\x9f\xa7\x98\xe2\x80\x8d\xe2\x99\x82\xef\xb8\x8f\xf0\x9f\x8d\x83\nDesintoxica tu mente \xf0\x9f\xa7\xa0\xf0\x9f\xa4\x95\nLibera tu alma \xf0\x9f\x92\xab\xe2\x9d\xa4\xef\xb8\x8f\n  https://t.co/AMlE02oq0h'
1488475970873053184,2022-02-01 11:35:00+00:00,b'\xc2\xbfSab\xc3\xadas que la meditaci\xc3\xb3n puede evitar enfermedades?\n\n \xf0\x9f\x98\xb1 \xf0\x9f\x92\xaa  Aqu\xc3\xad te cuento todo \xf0\x9f\x91\x87 \xf0\x9f\x8d\x83  https://t.co/cHikLhVYec'
1488282446093246466,2022-01-31 22:46:00+00:00,"b'\xc2\xbfA qu\xc3\xa9 me refiero con liderazgo hol\xc3\xadstico? \xf0\x9f\xa4\xa8 \n\nA la capacidad de observar el ser en 360, poder contemplar el ser desde el \xc3\xa9xito, desde la plenitud. El #liderazgohol\xc3\xadstico es tambi\xc3\xa9n la habilidad de tener influencia positiva en otros teniendo en cuenta la inteligencia emocional.'"
1488225678780776454,2022-01-31 19:00:26+00:00,"b'Si est\xc3\xa1s viviendo con miedo \xf0\x9f\xa4\x90 , est\xc3\xa1s viviendo a medias. Porque el miedo es ausencia de amor y eso es no vivir con libertad.'"
1488181800967061510,2022-01-31 16:06:05+00:00,"b'Muchas personas creen que el comunicar es hablar y olvidan que el comunicar tiene un porcentaje casi m\xc3\xa1s importante que el de hablar, en el escuchar. https://t.co/PVcBdKFaKa'"
1488178852593647629,2022-01-31 15:54:22+00:00,b'\xc2\xbfC\xc3\xb3mo puedes mejorar tu capacidad para tomar mejores decisiones? \xf0\x9f\xa7\x90'
1488159030719696901,2022-01-31 14:35:36+00:00,b'@ereuguarita \xf0\x9f\x99\x8f\xf0\x9f\x8f\xbc\xf0\x9f\x99\x8f\xf0\x9f\x8f\xbc'
1488151333794422791,2022-01-31 14:05:01+00:00,"b'Todos los seremos humanos tenemos puntos ciegos y no nos damos cuenta de patrones que repetimos pensando que estamos bien, cuando en realidad es lo contrario.'"
1488112330399531009,2022-01-31 11:30:02+00:00,b'Equilibra tu cuerpo  \xf0\x9f\xa7\x98\xe2\x80\x8d\xe2\x99\x82\xef\xb8\x8f\xf0\x9f\x8d\x83\nDesintoxica tu mente \xf0\x9f\xa7\xa0\xf0\x9f\xa4\x95\nLibera tu alma \xf0\x9f\x92\xab\xe2\x9d\xa4\xef\xb8\x8f\n  https://t.co/AMlE02oq0h'
1487914269257744386,2022-01-30 22:23:00+00:00,"b'Muchas veces nosotros somos los t\xc3\xb3xicos y no nos damos cuenta, lo digo por experiencia. He tenido que revisar mi punto de vista para entender que el t\xc3\xb3xico no era el otro, sino que era yo.\n\n\xc2\xbfTe haces una evaluaci\xc3\xb3n para revisar si lo t\xc3\xb3xico viene de tu lado?\xf0\x9f\xa4\x94'"
1487822413706444806,2022-01-30 16:18:00+00:00,"b'El aprender a disfrutar nuestra soledad es casarnos con nosotros mismos, pero no te cases por obligaci\xc3\xb3n. C\xc3\xa1sate contigo porque has escogido desde el amor dedicar tiempo a amarte, valorarte y honrarte en silencio.'"
1487784665608040452,2022-01-30 13:48:00+00:00,"b'Un mal d\xc3\xada, no borra tu progreso.'"
1487763022978457605,2022-01-30 12:22:00+00:00,"b'\xc2\xbfQuieres mejorar tu vida, pero no sabes c\xc3\xb3mo mejorar ni qu\xc3\xa9 pasos seguir? \xf0\x9f\x91\x87 https://t.co/AMlE02oq0h'"
1487727306990833667,2022-01-30 10:00:05+00:00,"b'El ego tratar\xc3\xa1 de conseguir lo que es mejor para ti y defender tu identidad. Por ello debemos trabajar nuestro ser desde el alma y la racionalidad. \xe2\x9c\x8d\xef\xb8\x8f\n\nY reconocer que tenemos integridad en el coraz\xc3\xb3n y no necesitamos defendernos de las cr\xc3\xadticas, quejas o comentarios negativos \xe2\x9d\xa4\xef\xb8\x8f https://t.co/YIsm4mRIVl'"
1487609009779662851,2022-01-30 02:10:01+00:00,b'\xc2\xbfC\xc3\xb3mo podemos evitar compararnos con los dem\xc3\xa1s? Valor\xc3\xa1ndonos y reconociendo lo que somos. Haz clic en este video para conocer el m\xc3\xa9todo \xf0\x9f\x91\x87 https://t.co/9YTzfYzy3l'
1487605233589096450,2022-01-30 01:55:00+00:00,"b'El fracaso no existe, solo son eventos que no salen como uno los sue\xc3\xb1a.'"
