twitter_id,date,tweet
1546374579387793408,2022-07-11 06:03:24+00:00,b'Begitu dalam perasaan ini kalau sudah menyangkut timnas https://t.co/W5NCtic50l'
1545802246180720640,2022-07-09 16:09:09+00:00,b'Ada yg tahu gak? Kenapa orang2 dulu saat difoto cenderung tdk menatap kamera? https://t.co/ZpSeklDiAl'
1545747429823516679,2022-07-09 12:31:20+00:00,b'Temuan unik dari lembaga @Evello12 tentang aksi #citayamfashionweek https://t.co/pnGqFrEQ2w'
1545747092270100481,2022-07-09 12:30:00+00:00,"b'Fix ya, spiderman itu aslinya orang Indonesia.  https://t.co/nYAbVn2UqU'"
1545623467021991936,2022-07-09 04:18:45+00:00,b'Siapa nama pahlawan ini? https://t.co/amNNIBzV0M'
1545428931121401856,2022-07-08 15:25:44+00:00,b'Menurut kamu?\n\nRT : Dukung\nLikes : Tidak Dukung https://t.co/QjBOQ98UdT'
1543223997688696833,2022-07-02 13:24:07+00:00,b'RT @INDONESIAinLOVE: Mencoba menikmati suasana Yogyakarta sambil menikmati suasana car free night di Malioboro \n\nIjin melintas https://t.co\xe2\x80\xa6'
1543223948313128964,2022-07-02 13:23:55+00:00,b'RT @INDONESIAinLOVE: Wedang Ronde di Pasar Klitikan 1 Mangkok cukup untuk menambah hangat tubuh untuk lanjukan jalan-jalan.\n\n#Yogyakarta\n#M\xe2\x80\xa6'
1543075832163627008,2022-07-02 03:35:22+00:00,b'Buat pengemudi mobil putih. Kamu keren banget.. sumpah.  https://t.co/iOsRH0tke8'
1542888295561998336,2022-07-01 15:10:09+00:00,b'Wedang Ronde di Pasar Klitikan 1 Mangkok cukup untuk menambah hangat tubuh untuk lanjukan jalan-jalan.\n\n#Yogyakarta\n#Malioboro https://t.co/1v6RDWiD7x'
1542860347710664704,2022-07-01 13:19:06+00:00,b'Mencoba menikmati suasana Yogyakarta sambil menikmati suasana car free night di Malioboro \n\nIjin melintas https://t.co/YRxaU2TTr2'
1542730096783798272,2022-07-01 04:41:32+00:00,b'Saling mendoakan ya \xf0\x9f\xa4\xb2 https://t.co/AJ6sSAi7o9'
1542674858361778176,2022-07-01 01:02:02+00:00,b'Doaku: Semoga suatu saat bisa ke Dieng. https://t.co/rXVo2t8O8l'
1542671556874076161,2022-07-01 00:48:55+00:00,b'Lagian cincin kok pindah lokasi? https://t.co/nhoLouwmAi'
1542482657636134914,2022-06-30 12:18:18+00:00,b'Tebing Breksi https://t.co/YwsreOfbOg'
1542482139765424128,2022-06-30 12:16:14+00:00,b'Malam lovers bila anda sedang berkunjung ke Yogyakarta jangan lupa mampir ke Bukit Breksi Sleman \n\nKita bisa saksikan kota Yogyakarta di waktu malam \n\nDi sekitar ada juga Candi Ijo dan  Watu Papat\n\n#yogyakarta \n#tebingbreksi \n#tembakdisini \n#indonesiainlove https://t.co/wuz9PvrpFS'
1542347208770539522,2022-06-30 03:20:04+00:00,b'Jika ada kabar yang membuat sedih hari ini. Inilah beritanya.\n\n\xf0\x9f\x98\xaa\xf0\x9f\x98\xb3 https://t.co/jAP90Y6z7Z'
1540929710133506050,2022-06-26 05:27:26+00:00,b'Suasana tol Jagorawi tahun 1978. Belum ada kemacetan dan antrian panjang. https://t.co/EeopYu2usO'
1540637415551148032,2022-06-25 10:05:58+00:00,b'Cerdas !!!\n\n https://t.co/QHduuKUfsq'
1540583098936483840,2022-06-25 06:30:08+00:00,"b'Menurut ilmuwan, ada empat spesies alien hidup di galaksi Bima Sakti. \n\nKamu percaya? https://t.co/vfwlt9kxoz'"
1540247040864571392,2022-06-24 08:14:45+00:00,b'Roti gosong tak pernah menyakitimu.. kata-kata kasar dari seorang suami karena istri membuat roti gosong yang menyakiti hatinya. \n\nSiap-siap weekend romantis https://t.co/AtYZLZF0tp'
1539781098376695808,2022-06-23 01:23:16+00:00,b'Pertanyaannya apa \xf0\x9f\x98\xa4 https://t.co/gWh53jXoEC'
1539780863814438912,2022-06-23 01:22:20+00:00,"b'Baru sadar, mengapa Ibu saya punya kebiasaan ini. https://t.co/ghbrQrVt6V'"
1539413970771378177,2022-06-22 01:04:26+00:00,b'Pilih sarapan pagi yang mana? https://t.co/mrw3QyrrIM'
1538761274473185281,2022-06-20 05:50:51+00:00,b'Selamat hari ayah. Tak lengkap jika tidak nonton video ini lagi. https://t.co/44IaP9GTMM'
1538705642403557376,2022-06-20 02:09:47+00:00,b'Selamat pagi Indonesia \xf0\x9f\x87\xae\xf0\x9f\x87\xa9 https://t.co/QvBMpBI72V'
1538091921918545921,2022-06-18 09:31:05+00:00,b'Temanggung selalu lekat di hati. https://t.co/s7WLP84wcw'
1537450306203955200,2022-06-16 15:01:32+00:00,b'Apa yg aneh dengan foto ini ya? https://t.co/Egx2BjdnHG'
1537341872968208384,2022-06-16 07:50:39+00:00,b'Harimu berat? Coba renungkan ini. https://t.co/PxawRLxy8U'
1537252908806197248,2022-06-16 01:57:08+00:00,b'Dari Jogjakarta yang penuh cinta.\n\nSelamat pagi Indonesia !! https://t.co/6trXl6nU6q'
1536819931337363456,2022-06-14 21:16:39+00:00,b'Selamat datang Piala Asia. \n\n#AyoTimnas #AyoIndonesia kita bisa https://t.co/mixeiQ8BoE'
1536593455660793859,2022-06-14 06:16:43+00:00,b'@hantu_timelines Woww kamu keren...'
1536593134544896000,2022-06-14 06:15:26+00:00,"b'Namanya bus ALS - Antar Lintas Sumatera. Kalau naik dari Aceh ke Lampung, ada istilah naik tidak kenal, turun jadi saudara. https://t.co/1OK7QlBaw5'"
1536341275355787264,2022-06-13 13:34:38+00:00,b'Pernah ngalamin? https://t.co/qYN8pX2MjL'
1535576882292224000,2022-06-11 10:57:13+00:00,b'@jhun_ho Kakak kan gak nanya nama2 ikan? \xf0\x9f\x98\xb3'
1535546840677986305,2022-06-11 08:57:50+00:00,b'@jhun_ho Iya ternyata bener...'
1535519547330940928,2022-06-11 07:09:23+00:00,b'@jhun_ho Oh ya?'
1535514438123417601,2022-06-11 06:49:05+00:00,b'Udara kok gerah banget. Kamu bagaimana? https://t.co/5Y57InZvse'
1535508461663924224,2022-06-11 06:25:20+00:00,"b'Setiap lihat sate, terbayang sate 100 tusuk dan bang bokir https://t.co/VH00suHaqG'"
1535507945408016384,2022-06-11 06:23:17+00:00,b'Bang Bokir.... https://t.co/JdK13ZB4MO'
1535075721411821569,2022-06-10 01:45:46+00:00,"b'Menurut penelitian, punya empang alias kolam ikan adalah impian banyak orang Indonesia saat menjalani hari tua atau pensiun. \n\nKamu setuju? https://t.co/OThp6xvZEE'"
1535061627611279360,2022-06-10 00:49:46+00:00,b'Siapakah dia? https://t.co/2VGbCoCXPa'
1534699510966124544,2022-06-09 00:50:51+00:00,b'https://t.co/0NHRUJvL1M Semalam tidur nyenyak banget ya!! #TimnasDay'
1534471201963507713,2022-06-08 09:43:38+00:00,b'Orang Indonesia itu kreatif. Selalu melawan arus dan norma umum. \n\n#MaafKalauSalah https://t.co/594chIU7k4'
1533971917853499392,2022-06-07 00:39:39+00:00,b'Rejeki itu tak pernah tertukar. \n\nSelamat pagi Indonesia !! https://t.co/fKEHHiSNH7'
1533816526788505602,2022-06-06 14:22:11+00:00,b'Emang lambangnya apa? Penasaran... https://t.co/trZaGmzH6M'
1533329036608360448,2022-06-05 06:05:04+00:00,b'Selamat datang kembali adik-adik manis!! https://t.co/KYT2AwkWRc'
1532956170973237249,2022-06-04 05:23:26+00:00,b'Kalau gue asli takut hepatitis akut. https://t.co/ihE0jvCQxC'
1532385756739960832,2022-06-02 15:36:49+00:00,b'Selamat jalan Ril... https://t.co/qb2pJQfADr'
1532034116698652672,2022-06-01 16:19:31+00:00,b'Selamat beristirahat Indonesia !! https://t.co/bdWyfr8Glg'
1531954742003306496,2022-06-01 11:04:07+00:00,"b'Saat istri tiap hari masak mie instan, kamu ngapain?\n\nMakan aja \xe2\x9d\x8c\nCerai dong \xe2\x9c\x85 https://t.co/XvzBeb2WUq'"
1531587818438656001,2022-05-31 10:46:06+00:00,b'Kita butuh lebih banyak lagi yang seperti ini. https://t.co/UhA8iHVq1I'
1530663911879766016,2022-05-28 21:34:49+00:00,b'Real Champions... Real Madrid.\n\nCongrats \xf0\x9f\x8e\x89 https://t.co/7O7OnJO4w0'
1529679137040125953,2022-05-26 04:21:40+00:00,b'Obrolan pagi menunggu datangnya tukang sayur. \n\nCredit: imran musa https://t.co/bExdATgTqo'
1529356273732681729,2022-05-25 06:58:44+00:00,b'Bener... BKT.'
1529262127462363136,2022-05-25 00:44:38+00:00,"b'Ayo tebak, dimana lokasinya? \xf0\x9f\xa4\x94 https://t.co/1hb9YfO4I5'"
1528020774652903425,2022-05-21 14:31:56+00:00,b'RT @DudyRudianto: Selamat jalan Pak Yuri. Banyak kenangan saat pandemi Covid19 lalu. \n\nAl Fatehah https://t.co/lh1wg2CSKq'
1527855780405596161,2022-05-21 03:36:18+00:00,b'Adem luar dalam\n\nDimana ini? https://t.co/PYvsm5HJNm'
1526427608350859264,2022-05-17 05:01:16+00:00,"b'Rakyat suka mengeluh pejabatnya korup, padahal budaya mengambil hak orang lain juga menjadi hal biasa di jalanan. \n\n#MawasDiri https://t.co/tmbPrFSo5P'"
1526049558983110657,2022-05-16 03:59:02+00:00,b'Pada suatu pagi... https://t.co/sShMWLGH7r'
1525680225874370560,2022-05-15 03:31:26+00:00,b'Maaf lahir batin mas bro.... https://t.co/ggHSActuVY'
1525679422589661184,2022-05-15 03:28:14+00:00,"b'Di Jawa, gotong royong membuat dodol kerap dilakukan jika ada warga sedang hajatan. \n\nButuh tenaga super kuat untuk bisa ngaduk-ngaduk wajan raksasa berjam-jam. https://t.co/BFxWb9qdJC'"
1525679034687860736,2022-05-15 03:26:42+00:00,b'RT @Evello12: Analisis Reaksi Publik Unggahan Meme Ruhut Sitompul\n\nSebuah utas (1/6) https://t.co/pn5JdrN8VE'
1525025756484861952,2022-05-13 08:10:48+00:00,"b'Setelah nonton Timnas Sepakbola Indonesia di Sea Games 2021, bisa lanjut nonton perjuangan Ginting dkk di #ThomasCup2022 di semifinal melawan Jepang https://t.co/Y9sR4usr53'"
1525024993658085376,2022-05-13 08:07:46+00:00,"b'Skuad timnas Indonesia melawan Filipina sore ini. Ayo Garuda, kalian bisaaaa \xf0\x9f\x94\xa5 #SEAGames2021 #SEAGames31 https://t.co/ADA4uBmgfl'"
1524317319161577472,2022-05-11 09:15:43+00:00,"b'Salah satu dampak penjajahan adalah meninggalkan jejak. Salah satunya ya bahasa,  dimana bahasa Indonesia dan Malaysia sama memakai serapan dari negara penjajahnya. https://t.co/jBfraoh5ix'"
1524074831008104448,2022-05-10 17:12:10+00:00,b'RT @Evello12: Mudik Lebaran 2022 Bersentimen Positif dan Dominan Bahagia\n\nSebuah utas (1/9) https://t.co/0tZDLXTrTz'
1524005144559755265,2022-05-10 12:35:15+00:00,b'RT @bengkeldodo: Tahukan Kamu : \n\nHari ini 93th lalu (10/05/29) dikenal sebagai lahirnya Cergam TINTIN karya Georges Remi (Herge).\n\nDan dia\xe2\x80\xa6'
1522538230192959490,2022-05-06 11:26:16+00:00,"b'Cabor sepak bola putra akan memulai petualangan mereka di #SEAGames2021 sore ini melawan tuan rumah, Vietnam\n\nAyo Garuda, kalian bisa https://t.co/gTFTZ0QDEo'"
1522500095748747264,2022-05-06 08:54:44+00:00,"b'Kalau krn seragam dan emblem2 perilaku jadi pongah, apa tujuan kalian di didik oleh negara menggunakan uang rakyat. https://t.co/nxEFNpHT5G'"
1522499597134069760,2022-05-06 08:52:45+00:00,b'Masa TNI seperti ini kelakuannya? @Puspen_TNI @tni_ad https://t.co/nxEFNpHT5G'
1522196595508658177,2022-05-05 12:48:44+00:00,"b'Tak selamanya Sinabung menyisakan duka. \n\nLokasi: Desa Gung Pinto, Tanah Karo, Sumatera Utara \xf0\x9f\x87\xb2\xf0\x9f\x87\xa8\n\xf0\x9f\x93\xb8By: dicky ochtiver https://t.co/z7zWQCtjS1'"
1522046012562735106,2022-05-05 02:50:22+00:00,b'Pak Tarno memang war biasah...!! https://t.co/DHBUoNsA2H'
1521528238769868801,2022-05-03 16:32:55+00:00,b'RT @DudyRudianto: Dari #TrendingFacebook Evello. Selamat Jalan Mieke Wijaya.\xf0\x9f\x99\x8f\xf0\x9f\x8f\xbb\n\n#RIPMiekeWijaya https://t.co/Vizgknf08F'
1520961721024020481,2022-05-02 03:01:47+00:00,b'Silahkan dinikmati suguhannya. \n\nSelamat Idul Fitri 1443 H https://t.co/HrxcurnKYl'
1520961477964107776,2022-05-02 03:00:49+00:00,b'RT @Evello12: Adakah Dampak Pejabat Publik Minta Maaf Saat Pelaksanaan Mudik Lebaran 2022?\n\nSebuah utas https://t.co/k8V9ActSv2'
1520347068350738433,2022-04-30 10:19:22+00:00,b'Petarung sejati\n\n\xf0\x9f\x93\xb8 Risyal Hidayat (Antara) https://t.co/PBzB6ptQxt'
1519945683499098112,2022-04-29 07:44:24+00:00,b'Kejahatan terhadap lingkungan harus dihukum berat.\n\n#PrayForBima https://t.co/E9L6hooUik'
1519903350074281984,2022-04-29 04:56:11+00:00,b'Lihat orang India seperti bercermin \xf0\x9f\x87\xae\xf0\x9f\x87\xa9 https://t.co/OIFhsuguAS'
1519902861970538496,2022-04-29 04:54:15+00:00,b'Korban Google Maps saat mudik \xf0\x9f\x98\xb3 https://t.co/2oe3el6WFZ'
1519555590787575809,2022-04-28 05:54:19+00:00,b'Apakah kamu salah satu diantara mereka? https://t.co/5F3CFAyWX6'
1518280814941044737,2022-04-24 17:28:49+00:00,b'Breaking news!! Pasar Gembrong https://t.co/U6j01XEvmu'
1518187446390779904,2022-04-24 11:17:48+00:00,b'Selamat berbuka...! https://t.co/6SuHAuQFis'
1517721795528654850,2022-04-23 04:27:28+00:00,b'Tanaman pakis raksasa di belantara hutan Prov Bengkulu. \n\nKalau dibuat sayur pakis bisa utk makan se-RT https://t.co/rGgLRBQAJ5'
1517255027345166336,2022-04-21 21:32:42+00:00,b'Selamat Idulfitri !! https://t.co/WBOlkNBwX0'
1516930591455088640,2022-04-21 00:03:30+00:00,b'RT @WidiAni55984705: Slamat Hari Kartini Bagi Kaum Wanita Nusantara Dimanapun Kita Berada\xf0\x9f\x8c\xba\xf0\x9f\x8c\xbc\n\nSemangat Pagi Utk Berkarya Disepanjang Hari In\xe2\x80\xa6'
1516930345027108865,2022-04-21 00:02:32+00:00,b'Ibu kita: Kartini!\nSetelah terang teruslah cemerlang wanita Indonesia... https://t.co/IiysQYrwa6'
1516728142937092099,2022-04-20 10:39:03+00:00,b'Buka pakai apa bray?\n\nKolak pisang \xe2\x9d\x8c\nBara api \xe2\x9c\x85 https://t.co/ExQFEzck9P'
1516584180897165312,2022-04-20 01:07:00+00:00,"b'Bedakah, kampung admin nie.. https://t.co/GPTyo1an2e'"
1516583792550776837,2022-04-20 01:05:27+00:00,b'RT @ArisWila: Kabupaten Sabu Raijua adalah salah satu destinasi wisata alam dan budaya terbaik di Provinsi NTT. Indonesia memang kaya dg pa\xe2\x80\xa6'
1516583464975634435,2022-04-20 01:04:09+00:00,b'Wajah Indonesia keren pastinya https://t.co/PlfHSFsY9y'
1516547039773208576,2022-04-19 22:39:25+00:00,b'Di negara yang katanya berdemokrasi... https://t.co/550ezSbmMK'
1516466964956606466,2022-04-19 17:21:13+00:00,b'Skill tingkat dewa https://t.co/Clsi1prqYF'
1516283065072775179,2022-04-19 05:10:28+00:00,b'Mau tanya... @kementan kemana ya? Apa masih ada? https://t.co/vVW7CBzADA'
1515928369061277696,2022-04-18 05:41:02+00:00,b'Sepakat? https://t.co/TZr3XY4XYS'
1515735245924204552,2022-04-17 16:53:38+00:00,"b'RT @nengutets: Gais, aku barusan dari JCM. Mobil depan aku platnya nggak keliatan, terus ternyata karcisnya ilang. Eh, dilalah dia nyolot s\xe2\x80\xa6'"
1515720345625321479,2022-04-17 15:54:25+00:00,b'Hukum Karma pasti berlaku ferguso. \n\nRT keras!! https://t.co/pwYSTAVbxE'
1513889214517379078,2022-04-12 14:38:10+00:00,b'Jazzy Night - cuppp ucuppp. https://t.co/P6ysxAu8DK'
1513362874345095172,2022-04-11 03:46:40+00:00,b'Saat suasana sedang ramai dan ricuh. https://t.co/gYnMAeZwb7'
1513257240706568193,2022-04-10 20:46:55+00:00,b'Jangan bermain dengan emak2... https://t.co/S2gzjlMzoc'
1513172626797371392,2022-04-10 15:10:42+00:00,b'Kekayaan Indonesia  https://t.co/fm5BCWTcrX'
1513141098121682948,2022-04-10 13:05:25+00:00,b'Sudah pernah juara sekali di AFF Futsal Championship. Tapi ada instansi pemerintah yang bilang kalau tim ini gak berprestasi dan tidak masuk cabor yg diikutkan ke Sea Games 2021. Hmmm \xf0\x9f\xa4\x94 https://t.co/O3Vzczs0Ws'
1513138835114573824,2022-04-10 12:56:25+00:00,"b'Timnas Futsal Indonesia harus mengakui keunggulan Thailand setelah kalah adu penalti dlm babak final AFF Futsal Championship 2022.\n\nTimnas kalah adu penalti 5-3 dr Thailand setelah bermain imbang 2-2 di waktu normal. \n\nJangan menyerah Garuda, tetap semangat \xf0\x9f\x94\xa5\xf0\x9f\x94\xa5\xf0\x9f\x94\xa5 https://t.co/dlSWGrthez'"
1512848220703326209,2022-04-09 17:41:37+00:00,b'Wwowwww sungguh pemberani si mbak... https://t.co/MnMkXs2EGz'
1512192269092528128,2022-04-07 22:15:06+00:00,b'Pasien bandel\xe2\x80\xa6\n\nhttps://t.co/sZk0PRHgxh'
1511651911111700480,2022-04-06 10:27:55+00:00,b'Oh ternyata kamu orangnya? https://t.co/Cbf1EaIPVb'
1511547983015587840,2022-04-06 03:34:57+00:00,b'Hebatnya seorang yg menyebut dirinya bolot. https://t.co/vPUpdYgOvo'
1511377498533097476,2022-04-05 16:17:30+00:00,b'Dan mimin memilih........ https://t.co/el9EffQK8Y'
1510963592199565318,2022-04-04 12:52:47+00:00,b'Definisi pemberani tongkat dewa https://t.co/bX76EkTDRF'
1510734774197157889,2022-04-03 21:43:32+00:00,b'Entah kenapa setiap kupanggil namanya utk sahur banyak yg marah2 https://t.co/Pc07A8h57X'
1510591309329080325,2022-04-03 12:13:28+00:00,b'Lirikanmu membuatku jatuh hati. https://t.co/BaRUISAfSz'
1510587627174793224,2022-04-03 11:58:50+00:00,b'Orang paling pemberani dan baik hati sedunia. https://t.co/2NwdmKpurr'
1510479751944994828,2022-04-03 04:50:10+00:00,b'Apa yg ada di benak pelapor ya? https://t.co/01rQnnWXga'
1510154387309883394,2022-04-02 07:17:17+00:00,b'Siapa tahu ada yang berminat? https://t.co/aTF47RBoq0'
1509719705296445440,2022-04-01 02:30:01+00:00,b'Apa namanya ya? https://t.co/deyeXf76W0'
1508992223597449217,2022-03-30 02:19:16+00:00,"b'Soal buah, kita sekali lagi tertinggal oleh Thailand  https://t.co/7Am98WNTzq'"
1508654918051467268,2022-03-29 03:58:56+00:00,"b'RT @DudyRudianto: Ditonton hingga 303 juta kali di jaringan Tiktok, tempelengan Will Smith Pada Chris Rock bersentimen positif. Bahkan emos\xe2\x80\xa6'"
1508628418685898757,2022-03-29 02:13:38+00:00,"b'""At your highest moment, be careful, that\'s when the devil comes for you."" \n\nWill Smith https://t.co/PYFERUo9my'"
1508484531745361921,2022-03-28 16:41:53+00:00,b'Pria seperti ini baiknya lempar ke kolam buaya. https://t.co/VXabT7N9dQ'
1508099869709201408,2022-03-27 15:13:22+00:00,b'Kira2 apa yang diobrolin ya? https://t.co/a1aDzcrvtF'
1508074414717702153,2022-03-27 13:32:13+00:00,b'Foto para juara #SwissOpen2022 \n\nCongrats Fajar/Rian dan Jojo. Terus semangat. https://t.co/fz4QNUoVJu'
1508066706018947076,2022-03-27 13:01:35+00:00,"b'Kemenangan kedua dari ganda putra, Fajar/Rian berhasil kalahkan ganda Malaysia 2 set langsung.\n\nCongrats Fajar/Rian, we proud of you guys !!! #SwissOpen2022 https://t.co/WomMvKPMAN'"
1508051794567774211,2022-03-27 12:02:20+00:00,b'Jonatan Christie/ Jojo juara tunggal putra Swiss Open. Dua set langsung \xf0\x9f\x94\xa5\xf0\x9f\x94\xa5\xf0\x9f\x94\xa5\n\nThanks Jojo sudah bawa harum nama Indonesia di kancah olahraga internasional #SwissOpen2022 https://t.co/qZzXxRIuOV'
1507890636007284736,2022-03-27 01:21:57+00:00,b'Dea ini siapa ya? Kok mimin gak tahu? https://t.co/2qNKvX2nrv'
1507878189259161601,2022-03-27 00:32:29+00:00,b'Dari bocil untuk bocil. \n\n https://t.co/UtM5hbf1Mu'
1507710903063838720,2022-03-26 13:27:45+00:00,b'Yuk dukung #EarthHour2022 https://t.co/ASoTgT03gK'
1507574565110960129,2022-03-26 04:26:00+00:00,b'Kamu kubu mana? Enak kotak atau buncit? https://t.co/fmzb3pZI5R'
1507479481211973638,2022-03-25 22:08:10+00:00,b'Kamu... membuatku jadi ingin nasi pecel pagi ini.. https://t.co/vAQlkTq6GN'
1506677172739907584,2022-03-23 17:00:05+00:00,"b'Karena mimin lapar, keluar dulu ke angkringan. Di daerahmu ada angkringan ngga? Share fotonya coba kalo ada... https://t.co/G2712zJnqN'"
1506522478193287169,2022-03-23 06:45:23+00:00,"b'Fakta menarik dr twitter Indonesia: Masyarakat menggunakan Twitter untuk ruang berekspresi - dengan 2,7 juta emoji digunakan selama Ramadan pada tahun 2021.\n\nEmoji \xf0\x9f\x99\x8f mengambil alih emoji \xf0\x9f\x98\xad sebagai emoji teratas yang digunakan selama Ramadan tahun lalu. https://t.co/8ms4PuXPnl'"
1506185904955613185,2022-03-22 08:27:57+00:00,b'Kamu melihatnya eksotik. Mereka melihatnya demi sesuap nasi. https://t.co/llS2jcKqCl'
1506180065339785217,2022-03-22 08:04:45+00:00,b'RT @azissubekti: Masih ingat rumus fisika F(gaya): P(tekanan)xA(luas bidang tekan)?\nGaya yang berlebihan diakibatkan tekanan yang besar. Ma\xe2\x80\xa6'
1505938338699972608,2022-03-21 16:04:13+00:00,"b'Udara panas sekali malam ini, apa hujannya menjauj ya? https://t.co/PQ5KAhe2rH'"
1505567542324363265,2022-03-20 15:30:48+00:00,b'\xf0\x9f\x87\xae\xf0\x9f\x87\xa9 : Pawang Hujan\n\xf0\x9f\x8f\xb4\xf3\xa0\x81\xa7\xf3\xa0\x81\xa2\xf3\xa0\x81\xa5\xf3\xa0\x81\xae\xf3\xa0\x81\xa7\xf3\xa0\x81\xbf: Clouds Engineering https://t.co/UleQxTQC2H'
1505478156832043012,2022-03-20 09:35:37+00:00,b'RT @Evello12: Perbincangan soal big data lagi hype ya minggu ini. \n\nJangan lewatkan obrolan @Beritabaruco &amp; Evello tentang Big Data dan Opi\xe2\x80\xa6'
1505478100833865728,2022-03-20 09:35:24+00:00,b'Beda harga Boss!! https://t.co/o2wMVCTdrc'
1505101539081220098,2022-03-19 08:39:05+00:00,"b'\xf0\x9f\x91\xa6\xf0\x9f\x8f\xbb Mah, pelan2... sakit\n\xf0\x9f\x91\xa9\xf0\x9f\x8f\xbb Mas, biar merah dan anginnya keluar semua... !! https://t.co/asFHGr6CFJ'"
1504992952292372480,2022-03-19 01:27:35+00:00,"b'Coba tebak, siapa bintang iklan rokok ini? https://t.co/FW80jT84YB'"
1504775703522590724,2022-03-18 11:04:19+00:00,b'Operasi pasar gelap. \n\nHati-hati!! https://t.co/fLe9T8e0QU'
1504719804137357315,2022-03-18 07:22:12+00:00,"b'Di Merauke Papua, parang tajam berguna utk cukur jenggot. \xf0\x9f\x98\x82\xf0\x9f\x98\x82 https://t.co/lic80gtj5i'"
1504486319816585216,2022-03-17 15:54:25+00:00,b'Kurindu purnama lalu \nBerpayung kabut asmara \nHingga kini masih kurasakan \nMeski kini kau telah sirna\xe2\x80\xa6 https://t.co/W17M1eRd17'
1504419652813828097,2022-03-17 11:29:30+00:00,"b'Tetap senyum, baik dan bersahabat walau akan menghadapi ujian beratmu.  https://t.co/eq9JQTwjJO'"
1504343186260787200,2022-03-17 06:25:39+00:00,b'Terima kasih @PSSI selalu memberikan hiburan terbaik buat rakyat Indonesia. https://t.co/B2RERKHbu6'
1503539156236247043,2022-03-15 01:10:43+00:00,b'Pesan Komeng: Jangan biarkan hidup mengalir seperti air. https://t.co/HExZTWXcOW'
1503185888364593152,2022-03-14 01:46:58+00:00,b'I Love Monday \xf0\x9f\x92\x95 https://t.co/zEbNxSs40s'
1502825859279106048,2022-03-13 01:56:20+00:00,b'Duh Bang @iwanfals akhirnya angkat suara.  https://t.co/ATwIUkJsfc'
1502467266239410177,2022-03-12 02:11:25+00:00,b'Selamat pagi Indonesia \xf0\x9f\x87\xae\xf0\x9f\x87\xa9 \n\nSudah mandi? https://t.co/rollKduws1'
1502221217021186053,2022-03-11 09:53:42+00:00,b'Yuk bikin sendiri minyak goreng pakai VCO. Yuk bisa. https://t.co/RaWI1nCoV7'
1502184786705915905,2022-03-11 07:28:57+00:00,b'Jenis emak2 menghadapi minyak goreng langka:\n\n\xf0\x9f\x94\xb4 Ikut antri panjang berjam-jam \xe2\x9d\x8c\n\xe2\x9c\xb3\xef\xb8\x8f Keluarkan bakat mafia \xe2\x9c\x85 https://t.co/CAU6QNpfp0'
1501868778996797447,2022-03-10 10:33:14+00:00,b'Check penglihatan dan konsentrasi otak. \n\nAda angka apa saja didalamnya? https://t.co/EGr7Psrfjt'
1501738995587649536,2022-03-10 01:57:32+00:00,b'RT @bengkeldodo_: Alhamdulillah kaget dan senang ada notifikasi masuk eh ternyata difolback akun  dewa \xe2\x9d\xa4\xf0\x9f\x92\x95\n\nTerimakasih min \xf0\x9f\x92\x95 @INDONESIAinLO\xe2\x80\xa6'
1501376088647348224,2022-03-09 01:55:28+00:00,"b'\xf0\x9f\x91\xa9\xf0\x9f\x8f\xbb : Mas kamu jadi merantau ke           kota?\n\xf0\x9f\x91\xa6\xf0\x9f\x8f\xbb : Gak dek, aku di sini aja bersama kamu. https://t.co/lzOzgCIIom'"
1501152028588130305,2022-03-08 11:05:08+00:00,b'Seputaran gunung Sumbing bosss https://t.co/HitGIbrmGR'
1501106407231614980,2022-03-08 08:03:51+00:00,"b'Sdh lama banget gak pernah naik taksi @Bluebirdgroup. Sekalinya naik, argonya 29 ribu, bayar pakai cash 50 ribu dan tak lama supir taksi angkat suara:\n\n""Maaf Pak tidak punya kembalian""\n\nAku dgn bijaksana ""ambil aja pak kembaliannya"" \n\nTapi ngomelnya sdh seminggu.'"
1501013398653313026,2022-03-08 01:54:16+00:00,b'Ini Majalengka Boss... https://t.co/mT0ScpDIuH'
1500640319343570947,2022-03-07 01:11:47+00:00,b'Pagi2 jangan katrok. Ntar kena jewer lo. https://t.co/9POqqftF2N'
1500637877033914371,2022-03-07 01:02:05+00:00,b'Selamat pagi Indonesia \xf0\x9f\x87\xae\xf0\x9f\x87\xa9 https://t.co/5IKfC54zpY'
1500473706300448774,2022-03-06 14:09:43+00:00,b'Idaman kamu yg mana? \n\nBerdiri \xe2\x9c\x85\nDuduk \xe2\x9c\x85\n\n https://t.co/LBTjaOus6w'
1500384066809786373,2022-03-06 08:13:31+00:00,b'RT @Evello12: Zelensky Akan Dikenang Dalam Waktu Yang Lama. Sebuah Analisis Big Data \n\n\xe2\x80\x9cLatar belakangnya kan komedian.. kok berani melawan\xe2\x80\xa6'
1500334924481830915,2022-03-06 04:58:15+00:00,b'Pilih yang mana? https://t.co/IzLDzYSJtz'
1500062884164149250,2022-03-05 10:57:16+00:00,b'\xe2\x9e\xa1\xef\xb8\x8fSuntik anak SD umum \xe2\x9d\x8e\n\xe2\x9e\xa1\xef\xb8\x8fSuntik anak SD suku Badui \xe2\x9c\x85\n\n#IlmuKebal https://t.co/mUK7RzM43G'
1500061152969392131,2022-03-05 10:50:23+00:00,b'\xe2\x9e\xa1\xef\xb8\x8f Sarapan bubur ayam biasa dengan pengamen.  \xe2\x9d\x8e\n\xe2\x9e\xa1\xef\xb8\x8f Sarapan Bubur Ayam dengan desing peluru      \xe2\x9c\x85 https://t.co/ymR7aVgOxH'
1500007777359458305,2022-03-05 07:18:17+00:00,b'Loh kok bisa? Biar apa sih kandungan itu? https://t.co/YWIJw1P7jS'
1499933469170094081,2022-03-05 02:23:01+00:00,"b'Negara dengan jumlah bahasa daerah terbanyak di dunia. 1. Papua Nugini, 2. Indonesia 3. Nigeria https://t.co/e7HTvtxfAF'"
1499754450575310850,2022-03-04 14:31:39+00:00,b'Netijen negeri ini memang ajaib https://t.co/eQXsaqXlYr'
1499393126955646980,2022-03-03 14:35:53+00:00,b'Setuju dan dukung ini https://t.co/vOCzEmCyWL'
1499356263565893632,2022-03-03 12:09:24+00:00,b'Kok tahu? https://t.co/TScA2qdM0x'
1499345876837634054,2022-03-03 11:28:08+00:00,b'Brrrr brrrr https://t.co/OwMkbqk8y1'
1499339780370624513,2022-03-03 11:03:54+00:00,"b'Coba tebak, dimana lokasinya? https://t.co/W5xGbjVpNU'"
1499241725927501826,2022-03-03 04:34:16+00:00,b'Selamat datang Angelina Sondakh.\n\nCukup ya. Yuk bisa. https://t.co/WlA1d3Z6xx'
1499050416243613696,2022-03-02 15:54:04+00:00,b'Nama kamu siapa? Tinggal dimana? Sdh ada yg punya blm?\n\n#KisahDariTegal https://t.co/skdnLWIh96'
1498998657030717441,2022-03-02 12:28:24+00:00,b'Cocok gak buat malam ini? https://t.co/M0nouAhc2d'
1498888711437963266,2022-03-02 05:11:31+00:00,"b'Nemu sajian tahu goreng, kok bahagia banget ya. https://t.co/yRjhXeEktM'"
1498661825361375233,2022-03-01 14:09:57+00:00,"b'@dah_hary Cocok ya, dua mangkok boleh juga'"
1498655091347562499,2022-03-01 13:43:12+00:00,b'Mie godok ala jogja. Cocok gak? https://t.co/3ZpDPDBrho'
1498601097539121157,2022-03-01 10:08:38+00:00,"b'Ada iklan @cakimiNOW, sayangnya brandingnya gak jelas. Dulu bgt Cak Imin, trus jadi Gus AMI dan skrg nama lengkap Abdul Muhaimin Iskandar.  https://t.co/51HPbHfyeW'"
1498595843599118339,2022-03-01 09:47:46+00:00,b'RT @Evello12: Berikut video2 hoaks dengan jumlah tayang tertinggi pada periode sepekan ini. Hoaks itu kejam #stophoax \n\n#tanyaevello\n\nhttps\xe2\x80\xa6'
1498585015969812481,2022-03-01 09:04:44+00:00,b'Apa kabar yg di serang? Semoga baik2 saja.  https://t.co/vE2l7kFl8g'
1498210568746188803,2022-02-28 08:16:49+00:00,b'Buat yg coba2 ke puncak. Masih ingat pepatah gak? https://t.co/vIXwh4iRQx'
