twitter_id,date,tweet
1463436894566453248,2021-11-24 09:18:39+00:00,b'Generasi milenial ini hebat. Mereka bisa berdesakan nonton konser  Ebiet G Ade yg nyanyi dambil duduk. Ebiet pun sampaikan rasa harunya melihat anak2 muda memberikan apresiasinya pada orang tua. https://t.co/BQSByyaDaU'
1463331934424244224,2021-11-24 02:21:35+00:00,b'Hati2 meletakkan sepatu di teras. Pastikan kamu aman sebelum dipakai. https://t.co/83pSnlvBAW'
1462996547793133568,2021-11-23 04:08:52+00:00,"b'Banyak yg skrg mengeluh macet krn WFO. ""Mending WFH, enak kerja dari rumah"" kata netizen. \n\nKamu pilih WFO atau WFH? https://t.co/retk03C2m9'"
1462938042579046401,2021-11-23 00:16:24+00:00,b'Soal telur ternyata banyak mitos dan fakta yg berkembang. \n\n#AyoSarapan https://t.co/OelN1aXgMz'
1462723618639544320,2021-11-22 10:04:21+00:00,b'Judul skripsi: Potensi kreativitas tawuran di Indonesia. Analisa perkembangan metode dahulu dan masa mendatang. \n\nSekedar usul buat yg blm nemu ide skripsi. https://t.co/8z1on9lKla'
1462714588533719045,2021-11-22 09:28:28+00:00,b'Boleh tahu gak apa hubungan video Ibunda Arteria Dahlan dimaki-maki dengan Emil Salim?  https://t.co/HEqi8mCG5k'
1462704532576636933,2021-11-22 08:48:30+00:00,b'RT @godamprakoso: @INDONESIAinLOVE Mangga dikunjungi dan diorder ya Gan....\nhttps://t.co/kUS08PMxMR'
1462642920113074176,2021-11-22 04:43:41+00:00,b'Ide jelang siang. \n\nSepakat? https://t.co/wms3plHBUP'
1462573846872018949,2021-11-22 00:09:13+00:00,b'Pantang menyerah era 4.0 https://t.co/V3NoyVCK56'
1462260852115984385,2021-11-21 03:25:29+00:00,"b'Selamat jalan legenda bulutangkis Indonesia, Verawaty Fajrin. Ia wafat di Rumah Sakit Dharmais, Jakarta, Minggu (21/11/2021) pagi WIB. https://t.co/gPLS0dHjFV'"
1462228015308410881,2021-11-21 01:15:00+00:00,b'Sudah berjemur pagi ini? \n\n#LawanCovid19 https://t.co/Lf78zgaK27'
1462225414273699844,2021-11-21 01:04:40+00:00,b'Selamat pagi Indonesia \xf0\x9f\x87\xae\xf0\x9f\x87\xa9\xf0\x9f\x87\xae\xf0\x9f\x87\xa9 https://t.co/adDZsMpcuQ'
1461870610187894785,2021-11-20 01:34:48+00:00,b'Ormas #FBR dan #PemudaPancasila bentrok di pasar Lembang Ciledug. \n\nBaiknya kedua ormas bubarin aja ya? RT kalau km setuju https://t.co/RtCDTMokXi'
1461647735073902598,2021-11-19 10:49:10+00:00,"b'Legenda tinju dunia, Mike Tyson punya kebiasaan aneh sblm bertanding. Ia harus bercinta dahulu sblm bertanding di kamar mandi atau ruang ganti. Tyson punya alasan sendiri knp ritual tersebut harus dilakukan. https://t.co/NzunLjhkWr'"
1461603434822455296,2021-11-19 07:53:08+00:00,b'Skrg kita hidup di era penjahat lebih ngegas ketimbang korbannya. Tetap semangat kak Nirina. \n\n#LawanMafiaTanah https://t.co/YgJDhzYj8A'
1461502181631152128,2021-11-19 01:10:48+00:00,b'Awali hari2mu dengan \xe2\x80\xa6\xe2\x80\xa6. https://t.co/Ojs0TZ5GNb'
1461501438706679812,2021-11-19 01:07:51+00:00,"b'Namanya Riri Khasmita, Mantan ART Nirina Zubir, Otak Kasus Mafia Tanah Rugikan Rp17 Miliar. https://t.co/NRTBANfZhk'"
1461356019871739909,2021-11-18 15:30:00+00:00,b'RT @INDONESIAinLOVE: Mereka anak2 yg hebat. Musuh terbesar dalam hidup adalah mengalahkan malu dan gengsi dlm diri sendiri. Semoga sukses.\xe2\x80\xa6'
1461352188353994758,2021-11-18 15:14:46+00:00,b'Sdh ketemu ya gaes. Cadas Pangeran gak serem. https://t.co/HBKnmCR70h'
1461351621196075014,2021-11-18 15:12:31+00:00,b'RT @DudyRudianto: Yana Supriatna (40 thn) yang dinyatakan hilang di Kawasan Cadas Pangeran menjadi trending pencarian di Google Indonesia p\xe2\x80\xa6'
1461177001104928771,2021-11-18 03:38:39+00:00,b'Hukum oh hukum.... https://t.co/0YCg70Q7TZ'
1461158891438280709,2021-11-18 02:26:41+00:00,b'RT @Evello12: Bagaimana image brand anda di masyarakat? positif atau negatif?\n\n#TanyaEvello\n\nhttps://t.co/AbiWvwOTAv\nhttps://t.co/YcnKL5Yzu\xe2\x80\xa6'
1461143169114902532,2021-11-18 01:24:12+00:00,b'RT @arjuna_keane: @INDONESIAinLOVE Sungai musi https://t.co/Q2ybDVuNgV'
1461133852802359296,2021-11-18 00:47:11+00:00,b'Mengawali hari dengan mandi di sungai.\n\nMungkinkah? https://t.co/RHyJhMlXhv'
1460902208573034497,2021-11-17 09:26:43+00:00,"b'Ladies, kalau kamu ditaksir pemilik mobil ini, terima atau tolak? https://t.co/tdLtaBlPfD'"
1460900462673076225,2021-11-17 09:19:47+00:00,"b'Berdasarkan pemeriksaan tim medis, anak gajah liar itu mengalami luka serius akibat terkena jerat pada bagian tengah belalainya yang hampir putus.'"
1460900265708507137,2021-11-17 09:19:00+00:00,b'Awalnya warga melihat gajah tersebut terpisah dari rombongannya pada Sabtu (13/11) lalu. Tim Balai Konservasi Sumber Daya Alam Aceh dan masyarakat baru menemukan anak gajah itu pada Minggu (14/11) siang dengan luka di belalainya.'
1460900091011559427,2021-11-17 09:18:18+00:00,"b'Seekor anak gajah yang terjerat bagian tengah belalainya dilaporkan mati setelah mendapat perawatan di Pusat Latihan Gajah Saree, Kabupaten Aceh Besar.'"
1460899634855874562,2021-11-17 09:16:29+00:00,b'Selamat jalan nak manis. \xf0\x9f\x98\xad https://t.co/GcBYXkDKb5'
1460864822698921986,2021-11-17 06:58:09+00:00,"b'Anugerah terbaik itu, bersaudara dan saling mencintai hingga menjadi debu. \n\nFoto: istimewa https://t.co/zYFFKgj3QJ'"
1460851132591329281,2021-11-17 06:03:45+00:00,b'Nyerah\xe2\x80\xa6 \xf0\x9f\x98\xb5\xe2\x80\x8d\xf0\x9f\x92\xab https://t.co/UVtqzqFkwJ'
1460851059694325760,2021-11-17 06:03:28+00:00,"b'RT @IpungLombok: Jalur pendakian Gunung Rinjani melalui Torean Lombok Utara, yg berminat ayo di jajal.... \n\nhttps://t.co/Q6gOSZTHvJ https:/\xe2\x80\xa6'"
1460783782185762820,2021-11-17 01:36:08+00:00,b'Turut berduka cita: Penyiar legendaris. https://t.co/0GEKR0OJdk'
1460778776200052737,2021-11-17 01:16:14+00:00,"b'Kalau suami kamu pulang mabuk, jangan dimarahi. Penjara menanti \xf0\x9f\x91\x8a https://t.co/Olup5eSue0'"
1460777749031702530,2021-11-17 01:12:09+00:00,b'Hidup adalah perjuangan tanpa henti-henti.\n\nSong: Dewa 19\nLokasi: Agam https://t.co/rlEdPr2QxI'
1460635026626793473,2021-11-16 15:45:02+00:00,b'Cukup\xe2\x80\xa6  #TimnasDay https://t.co/8cn74NZ3Mt'
1460621650597089280,2021-11-16 14:51:53+00:00,b'@DaniCicadasBdg Seri aja sudah bagus sih \xf0\x9f\x98\x84'
1460619797700362246,2021-11-16 14:44:31+00:00,b'RT @itemkritingg: @INDONESIAinLOVE Yok Timnas bisa https://t.co/Z58RtW0umO'
1460616312422502400,2021-11-16 14:30:40+00:00,b'Tetap semangat #TimnasDay. Sejauh ini masih solid. https://t.co/KmgSa4SVKx'
1460594400992501769,2021-11-16 13:03:36+00:00,b'Siapkan kopi dan cemilan utk #TimnasDay https://t.co/sT4TnFF4Zw'
1460590221821562881,2021-11-16 12:46:59+00:00,b'Wes angel \xe2\x80\xa6.  https://t.co/ABzAtBoSB9'
1460498581870186497,2021-11-16 06:42:51+00:00,b'Kamu bekerja dari mana? https://t.co/4yJYmj9Axc'
1460480717813542920,2021-11-16 05:31:52+00:00,b'Kamu dukung siapa? rt utk warga atau comment/likes utk geng motor. https://t.co/vni9Vd8cP7'
1460459959762620422,2021-11-16 04:09:23+00:00,b'What?? #PrayforSintang https://t.co/91S3jYYdDj'
1460451818111000578,2021-11-16 03:37:01+00:00,"b'Harus digugat, itu artinya negara tak hadir https://t.co/hQQZLQJSvn'"
1460407387857162241,2021-11-16 00:40:28+00:00,"b'Knalpot kamu bising gak? \n\nKesal dengan Suara Motor Pengendara, Warga Langsung Serang dengan Kayu P... https://t.co/1j0naAxf21'"
1460087123332239364,2021-11-15 03:27:51+00:00,b'Pasar tradisional Wonosobo diwaktu pagi. \n\nFoto: Istimewa https://t.co/RBxxgpMfk0'
1460046491406331908,2021-11-15 00:46:24+00:00,b'Kamu setuju gak? https://t.co/ehOt5H09xj'
1460045372529602561,2021-11-15 00:41:57+00:00,b'Hmmm helm nya boleh juga. https://t.co/mUluY5RPZq'
1459801319011545092,2021-11-14 08:32:10+00:00,"b'Sehat selalu Pak @SBYudhoyono, kami tunggu di tanah air. https://t.co/5t60Wdat3G'"
1459747519680843779,2021-11-14 04:58:24+00:00,"b'Saat gebuk berkerumun.. \n\nSaat diminta tanggung jawab, kabur.\n\n#Mental #SatpolPP https://t.co/nZAs8GH5Cf'"
1459740830168752131,2021-11-14 04:31:49+00:00,b'Jangan sedih karena hanya punya sedikit pilihan. Kadang banyak pilihan membuatmu tak pernah memilih. \n\n#JajanAjaRibet https://t.co/lzVnao0S5q'
1459527312597155846,2021-11-13 14:23:22+00:00,b'RT @Pengabdi_ketan: @INDONESIAinLOVE Ini lurr... https://t.co/WXsy9hERal'
1459516015075741703,2021-11-13 13:38:29+00:00,b'#BreakingNews Kilang Minyak Cilacap terbakar pukul 19.15 WIB. Masih dalam penangan.  https://t.co/eyhOnZy8kj'
1459417454455623681,2021-11-13 07:06:50+00:00,b'Di belakang rumah kamu masih seperti ini? https://t.co/p41fNGChPb'
1459383673350856709,2021-11-13 04:52:36+00:00,b'RT @vivitdhani: @INDONESIAinLOVE Ada donk \xf0\x9f\x98\x81 https://t.co/22iaJafFAY'
1459383594002964487,2021-11-13 04:52:17+00:00,b'RT @RatihRudianto: @INDONESIAinLOVE Ada dong Min \xf0\x9f\x98\x80 https://t.co/WibVzxCHMk'
1459339417923981312,2021-11-13 01:56:45+00:00,b'Di rumah kamu ada lampu seperti ini gak? https://t.co/P65nYYVNBw'
1459111151199916040,2021-11-12 10:49:42+00:00,b'Ada apa dengan Bu Susi? Sejak sore jadi trending?'
1458661487157805056,2021-11-11 05:02:53+00:00,b'@IroelSyahrul \xf0\x9f\xa4\xa3'
1458657598748585986,2021-11-11 04:47:26+00:00,b'@gemuruhbisu Kamu keren banget'
1458657468209197063,2021-11-11 04:46:55+00:00,b'Ada yang tahu ini dimana? https://t.co/v9SDQKiuHf'
1458609761847414789,2021-11-11 01:37:21+00:00,"b'RT @DudyRudianto: Hasil penelusuran #Evello, ternyata Menteri @kemenkomarves Luhut Binsar Pandjaitan cukup populer di jejaring Tiktok. Sele\xe2\x80\xa6'"
1458609578283728899,2021-11-11 01:36:37+00:00,b'Pernah gak kamu berusaha putus dari rokok? https://t.co/iBYrXIH5rM'
1458605456000122884,2021-11-11 01:20:14+00:00,b'Kita tak pernah tahu kapan bencana menghampiri kita.  https://t.co/u4G4wl68qi'
1458284550073683968,2021-11-10 04:05:05+00:00,b'Sungguh ngilu\xe2\x80\xa6 gak kuat jangan lihat ya. https://t.co/bzQcgXvnju'
1458262419944263685,2021-11-10 02:37:08+00:00,"b'Pahlawan tak selalu heroik. Tak harus berseragam gagah dan bersenjata. Dalam kelemahannya sebagai manusia biasa, Pahlawan menunjukkan asa pada mereka yang membutuhkannya. \n\nSelamat Hari Pahlawan. https://t.co/fKy7Qdg9rk'"
1458239132623273989,2021-11-10 01:04:36+00:00,b'Ada yg mengira ini di Eropa. Ini di kota Soe Nusa Tenggara Timur (NTT).\n#kenalinegerimu https://t.co/Glxly4LEjd'
1458014469968175105,2021-11-09 10:11:52+00:00,b'Apa ada yg kurang ya? https://t.co/2VOCXcJm4i'
1458009552721375234,2021-11-09 09:52:20+00:00,b'Dampak #SalamDariBinjai https://t.co/1r0hAT4UE4'
1457995117969625090,2021-11-09 08:54:59+00:00,b'Punya istri pengertian rasanya bahagia bgt. https://t.co/bqvZiEIfzO'
1457519160590618625,2021-11-08 01:23:41+00:00,b'Coba tebak\xe2\x80\xa6 siapakah dia? https://t.co/4jknaz9Hxc'
1457519085319712773,2021-11-08 01:23:23+00:00,b'Jawaban kamu paling keren\xe2\x80\xa6 https://t.co/JUPbCLHn8E'
1457266586704760835,2021-11-07 08:40:03+00:00,"b'Nah kali ini posisi mobil di belakang yg berpose, ternyata tetap kaki satu diangkat. \n\nFoto : 1988 berlokasi di pelabuhan bakauheni https://t.co/swPiCmpKoa'"
1457170423011893249,2021-11-07 02:17:56+00:00,b'Mau tanya\xe2\x80\xa6 kenapa orang2 jadul kalau di foto harus angkat kaki sebelah? \n\nLok: Lintas Melawai era 1980-an https://t.co/wXpOQp7Z6B'
1457151615564013570,2021-11-07 01:03:12+00:00,b'Ada yang baru nih? \n\n#Lalapan https://t.co/fc5dzorlvF'
1457149125430956032,2021-11-07 00:53:18+00:00,b'Masa sih ada yg tidak tahu ini dimana? https://t.co/FWlavAGBWS'
1456873777447391232,2021-11-06 06:39:10+00:00,"b'Kamu pilih apa? Bakso, Nasi Goreng atau Martabak? \nKalau ini adalah pilihan warga #Tiktok. \n\nhttps://t.co/hNL5RrZC3P'"
1456842329373896706,2021-11-06 04:34:12+00:00,b'Sepertinya sepiring gak akan cukup\xe2\x80\xa6\n\n#SotoLamongan https://t.co/ILqJq7ZE0f'
1456768812028629002,2021-11-05 23:42:04+00:00,"b'RT @INDONESIAinLOVE: Hei Lovers, ini Kampung Pelangi,tak jauh dari destinasi favorit Sam Poo Kong,kini jadi ikon wisata Kota Semarang. Seti\xe2\x80\xa6'"
1456615748818722825,2021-11-05 13:33:51+00:00,b'Apa itu Peparnas? Pekan Paralimpik Nasional (Peparnas) adalah ajang kompetisi olahraga menyerupai PON yang diikuti oleh atlet penyandang disabilitas Indonesia. Peparnas XVI 2021 sendiri digelar sesudah PON XX Papua 2021.'
1456614863510269955,2021-11-05 13:30:20+00:00,"b'Opening Ceremony Pekan Paralimpik Nasional XVI 2021 di Stadion Mandala, Jayapura, Papua #PeparnasXVIPapua #Peparnas2021 https://t.co/bwVJWhN6Fy'"
1456505606773239808,2021-11-05 06:16:11+00:00,b'Di Tiktok ditonton lebih dari 474 ribu views. \n\n#RIPVanessaAngel https://t.co/iReER2T6Ps'
1456290436088143880,2021-11-04 16:01:11+00:00,b'Tahukah kamu? Menurut @GreenpeaceID salah satu dampak dr perubahan iklim adalah banjir bandang yg melanda Kota Batu Jawa Timur. Cuaca ekstrem adalah bentuk perubahan iklim bumi kita. #prayForBatu\n\n https://t.co/U4is9YtPl2'
1456189020837335040,2021-11-04 09:18:11+00:00,b'RT @DudyRudianto: Berita @detikcom tentang kecelakaan Vanessa Angel dibagikan lebih dari 2 ribu kali dengan 3 ribu percakapan. \n\n#TrendingE\xe2\x80\xa6'
1456063021814407168,2021-11-04 00:57:31+00:00,"b'Jangan dipandang hina, mereka juga pahlawan. Mereka adalah korban-korban perubahan kondisi waktu itu yang tidak jelas...'"
1456062881787613185,2021-11-04 00:56:58+00:00,"b'Garong adalah singkatan (GAbungan ROmusha NGamuk). Jangan menyalahkan mereka, itu semua karena keadaan di waktu dulu yang sangat sulit menentukan pilihan.'"
1456062437149474819,2021-11-04 00:55:12+00:00,b'Garong rata-rata bersenjata pendek. Bila ada karabin larasnya dipotong sedikit agar mudah disembunyikan disarung.'
1456062254483345412,2021-11-04 00:54:28+00:00,b'Orang tidak berani bila waktu sudah sore sekitar pkl 17.00 melintasi daerah tersebut. Para garong ini tidak perduli korbanya dari Republik atau pihak orang bule (Belanda). Selama punya harta dan uang yang banyak di babat habis tanpa ampun oleh garong.'
1456062147838955527,2021-11-04 00:54:03+00:00,b'Ada cerita sedikit tentang ex Romusha ini. Nasib mereka tidak menentu. Sedikit yang bernasib baik ada sebagian juga yang menjadi garong di daerah tagogapu padalarang Bandung.'
1456062019484852227,2021-11-04 00:53:32+00:00,b'STASIUN SENEN 1947 DAN ISTILAH GARONG\n\nPasar Senen 1947\nPara ex Romusha menunggu rangkaian Kereta Api Jarak jauh di spoor 1 St. Pasar Senen untuk dipulangkan ke daerah masing-masing.\n\nOleh: Ainy Husein https://t.co/EQYHwC95iX'
1455720403758772224,2021-11-03 02:16:04+00:00,b'Berbeda dgn cara Kang Dedi\xe2\x80\xa6 video ini memperlihatkan rasa tidak suka warga terhadap bagaimana aparat menjalankan fungsi dan tugasnya hingga hilang respect. https://t.co/c6GZ9QXUNW'
1455719623559561222,2021-11-03 02:12:58+00:00,b'Kang @DediMulyadi71 memilih membantu dahulu walau kemudian terbukti sebaliknya. https://t.co/3MgUm7FFNY'
1455718781397790726,2021-11-03 02:09:38+00:00,b'Kang @DediMulyadi71 ini politisi keren. Punya karakter dan sabar banget walau emosi. -Part 1 https://t.co/hXeaJb13XR'
1455375179488514049,2021-11-02 03:24:17+00:00,b'Adakalanya hasil mengkhianati proses.\n\n#TetapSemangat https://t.co/JylrVy3wnN'
1455098874641534982,2021-11-01 09:06:20+00:00,b'Terus berlatih yang keras ya Bang... https://t.co/bRdFBgOHit'
1454992069013893125,2021-11-01 02:01:56+00:00,b'RT @DudyRudianto: Menilik Popularitas Film Pendek Tilik di Facebook\nhttps://t.co/52EK8txqGj https://t.co/hRZzhQOs0f'
1454973090258034689,2021-11-01 00:46:31+00:00,b'Sehat selalu Mas Purnomo. https://t.co/pyzqr37Vvk'
1454839851358961672,2021-10-31 15:57:04+00:00,"b'RT @Journaldi: Mengulik Bekas Pendaratan Pertama Sekutu di Holllandia, Kota Jayapura\n \nhttps://t.co/Ne8ET9E9iW lewat @tribunnews @jayapurau\xe2\x80\xa6'"
1454762511547305988,2021-10-31 10:49:45+00:00,b'Calon mantu idaman.. https://t.co/FxDQzvsoeA'
1454673540922298368,2021-10-31 04:56:13+00:00,b'Kisah lama saat Mendoan diprotes karena hak eksklusif pribadi. \n#SaveMendoan\n\nhttps://t.co/El3DOjqI2e'
1454640154467913733,2021-10-31 02:43:33+00:00,"b'Ukuran boleh jumbo, tapi mimin gak sanggup makan pecel lele ini. https://t.co/J08Fb89Bke'"
1454639553512296456,2021-10-31 02:41:10+00:00,b'RT @_sitimasitohh: @INDONESIAinLOVE Simulasi tahun baruan min haha https://t.co/t0a81a58eL'
1454418368711127040,2021-10-30 12:02:15+00:00,b'Malam minggu kamu dimana? https://t.co/bekmMuNe3I'
1454340265620033538,2021-10-30 06:51:54+00:00,"b'Beli satu, bisa dimakan sekeluarga seminggu. \n\n#TalasSumba https://t.co/wEPJIhYQrY'"
1454278720894615557,2021-10-30 02:47:20+00:00,b'@first_dhani Artinya habis 3 piring \xf0\x9f\x98\x80'
1454264863589498883,2021-10-30 01:52:17+00:00,b'Mas oknum ini uangnya banyak sekali ya? Berarti take home pay yg dibawa lebih dari jumlah ini. \n\nhttps://t.co/LMrvFDyIaL'
1454240250482462720,2021-10-30 00:14:28+00:00,b'Apakah kamu sehat? Coba kenali warna kotoranmu. \n\nSelamat pagi Indonesia \xf0\x9f\x87\xae\xf0\x9f\x87\xa9 https://t.co/hAkSUTetH0'
1453945597048725505,2021-10-29 04:43:37+00:00,b'Oh ternyata mereka tuh numpang cari makan aja di perusahaan plat merah. https://t.co/DOtsF31Ooo'
1453890041327984673,2021-10-29 01:02:52+00:00,"b'Selamat jalan nak, dunia memang tak selalu indah. \n\nNamanya Nopelinus Sondegau, umur 2 tahun, menjadi korban saat pecah baku tembak antara TNI/Polri dan TPNPB di Kampung Mamba, Distrik Sugapa, Ibu Kota Kabupaten Intan Jaya, Papua, Selasa (26/10/2021). https://t.co/wxU492A0XM'"
1453680482323873796,2021-10-28 11:10:09+00:00,b'Mau menyerah dengan keadaan? Banyak2lah belajar dari atlit Papua Laurens Siep. https://t.co/4YHuy2B7c9'
1453643153215348737,2021-10-28 08:41:49+00:00,b'RT @INDONESIAinLOVE: Betapa bahagia mereka bisa terlepas dari sampah plastik. \n\n#LebaranTanpaPlastik  https://t.co/yKWZ2GWF3B'
1453527555068235779,2021-10-28 01:02:29+00:00,"b'Kalau dulu kamu anggap ini keren, kita satu server. https://t.co/Se3WC9G7Av'"
1453260468324376585,2021-10-27 07:21:10+00:00,b'Pemerintah resmi meniadakan cuti bersama natal dan tahun baru utk menekan terjadinya gelombang ketiga #Covid19.\n\nKamu sepakat? https://t.co/QwucLGO6Fj'
1452999703730196480,2021-10-26 14:04:59+00:00,"b'3 topik paling ramai ditonton hari ini (26/10, 21:03 WIB) berdasarkan #TrendingEvello: Dugaan penyiksaan Anjing Canon, Pemukulan oleh Kapolres Nunukan terhadap anak buahnya dan Wawancara bersama Lucinta Luna. \n\n#TanyaEvello https://t.co/VA4hMKXdPh'"
1452990674953924615,2021-10-26 13:29:06+00:00,b'@jangandigaruk \xf0\x9f\x98\x85'
1452988617366724608,2021-10-26 13:20:56+00:00,"b'Harus diakui kita kalah kelas, baik fisik, teknik dan skill. Bener gak?\n\n#TimnasDay https://t.co/UeUzb0PLTk'"
1452900642683375620,2021-10-26 07:31:21+00:00,b'Hujan-hujan gini enaknya apa ya\xe2\x80\xa6 https://t.co/uqgEOWqBHG'
1452808560174268419,2021-10-26 01:25:27+00:00,"b'Pak Polisi, dibalik seragam yg gagah itu kita semua manusia biasa. Jikalau bogem melayang ke wajah pasti sakit dan terjatuh.  https://t.co/OFrvGvdAC7'"
1452621643268837385,2021-10-25 13:02:42+00:00,b'Update #COVID19. Ayo jangan kendor\xe2\x80\xa6 https://t.co/8qqUkhqGpg'
1452604366960017410,2021-10-25 11:54:03+00:00,b'Banggalah dengan apa yg kamu punya. https://t.co/JmQF0aSat1'
1452567772714594305,2021-10-25 09:28:39+00:00,"b'RT @yayasaninobu: \xf0\x9f\x93\xb8 A roaring orange sunset above the beach in @KABUPATENFAKFAK, West Papua.\n\n#NaturePhotography #LandscapePhotography #Fak\xe2\x80\xa6'"
1452495111317639170,2021-10-25 04:39:55+00:00,b'RIP Gunther. Terima kasih menjadi bagian dari masa remaja kami. https://t.co/bSo7WdxqhL'
1452125732293931021,2021-10-24 04:12:08+00:00,"b'Di kota besar, pemandangan seperti ini adalah kemewahan. https://t.co/ZsGcFlIDla'"
1451914750476967940,2021-10-23 14:13:46+00:00,b'RT @kumparan: Sebuah video berdurasi 16 detik yang memperlihatkan sejumlah petugas Satpol PP mengambil paksa seekor anjing berwarna hitam r\xe2\x80\xa6'
1451814503847395332,2021-10-23 07:35:25+00:00,b'Dimana nih? https://t.co/WBno2RbVEv'
1451751870385377288,2021-10-23 03:26:32+00:00,b'Pencarian dengan kata kunci Sukmawati mencapai lebih dari 10 ribu kali di Google Indonesia. Selain itu pencarian dilakukan dgn kata kunci Sukmawati Pindah Agama. #GoogleDailyTrending https://t.co/iL0bt8bSwm'
1451717050305445891,2021-10-23 01:08:11+00:00,b'Rinduku terjawab sudah \xf0\x9f\x98\x8d\n\n#JajananPasar https://t.co/BJUV6KdbZJ'
1451363442632245250,2021-10-22 01:43:04+00:00,b'Buat yg lagi di Madiun.. btw dimana alamatnya? https://t.co/GV8Ch03mK3'
1451195710141992961,2021-10-21 14:36:33+00:00,b'Sedih gak sih baca ini? https://t.co/icGCI7JwpD'
1451193237595512849,2021-10-21 14:26:44+00:00,b'Banyak2lah belajar dari kesabaran admin #Shopee #Bukalapak #Tokped menghadapi netizen +62'
1451019130816000002,2021-10-21 02:54:54+00:00,"b'Riam Dait, Air Terjun 7 Tingkat. \n\xe2\x80\xa2\nSalah satu air terjun paling unik yang ada di kabupaten landak Kalimantan Barat, terletak di perbukitan namun hamparan pasirnya mirip dengan Pasir Pantai. Hutan yang rimbun dengan sejuknya aliran air terjun dari Bukit Dait https://t.co/vOqfobmtjm'"
1450841754844819459,2021-10-20 15:10:04+00:00,b'Edukasi hukum buat kamu dan kita semua. #timraimas #ambarita https://t.co/MCzFrta4up'
1450508097634508801,2021-10-19 17:04:14+00:00,b'Guys sila disimak ya!! https://t.co/ppB6vasCMC'
1450506294410973189,2021-10-19 16:57:04+00:00,b'\xf0\x9f\xa7\x94\xe2\x80\x8d\xe2\x99\x82\xef\xb8\x8f: Mah papah mau periksa hp mamah..\n\n\xf0\x9f\x91\xa9\xe2\x80\x8d\xf0\x9f\xa6\xb0: Loh ada apa pah kok periksa2 hp mamah? \n\n\xf0\x9f\xa7\x94\xe2\x80\x8d\xe2\x99\x82\xef\xb8\x8f: itu kan wewenang papah.. sebagai suami. Mamah tahu gak apa itu kewenangan?'
1450321205341261825,2021-10-19 04:41:35+00:00,b'Tangis Bahagia itu akhirnya pecah. https://t.co/YP5Ejv4lTJ'
1450279702082379777,2021-10-19 01:56:40+00:00,b'Selamat datang kemacetan \xf0\x9f\xa4\x97\xf0\x9f\xa4\x97 https://t.co/cknTTlPmER'
1449897402714902528,2021-10-18 00:37:33+00:00,b'Ada apa dengan Sumatera Utara? https://t.co/KAAC0Px2Vr'
1449762906589974535,2021-10-17 15:43:06+00:00,"b'Sayangnya, bendera Merah Putih Indonesia tak dapat berkibar di momen mengharukan ini. \n\nYuk dukung terus perjuangan atlet nasional #ThomasCup2020 #ThomasCup #BadmintonIndonesia https://t.co/7Mxs53Ixk4'"
1449756530862002184,2021-10-17 15:17:46+00:00,b'Penantian 19 tahun usai. Indonesia berhasil menjuarai Thomas Cup setelah kalahkan China dengan skor 3-0 #ThomasCup #ThomasCup2020 #BadmintonIndonesia https://t.co/xRQHhYbQk7'
1449750513919037447,2021-10-17 14:53:52+00:00,b'INDONESIA JUARAAAAA \n\n#FinalThomasCup'
1449748136813993990,2021-10-17 14:44:25+00:00,b'Harap2 cemas menanti kemenangan Jojo untuk Indonesia. \n\n#ThomasCup2021 https://t.co/kGqS5EWmbA'
1449560058480586752,2021-10-17 02:17:04+00:00,b'Terima kasih sdh mengingatkan kembali.\xf0\x9f\x99\x8f\xf0\x9f\x8f\xbb https://t.co/AhF9rASSdn'
1449393209138835459,2021-10-16 15:14:04+00:00,b'RT @DudyRudianto: https://t.co/tVsnofRJQc'
1449303265200402434,2021-10-16 09:16:39+00:00,b'Turut berduka cita atas jatuhnya korban susur sungai MTS Harapan Baru Ciamis. https://t.co/WyMP6FP2Eg'
1448923395257556994,2021-10-15 08:07:11+00:00,b'Menanti penutupan #PONXXPapua2021 dan indahnya pegunungan di belakang stadion. https://t.co/wIw3YCLTUs'
1448823249110896647,2021-10-15 01:29:15+00:00,b'Wujudkan mimpi kamu. Jangan bermalas-malasan. https://t.co/hnZWhExLMo'
1448586551642914816,2021-10-14 09:48:42+00:00,b'Iklan tempelan ini bukan di Indonesia. Iklan ini berada di Vancouver Kanada utk pameran tunggal pelukis asal Indonedia: Noviadi Angkasapura. https://t.co/MFIHHe2r0m'
1448452969159004162,2021-10-14 00:57:53+00:00,b'Dear Pak @ridwankamil segini amat perlakukan atlit kalian. https://t.co/30YKp9QUNF'
1448241142789599234,2021-10-13 10:56:10+00:00,b'The power of mantan. https://t.co/gEMPsju7YD'
1448154765309853698,2021-10-13 05:12:56+00:00,b'Apa namanya di tempat kamu? https://t.co/tnYItqDORC'
1448111372420612097,2021-10-13 02:20:30+00:00,b'Woyyy dimana ini. Nurse line ketinggalan.. https://t.co/bldHXkdzP9'
1448110136883441667,2021-10-13 02:15:35+00:00,b'#PolriSesuaiProsedur  https://t.co/XG72uM6QM6'
1448109241915490305,2021-10-13 02:12:02+00:00,b'Bacaan bagus. https://t.co/DDwX9XRfL8'
1447929923381911560,2021-10-12 14:19:29+00:00,b'@sobakhus @RatihRudianto Halo kak @RatihRudianto bisa share ilmunya gak?'
1447922321705029636,2021-10-12 13:49:17+00:00,b'Tahukah kamu ini apa? Ini adalah kompos kering yg berasal dari sampah rumah tangga yg diproduksi oleh pegiat kompos @RatihRudianto. Kompos ini dijadikan buah tangan oleh kak Ratih sebagai bentuk kampanye #kelolasampahsendiri. https://t.co/MeGsBZ9xa6'
1447724672158617604,2021-10-12 00:43:53+00:00,b'What? Superman bukannya ngejar penjahat? Kok malah ngurusin orientasi seksual? https://t.co/tY0wt5KtFr'
1447405228261707779,2021-10-11 03:34:32+00:00,"b'Nasi bakar, pengantar semangat di senin pagi. https://t.co/KEJg2NiN7L'"
1447205636878389253,2021-10-10 14:21:26+00:00,b'Kamu cewek cerdas. Jangan mau sama cowok norak. \xf0\x9f\x91\x8f https://t.co/yGr4Q8CPYs'
1447013318925848576,2021-10-10 01:37:14+00:00,b'Jangan berhenti. Tuntaskan dan seret pelaku ke penjara. https://t.co/zqUrixlZHw'
1446866177754468359,2021-10-09 15:52:32+00:00,b'Perjuangan dimulai dari keyakinan akan kebenaran. Lanjutkan jenderal.. https://t.co/6CAYuLjzkb'
1446862871221047301,2021-10-09 15:39:24+00:00,"b'Kabar baik buat kamu, buat aku dan buat kita semua. https://t.co/JJzEjLhi4h'"
1446826283262873601,2021-10-09 13:14:01+00:00,"b'Enak ya kalau punya rumah pinggir laut, tiap hari jadi anak senja\n\n*Bayangin aja dulu ya https://t.co/tkhNyvTybC'"
1446716426379677696,2021-10-09 05:57:29+00:00,b'Kangen siang hari seperti ini gak? https://t.co/JoPwWIi6be'
1446684687393427458,2021-10-09 03:51:22+00:00,b'Selamat pagi Indonesia \xf0\x9f\x87\xae\xf0\x9f\x87\xa9 https://t.co/lu0XuL9Vod'
1446450788134318083,2021-10-08 12:21:56+00:00,b'Orang kecil butuh kerja. Pemberi kerja tak memperhatikan K3. Memanfaatkan keterdesakan rakyat kecil. Selamat jalan\xe2\x80\xa6 doaku utk kalian semua. https://t.co/rWGKgHj2sL'
1446421596449619974,2021-10-08 10:25:56+00:00,b'Apa yang kamu rasakan saat berada di sini? https://t.co/hlHsBb4Odm'
