twitter_id,date,tweet
1546557620571471877,2022-07-11 18:10:45+00:00,"b'Our choices do not need to change the world, but in many cases they are chances to change our world.'"
1545848915404079104,2022-07-09 19:14:36+00:00,b'\xe2\x80\x98I don\xe2\x80\x99t know\xe2\x80\x99 is an acceptable answer. \xe2\x80\x98Can I have some help?\xe2\x80\x99 is an acceptable question.'
1545411931015634944,2022-07-08 14:18:11+00:00,"b'Time passes, chapters finish, and with that new roles are sometimes bestowed upon us. We may not be ready for them, they may be difficult and we may flat out resist. Take the time needed to reflect and get to the core of the \xe2\x80\x9cwhy\xe2\x80\x9d. Might just be what\xe2\x80\x99s needed to turn the page.'"
1544964316864122883,2022-07-07 08:39:31+00:00,"b'We rarely have time for change, until it\xe2\x80\x99s time to change.'"
1544599487506796544,2022-07-06 08:29:49+00:00,"b'Do not downplay the care and maintenance you need to give yourself the best chance of reaching your goals. Take care of yourself. It\xe2\x80\x99s work, and takes time, but well worth it.'"
1544324768723255297,2022-07-05 14:18:11+00:00,"b'Does insurance cover this therapy session? Thank U @THEN1CKSTER for the in depth reflective look. I really thought your perspective was incredible, well researched, and made me question myself. I laughed, cried, and thought\xe2\x80\xa6 that there is the making of a great day. Respect. \xf0\x9f\xa5\x83 https://t.co/w5J1DlM3hW'"
1543954700860530691,2022-07-04 13:47:40+00:00,b'Stop being someone you are not for the benefit of someone that is not you.'
1543211756041936897,2022-07-02 12:35:28+00:00,b'Don\xe2\x80\x99t run away from what\xe2\x80\x99s happened. But don\xe2\x80\x99t let it define you. Let it teach you.'
1542484929161953285,2022-06-30 12:27:19+00:00,"b'Onward doesn\xe2\x80\x99t always have to be forward. Onward can mean accepting and processing setbacks, working thru them, absorbing the lesson they yield. Onward.'"
1541770194862891009,2022-06-28 13:07:13+00:00,"b'Overwhelmed with ALL the messages thru this month. Being at #WWERaw last night gave me an opportunity to show you how much YOU mean to me. Thank you @WWE for every chance you\xe2\x80\x99ve taken on me, so I will continue to always give my best for my home, for my family, for US.'"
1541534459194925056,2022-06-27 21:30:30+00:00,"b'Yup, this is how I know it\xe2\x80\x99s a Monday\xe2\x80\xa6 \n#WWERaw is LIVE tonight! \nSIGNED. SEALED. DELIVERED. \n8pm ET on @USA_Network! https://t.co/EJojcAXUZZ'"
1541404003686223872,2022-06-27 12:52:07+00:00,"b'What a long, strange trip it\xe2\x80\x99s been\xe2\x80\xa6\n\nTruckin\xe2\x80\x99 down to #WWERaw LIVE from Laredo, TX. Celebrate with me, @WWE, and the #WWE Universe! We\xe2\x80\x99re going to have some good Old Fashioned fun \xf0\x9f\xa5\x83 TONIGHT! https://t.co/l57y84X5Bd'"
1541039318390738947,2022-06-26 12:42:59+00:00,b'Having the best today possible might just make yesterday look a little more golden and tomorrow look a little more hopeful.'
1540384085020901376,2022-06-24 17:19:19+00:00,"b'It is impossible to encapsulate the last 20 years of life into one message, but the team @WWE make magic! \n\nI\xe2\x80\x99m excited and cannot wait to C the @WWEUniverse on #WWERaw! https://t.co/WNqswMn60t'"
1539584359941955589,2022-06-22 12:21:30+00:00,b'Trust takes a lifetime to build and a moment to destroy. Treat it as valuable as it sounds.'
1539234210086535168,2022-06-21 13:10:07+00:00,b'Climb the hill in front of you.'
1538861878314663937,2022-06-20 12:30:37+00:00,"b'Kindness is not easy when life becomes stressful. Nowadays with all the information at are disposal, stress is almost all day for many people. I know it\xe2\x80\x99s hard, and I\xe2\x80\x99m far from perfect, but when you can, take a breath\xe2\x80\xa6 summon kindness.'"
1538496577681104897,2022-06-19 12:19:02+00:00,b'Do not expect anyone other than yourself to understand any choice you make. But do except them to have their own perspective.'
1538161786645528577,2022-06-18 14:08:42+00:00,"b'Desperation has a way of forcing us into discovery or catastrophe. Take a moment, even the smallest moment, before you act. It could just be the difference between the two.'"
1537758606703083520,2022-06-17 11:26:36+00:00,"b'With the correct perspective, anything that ever happens to us in our life can be a lesson. We just need to be brave enough to want to learn.'"
1537402050048413696,2022-06-16 11:49:46+00:00,"b'It\xe2\x80\x99s not where you start the journey, it\xe2\x80\x99s not where you finish the journey, it\xe2\x80\x99s the journey.'"
1536753251588231169,2022-06-14 16:51:41+00:00,b'What we wear is an extension of us. In 20 years I have been ridiculed countless times about my \xe2\x80\x98uniform\xe2\x80\x99 but I would #NeverGiveUp on being ME. \nHere\xe2\x80\x99s to ALL of us who refuse to sacrifice who we are to please those who don\xe2\x80\x99t understand us. @WWEShop https://t.co/y1dNKujmfA'
1536241963212517378,2022-06-13 07:00:00+00:00,b'Be realistic with yourself whenever you\xe2\x80\x99re reflecting on the past. We can often make moments different in our mind than they actually were. Look for the takeaways. Look for the lessons. Look for the growth thru an honest lens. Never give up. https://t.co/x6DPgHlczH'
1535673174549053440,2022-06-11 17:19:50+00:00,"b'The world is all around us, but we should never expect it to revolve that way.'"
1535129001328615425,2022-06-10 05:17:29+00:00,b'Spend less time proving yourself to others and more time being yourself. Others will eventually understand.'
1534702186797703169,2022-06-09 01:01:29+00:00,b'We all have a spark of greatness inside us. We just need the drive to pursue our dreams. Proud to be the voice of @Honda and this introduction to the all-new HR-V. #ThePowerOfDreams https://t.co/KoExwH5N3K'
1534279215675228160,2022-06-07 21:00:45+00:00,"b'What a wonderful way to spend a Saturday. Misha and his mother, Liana define #NeverGiveUp. \n\nThank you to the @WSJ and @WWE who helped make this special visit possible. https://t.co/RpriCvjN3K'"
1533972285526245376,2022-06-07 00:41:07+00:00,"b'Been far too long and what a special occasion to be able spend with the @WWEUniverse!\n\nLaredo, TX, C U soon!!! #WWERaw #CenaMonth https://t.co/wj72M0qMW1'"
1533798471345418240,2022-06-06 13:10:26+00:00,"b'Success isn\xe2\x80\x99t defined by what you have done, but what you pass onto those who come next. If honesty is the core of any relationship, support must be how we show it. Thank you all for the kind words, I\xe2\x80\x99m always in your corner. https://t.co/A3u1Hdst6l'"
1533435979754876929,2022-06-05 13:10:02+00:00,"b'Honesty doesn\xe2\x80\x99t need to be brutal, it just needs to be honest.'"
1533070109190807552,2022-06-04 12:56:11+00:00,b'Be a vehicle of joy whenever possible.'
1532667707920883714,2022-06-03 10:17:11+00:00,"b'The longer you hold onto something, the heavier it will become.'"
1532292245386321923,2022-06-02 09:25:14+00:00,"b'In situations where you can, do all you can. In situations where you can\xe2\x80\x99t, do what you can to change your perspective.'"
1531882389907001344,2022-06-01 06:16:37+00:00,"b'Those who cause you emotional pain will continue to do so if you allow them to. Find the strength to course correct. It will not be easy, it will be worth it.'"
1531511730962145280,2022-05-31 05:43:45+00:00,b'Ahhhhhh very avant garde. Bold. I\xe2\x80\x99m moved by the @LarsWinther4 Sasquatch impression. So much to taste in this image if ya wanna. A true expression of the power of modern art. \xf0\x9f\xa7\x9c\xe2\x80\x8d\xe2\x99\x82\xef\xb8\x8f https://t.co/5yvweVnUv3'
1531143454100705280,2022-05-30 05:20:21+00:00,"b'Let us never forget all those who made the ultimate sacrifice to uphold the values at the core of our democracy. Life, liberty and the pursuit of happiness. #MemorialDay'"
1530834110129876993,2022-05-29 08:51:08+00:00,"b'Focus doesn\xe2\x80\x99t get rid of the noise, but it will help turn it into music.'"
1530466886248538112,2022-05-28 08:31:55+00:00,b'Do not limit yourself to be defined only by what others think of you.'
1529755648992346112,2022-05-26 09:25:42+00:00,"b'Just because large scale change may seem out of reach, doesn\xe2\x80\x99t mean we can\xe2\x80\x99t take small steps to change our actions and attitude towards the world.'"
1529080508906409986,2022-05-24 12:42:56+00:00,b'Usually in an argument you can either be right or move forward. One means nothing the other means moving forward.'
1528691435481989120,2022-05-23 10:56:54+00:00,"b'If forgiveness is something you value, offer it in abundance.'"
1528344649487814656,2022-05-22 11:58:54+00:00,b'Go to sleep each night with a plan. Wake up each day ready to adapt to what life throws at you.'
1527907440813031425,2022-05-21 07:01:35+00:00,b'Worry less about how high the ceilings are and invest more in the warmth of the home.'
1527260681803816960,2022-05-19 12:11:36+00:00,b'Care more about being kind and less about being correct.'
1526864954783047681,2022-05-18 09:59:07+00:00,b'Never expect the want without considering the work.'
1526501114014728193,2022-05-17 09:53:21+00:00,b'I am grateful to all those who attempt to buffer my stupidity.'
1526129099655225346,2022-05-16 09:15:06+00:00,b'Push yourself to constantly see fresh perspectives.'
1525850377077329920,2022-05-15 14:47:33+00:00,b'Many voices will influence you on who you should be and what is best for you. Make sure not to leave yourself out of that discussion.'
1525431851493511170,2022-05-14 11:04:29+00:00,b'Minimize the hold that pride has on preventing correction.'
1525060125391826945,2022-05-13 10:27:22+00:00,"b'When you find yourself continuously hitting a wall, circle back and revisit the real obstacles in your path.'"
1524669424967557120,2022-05-12 08:34:52+00:00,"b'Aspire to do many things in life, but do not aspire to be anyone other than your best self.'"
1524286134750220289,2022-05-11 07:11:49+00:00,b'A relationship is only as solid as the trust it is based on.'
1523687966765293568,2022-05-09 15:34:54+00:00,"b'20yrs ago @DaveBautista began turning skeptics into believers. Crafting a remarkable legacy in @WWE and continues to amaze with his incredible work as an actor. He\xe2\x80\x99s outspoken, honest &amp; 1 of the nicest, most giving people I\xe2\x80\x99ve ever met. Happy 20yrs from an OWV classmate.Cheers!\xf0\x9f\xa5\x83'"
1523574842779267072,2022-05-09 08:05:23+00:00,b'Perform more random acts of love for those you love. And more random acts of kindness for all others.'
1523220013909516288,2022-05-08 08:35:26+00:00,"b'When people show you who they are, believe them.'"
1522215699321528321,2022-05-05 14:04:38+00:00,"b'Real forgiveness is brave. Find that bravery when you can. It\xe2\x80\x99s not only a chance for you to move on with your journey, but you are also offering help to those that have hurt you. There aren\xe2\x80\x99t many more displays of selflessness than this.'"
1521820130304528386,2022-05-04 11:52:47+00:00,"b'We strive so much for what we can get, never forget to take stock of what we have .'"
1521239226796363777,2022-05-02 21:24:29+00:00,b'A new approach to one of my favorite pastimes: the opportunity to spend more time with friends and loved ones over a delicious spirit. A toast to @ThomasAshbourne! \xf0\x9f\xa5\x83\n\nhttps://t.co/TrlAsf6pRp'
1520707924070346753,2022-05-01 10:13:17+00:00,"b'If you\xe2\x80\x99re about to do something with the main purpose to make people angry, stop and think clearly before you act. It more than likely will change your perspective.'"
1520352233937936384,2022-04-30 10:39:54+00:00,b'During hardship never lose the capacity to believe things will get better.'
1520027936845402112,2022-04-29 13:11:15+00:00,"b'There are very few, if any, experiences that match being included in someone\xe2\x80\x99s \xe2\x80\x9cwish.\xe2\x80\x9d It is an honor and also an important responsibility. The work @MakeAWish does is absolutely incredible and today we celebrate Wish Kids everywhere! #WorldWishDay'"
1519633805853827074,2022-04-28 11:05:07+00:00,"b'Betting on yourself is not a gamble, it\xe2\x80\x99s an experience.'"
1519269275005038592,2022-04-27 10:56:36+00:00,"b'Wisdom should always be shared widely, never withheld.'"
1518582867533705217,2022-04-25 13:29:04+00:00,"b'Everyone understands that you have far more talent, strength, and gifts than I ever had. Don\xe2\x80\x99t apologize for that. Ever. An apology should come 20 years from now if you fail to provide the EFFORT needed to turn your potential into your legacy. I hope that day never comes. \xf0\x9f\xa5\x83 https://t.co/3apKiTwgDw'"
1518247583306637312,2022-04-24 15:16:46+00:00,"b'I want to thank everyone who chose to share a message or contact me directly to remind me that life is the greatest gift anyone can receive. I will never promise to be perfect but I will promise to do my best to earn each day and approach life with love, empathy, and curiosity.'"
1518084808710266881,2022-04-24 04:29:57+00:00,b'Dear @JamesGunn she really spent the entire party eye effin\xe2\x80\x99 me. In a creepy 2D sorta way. https://t.co/6qGZzzRVjB'
1517733103535542278,2022-04-23 05:12:24+00:00,b'Another year where my best friend/arch enemy @iamjohnoliver from @LastWeekTonight reminds me that 4/23/77 is HIS day. As a 4/23/77 John myself I humbly recognize and respect that today I\xe2\x80\x99m just a #2 in the John\xe2\x80\xa6 such is life #HappyBirthdayJohnOliver https://t.co/CzwyNjmr9O'
1517503532064288771,2022-04-22 14:00:10+00:00,"b'We all rely on each other as a human race, so today, on #EarthDay join the #ElbowGrease: Cleanup Crew that teaches readers the importance of our place on Earth and how we can work together! @randomhousekids\n\nhttps://t.co/Pt5sE18AIj https://t.co/WAAkB1YeqW'"
1517126275177058304,2022-04-21 13:01:05+00:00,b'For 20 years @RandyOrton has cemented his legacy as 1 of the greatest @WWE Superstars ever. I have the utmost respect for every achievement he\xe2\x80\x99s earned &amp; CONTINUES to earn. But my genuine love &amp; admiration for him is in his maturity &amp; growth as a human being. Here\xe2\x80\x99s to RKO! \xf0\x9f\xa5\x83'
1516839074648133632,2022-04-20 17:59:51+00:00,"b'This right here\xe2\x80\xa6\xe2\x80\xa6. Is some heavy hammer, peace makin\xe2\x80\x99 magic https://t.co/ipQG5vrhVN'"
1516805492743360515,2022-04-20 15:46:25+00:00,b'This might just be because of that slick looking chrome helmet and maybe enthusiasts getting excited for a @Marvel @DCComics crossover chrome helmet showdown?? https://t.co/NXJABJTOKG'
1516392859254943744,2022-04-19 12:26:45+00:00,b'There is no such thing as perfect progress.'
1516029636693483523,2022-04-18 12:23:26+00:00,b'The biggest mistake of all is being placed in an environment that does not allow mistakes to be made.'
1515366294186389507,2022-04-16 16:27:33+00:00,b'Spend less time hoping something comes true and more time figuring out how to do it.'
1515014540441710592,2022-04-15 17:09:48+00:00,b'Don\xe2\x80\x99t panic'
1514618047197114374,2022-04-14 14:54:17+00:00,b'Always strive for that zone just barely out of reach. Over time you\xe2\x80\x99ll reach far beyond what you currently can\xe2\x80\x99t grasp.'
1514237030246412288,2022-04-13 13:40:15+00:00,"b'Those that influence you mold your perspective. When searching for change, make sure to take honest inventory of those close to you.'"
1513475535023734788,2022-04-11 11:14:21+00:00,b'Don\xe2\x80\x99t seek \xe2\x80\x9csuccess\xe2\x80\x9d strictly to prove skeptics wrong. Find something you love and passionately commit to it. There will always be skeptics and critics no matter the level of achievement.'
1513200368380915713,2022-04-10 17:00:56+00:00,b'Work hard to understand the difference between constructive criticism and hurtful manipulation. One will inspire growth the other might be disguised as \xe2\x80\x9cfor your own good\xe2\x80\x9d but little \xe2\x80\x9cgood\xe2\x80\x9d will come from it.'
1512821405934571522,2022-04-09 15:55:04+00:00,"b'Each day we have a choice of which \xe2\x80\x9chills to climb\xe2\x80\x9d. Ask yourself why you choose to \xe2\x80\x9cclimb\xe2\x80\x9d a particular \xe2\x80\x9chill\xe2\x80\x9d over another. During those moments of difficulty, failure, and even triumph never forget the why.'"
1512470226478247943,2022-04-08 16:39:36+00:00,b'Meaningful goals are rarely achieved overnight. In 2006 I had the honor of visiting India. It was extraordinary! It\xe2\x80\x99s been a goal to return to a culture I\xe2\x80\x99m eager to learn from and to who I owe so much. Grateful to @amazonstudios for this opportunity! \n\nhttps://t.co/O4XOKtkIGR'
1512023110953758726,2022-04-07 11:02:56+00:00,"b'Soooo many choices for end zone celebrations! VKM strut, Shane O\xe2\x80\x99 shuffle\xe2\x80\xa6 end zone dance aside, congrats on earning an incredible opportunity!! https://t.co/7VWRMnvjGe'"
1511705824388919300,2022-04-06 14:02:09+00:00,b'We all like things fast. But shopping for new car insurance? Slow. Until @Experian_US changed the game. Now you can find new car insurance fast - really fast. Experian could even help you save hundreds. https://t.co/uej36F78Yh https://t.co/BMojablF2u'
1511320231846694922,2022-04-05 12:29:56+00:00,b'Allow your mind to wander on occasion. Whatever you miss will most likely be there when you plug back in.'
1510971620457959426,2022-04-04 13:24:41+00:00,"b'Congrats to everyone who made this year\xe2\x80\x99s #WrestleMania an absolutely STUPENDOUS 2-night affair. Celebrate the weekend, the fans &amp; the closing one of chapter to start the next. \nEnjoy the shortest off season in ALL of sport &amp; entertainment before a VOCAL #WWERaw crowd tonight! \xf0\x9f\xa5\x83'"
1510615036133318658,2022-04-03 13:47:45+00:00,b'#WrestleMania'
1510321159396601859,2022-04-02 18:19:59+00:00,"b'I was, am and always will be a fan first! #WrestleMania is the greatest spectacle in all of sports and entertainment! Excited for the entire @WWE Universe and wishing all those involved the best!'"
1509894991442759681,2022-04-01 14:06:33+00:00,b'You can give your all to your work just don\xe2\x80\x99t let your work be all that you are.'
1509473014290825220,2022-03-31 10:09:45+00:00,b'When we become no longer interested in truth we become harmful to ourselves and those around us'
1509209661186191364,2022-03-30 16:43:17+00:00,"b'Live with someone, not for someone. Harmony is far more productive for all than subjugation.'"
1508788951015952385,2022-03-29 12:51:32+00:00,"b'To live with no apology is to live with no flaw. No flaw is no failure. No failure is perfection. No one is perfect. Embrace the powers of apology, forgiveness, empathy and connection. Live.'"
1508411181320785920,2022-03-28 11:50:25+00:00,b'Control the controllable. Not what happens but what you do about what happens.'
1508057292348043270,2022-03-27 12:24:11+00:00,"b'When we make a mistake, especially one that causes hardship, we can not force those affected to forgive. They must come to that on their terms. But we can be accountable, apologize, learn and do our best to course correct.'"
1507827353820479494,2022-03-26 21:10:29+00:00,"b'I do. Vividly. You worked your a** off on the road to the event and at the event itself. Sacrificing your body during the event to do all you could to give the audience every ounce, even possibly at the expense of your own memory. Your passion and dedication hasn\xe2\x80\x99t ever changed. https://t.co/VJkfwOOiYV'"
1507619240731369472,2022-03-26 07:23:31+00:00,b'If you wait for the perfect time. You will become a perfectionist at waiting.'
1507343034991755265,2022-03-25 13:05:59+00:00,b'8 episodes down! Lot of EVIL for one day! \xf0\x9f\x98\x88 glad you enjoyed it !!!! #WWEEvil https://t.co/XQALtwAmVT'
1507342793517248520,2022-03-25 13:05:01+00:00,b'One of my favorite bad guys and #WrestleMania opponents. He reminds everyone all the time! #WWEEvil https://t.co/FGtt6PfEhU'
1507342688152129538,2022-03-25 13:04:36+00:00,b'Let me know what you think! #WWEEvil https://t.co/qAWnQCUaOF'
1507009780086284290,2022-03-24 15:01:45+00:00,"b'Some of @WWE\xe2\x80\x99s most vile, most despicable \xe2\x80\xa6 and most entertaining characters of all time have one thing in common: they are EVIL!\n\nSee all episodes of the new series #WWEEvil streaming on @peacockTV NOW!! https://t.co/FpCOvq7qWm'"
1506938970776743936,2022-03-24 10:20:22+00:00,b'Seeing this to start the day. Wow! Amazing \xf0\x9f\xa7\x9c\xe2\x80\x8d\xe2\x99\x82\xef\xb8\x8f https://t.co/S3Udi1oeEH'
1506589638495985669,2022-03-23 11:12:15+00:00,b'Embrace those rare moments when you can operate just beyond your limits. Pretty soon the impossible will seem normal.'
1506410225313755136,2022-03-22 23:19:20+00:00,b'Wanted to thank you for believing in me when few did. For someone of your ability to give me a chance helped my confidence more than you know! Feels like it was just yesterday\xe2\x80\xa6but maybe because my days feel about 15 years long sometimes. #Respect https://t.co/qtHaujMZxn'
1506215638930497538,2022-03-22 10:26:07+00:00,b'Bringing the awesomeness of #Peacemaker across the pond and into YOUR homes. \n\nSee all episodes of @DCpeacemaker on @SkyTV and streaming on @NOW \xe2\x80\xa6 NOW! https://t.co/inlJTj4o1x'
1505866874327818245,2022-03-21 11:20:15+00:00,"b'Work hard to be good, and in the moments you can\xe2\x80\x99t find the strength to be good, be aware.'"
1505547646718590979,2022-03-20 14:11:45+00:00,b'If you find yourself in a place where it\xe2\x80\x99s wrong to ask questions \xe2\x80\xa6 you\xe2\x80\x99ve found yourself in the wrong place.'
1505232347221868550,2022-03-19 17:18:52+00:00,b'Knowledge is in the page. Wisdom is in the deed. Make sure to absorb adequate quantities of both.'
1504437869359865857,2022-03-17 12:41:53+00:00,"b'Care less about being remembered, care more about living.'"
1504061825603801088,2022-03-16 11:47:37+00:00,"b'The more you try, the more you will fail. Never stop trying.'"
1503695919962890249,2022-03-15 11:33:39+00:00,b'Not every triumph has to be earth shattering. Each day all of us do or can do many things to create a small win. See and embrace the small wins and it just might lead to earth shattering triumph.'
1503309919482789888,2022-03-14 09:59:49+00:00,"b'For any sort of change to happen, it must be genuinely believed that the change is feasible.'"
1502995776921866241,2022-03-13 13:11:32+00:00,"b'Drive is very powerful. To make sure that power is used in the right direction, never forget why you\xe2\x80\x99re driving.'"
1502690719940677639,2022-03-12 16:59:20+00:00,b'I have nothing to prove. I have everything to learn.'
1502481423000903683,2022-03-12 03:07:40+00:00,"b'Wow. Thank YOU for this!! I\xe2\x80\x99m inspired by those such as yourself who continue to inspire people across the globe!! #NeverGiveUp is a message for everyone, everywhere!! https://t.co/bJfC2Bk0pD'"
1502271491232223236,2022-03-11 13:13:29+00:00,b'May every answer we get on the journey lead to more questions and curiosity.'
1501966796055851015,2022-03-10 17:02:44+00:00,"b'For heroes to be heroes, we need villains. \nFor triumph to feel triumphant, we need struggle. \nFor good to overcome \xe2\x80\xa6 there must be evil. \n\nSee this 8-part series showcasing @WWE\xe2\x80\x99s most villainous characters.\n\n#WWEEvil premieres March 24th, streaming exclusively on @peacockTV. https://t.co/o8oeJeeMiM'"
1501878398448193548,2022-03-10 11:11:28+00:00,"b'In my excitement I have already purchased a very elaborate, somehow rocket powered, Rube Goldberg type machine that is designed to clean my unspeakables. It looked somewhat reliable and just crazy enough to work. Detailed reports to follow https://t.co/kwnng8vf2W'"
1501605671783092224,2022-03-09 17:07:45+00:00,"b'As a two-time host (and multi-time recipient of a famous @Nickelodeon sliming), it is so great to be a nominee for Favorite Movie Actor at the #KCA! \n\n#KidsChoiceAwards is such a fun show and THAT is what it\xe2\x80\x99s all about! \nhttps://t.co/C7icrvKl78 https://t.co/h72wuo4dMQ'"
1501378790689288195,2022-03-09 02:06:12+00:00,"b""RT @Wipeout: GET HYPE IT'S FINALE TIME! #WipeoutTBS https://t.co/DoZNJZs8W2"""
1501366958255751171,2022-03-09 01:19:11+00:00,"b""RT @Wipeout: Ever wonder if you'd make it all the way or fall victim to the Big Balls? \n\nNow\xe2\x80\x99s your chance to learn your #WipeoutTBS fate!\xe2\x80\xa6"""
1501349053069762560,2022-03-09 00:08:02+00:00,b'Everyone loves a good redemption story \xe2\x80\xa6 but are you ready for one on the #WipeoutTBS course? You\xe2\x80\x99ll have to tune into the season finale TONIGHT on @TBSNetwork!! @Wipeout https://t.co/H2muxz2Ys7'
1501263916311056387,2022-03-08 18:29:44+00:00,"b'Never in the history of #StoneColdFriday did I think I\xe2\x80\x99d see this!! Excited for @SteveAustinBSR, excited 4 the @WWE Universe and I\xe2\x80\x99m excited for #WrestleMania!!!! https://t.co/SLCjWlTSKA'"
1500780499501039616,2022-03-07 10:28:48+00:00,"b'It\xe2\x80\x99s incredible what can be learned, achieved, and experienced if genuinely committed.'"
1500415020005535747,2022-03-06 10:16:31+00:00,"b'It\xe2\x80\x99s been said \xe2\x80\x9cwhen it rains, it pours.\xe2\x80\x9d If that\xe2\x80\x99s true, fall in love with someone brave enough to dance with you durning the storm.'"
1500091069719093248,2022-03-05 12:49:16+00:00,"b'When trouble enters life and we need answers, always start with the person in the mirror.'"
1499733643140472843,2022-03-04 13:08:58+00:00,b'This interview is unlike any other because @VinceMcMahon is unlike any other person on this planet. Congrats to @PatMcAfeeShow for sharing this moment under the \xe2\x80\x98learning tree\xe2\x80\x99 only a select few ever get with your listeners.\n\nhttps://t.co/4y1ZAGzZJF'
1499375238475300866,2022-03-03 13:24:48+00:00,"b'No one is perfect. We all make poor choices. Absorb the appropriate consequence, navigate the best you can, continue attempting to live honorably.'"
