twitter_id,date,tweet
845686594556243968,2017-03-25 17:19:30+00:00,b'Penting nih!! https://t.co/sNWbNgstqf'
844766357505814529,2017-03-23 04:22:49+00:00,"b'Hujan, baru sampai kantor. Enaknya ngapain?'"
844398002630512640,2017-03-22 03:59:06+00:00,"b'Teman-teman yang berada di Bali, semoga gempa nya tidak berdampak panjang yah.'"
843710156403703808,2017-03-20 06:25:51+00:00,"b""Do what you love and you'll never have a problem with monday!!"""
843709577870827524,2017-03-20 06:23:33+00:00,"b""RT @Age_In_Days: Tweet your wishes to famous host @vjdaniel 'cause he celebrates 13,000 days anniversary today! https://t.co/QRf1B0BaoJ #Vj\xe2\x80\xa6"""
843000637759541248,2017-03-18 07:26:28+00:00,"b'@shady2brandals wawww. Okay, thank you for the review'"
842942436196270080,2017-03-18 03:35:12+00:00,"b'Ada yang sudah nonton ""Lion"" kah? Gimana reviewnya?'"
842659153604620289,2017-03-17 08:49:32+00:00,b'Hujan jumat. Gimana menurut lo semua?'
842563416778670080,2017-03-17 02:29:07+00:00,b'Guys! PUNO Asal Tebak game dari @damniloveindo udah top 3 nih! Yang belum download nyesel sih!! https://t.co/1TsYjRCwPc'
841961350029033473,2017-03-15 10:36:43+00:00,b'Kepengen martabak sore ini. Menurut kalian makan yang rasa apa?'
841551183613313024,2017-03-14 07:26:52+00:00,b'Jelaskan apa yang terjadi di foto sebelah kanan... https://t.co/WvVEcmgMH1'
840622020572332032,2017-03-11 17:54:42+00:00,"b""CONGRATSSS FOR SHARON DARI TORAJA!! IT'S A WRAP!!!! https://t.co/Ejs5eIeg4z"""
840621155354472448,2017-03-11 17:51:16+00:00,b'\xf0\x9f\x98\x82\xf0\x9f\x98\x82\xf0\x9f\x98\x82 https://t.co/qxZ4oVeIOf'
840102446407987205,2017-03-10 07:30:06+00:00,"b'""People don\'t buy what you do, they buy why you do it"" - Simon Sinek'"
839872561009696768,2017-03-09 16:16:37+00:00,"b'Sebelum lewat jam 12, selamat hari musik nasional. Maju terus musik Indonesia!!'"
839431679529762817,2017-03-08 11:04:42+00:00,"b'Dlm rangka #internationalwomensday bolehkah gw bertanya, apakah yang ngebuat lo bangga sebagai perempuan?'"
839431520754380800,2017-03-08 11:04:05+00:00,"b""Happy International Woman's Dat to all wonderful women out there!!"""
839137929398116353,2017-03-07 15:37:27+00:00,"b'Film ""Lion"" bagus ya? Ada yang sudah nonton? Review donggg'"
839080223354171392,2017-03-07 11:48:09+00:00,b'Hujan lagi. Bye!'
838803452230676480,2017-03-06 17:28:21+00:00,b'#backstage life tonight *maafkan kurang sedikit fokus videonya\xf0\x9f\x98\x82\xf0\x9f\x98\x82 https://t.co/ACXXjp2pdu'
838802923106623488,2017-03-06 17:26:15+00:00,b'Enjoyy https://t.co/UhSLJpfByl'
838765835795619842,2017-03-06 14:58:53+00:00,b'Thank you again for being such a humble and inspiring figure! It was an honor to have met you... enjoy Indonesia https://t.co/HnoIzYOXls'
838757333459050496,2017-03-06 14:25:06+00:00,"b""Don't you just love the cute Koala between me and Minister Ciobo? https://t.co/FCsPtWc34h"""
838725304780652544,2017-03-06 12:17:50+00:00,b'RT @bintangcomID: #SpiritEntertainment @vjdaniel Persiapkan Diri Ikut Chicago Maraton https://t.co/GpspH4nSti https://t.co/m95KobiO9b'
838725171426942976,2017-03-06 12:17:18+00:00,b'RT @bintangcomID: #SpiritEntertainment @vjdaniel Siap Lari di Amerika Serikat https://t.co/zkx2Nn6jrp https://t.co/Uaxy8ayv5G'
838244108376260609,2017-03-05 04:25:43+00:00,"b'Tiba2 melintas dipikiran kalimat ini ""jika kita jatuh, apakah kita ttp setia dan mau untuk mengulangnya kembali?""'"
838042327570493440,2017-03-04 15:03:55+00:00,b'Wahhh saya yg terima kasih sudah bs dibantu https://t.co/FsISeKTJtc'
838042143927099396,2017-03-04 15:03:11+00:00,b'RT @PTSPBangka: Thank you for your testimony @vjdaniel @PTSPBangka #jakartamelayani https://t.co/BSC93j8VFw'
837115256111390720,2017-03-02 01:40:04+00:00,"b'""You are smarter than you think, stronger than you think, and you are capable of so much more than you think"" have a great day guys!!'"
836984585367896065,2017-03-01 17:00:50+00:00,b'CONGRATS FOR THE CONCERT @bclsinclair'
836525513376030721,2017-02-28 10:36:38+00:00,b'Gilaaaa macet banget jalanan hari ini'
835921015125360640,2017-02-26 18:34:35+00:00,b'@IndonesianIdol tadi sore. See you next week guys https://t.co/SeNsY7H3PC'
835920806987235328,2017-02-26 18:33:45+00:00,"b'RT @IndonesianIdol: Kata @vjdaniel Km masuk ke dlm lagu itu, sehingga lagu itu jd milik km @AyiIdolJr #IdolJrTop3 @Official_MNCTV https://t\xe2\x80\xa6'"
835920769385275392,2017-02-26 18:33:36+00:00,"b'RT @Official_MNCTV: Terbukti, Mama @Nola_Be3 sampai menitihkan air mata dibuat @NavisIdolJr .Kalau kata Kak @vjdaniel penampilanmu sangat i\xe2\x80\xa6'"
835721386115026944,2017-02-26 05:21:20+00:00,b'Jangan lupa sore nanti @IndonesianIdol'
835721119491485696,2017-02-26 05:20:16+00:00,"b'What a blessed quotes!! Have a great sunday, sir! https://t.co/Yuhmjplfeb'"
835462592537645057,2017-02-25 12:12:58+00:00,"b'Nampaknya hujan nya ngerata nih, stay safe guys'"
835364088586723328,2017-02-25 05:41:33+00:00,b'Waw baru tau kl whatsapp sekarang bisa stories juga\xf0\x9f\x98\x82\xf0\x9f\x98\x82'
834670582830477312,2017-02-23 07:45:49+00:00,"b'""If you desire to make a difference in the world, you must be diffrent from the world"" - Elaine&amp;Dalton\nHave a great day guys'"
833912179443146752,2017-02-21 05:32:11+00:00,"b'Biasanya kl cuaca lagi gabagus kayak gini kondisi badan bisa drop nih guys. Hati2 yah, jaga kondisi badan biar ttp fit!!'"
833541664027271168,2017-02-20 04:59:53+00:00,b'Productive monday. Here we go\xf0\x9f\x98\x8e'
833540594051866624,2017-02-20 04:55:38+00:00,b'RT @IndonesianIdol: Menurut kak @vjdaniel Keren bgt @AuraIdolJr km bisa mengimbangi suara dr kak Regina #IdolJrDuetStar @Official_MNCTV htt\xe2\x80\xa6'
832865081457205248,2017-02-18 08:11:23+00:00,b'Sabtu. Pada punya rencana apa nih guys?'
832623661429305344,2017-02-17 16:12:04+00:00,b'@xtianbautista hey bro! Great to see you tonight! Keep in touch...'
831763929323937793,2017-02-15 07:15:48+00:00,b'Sampe Bung Karno aja respect karena Gw dah nyoblos buat Jakarta yang lebih baik #PilkadaDKI https://t.co/k6cOjej0q0'
831760693674262529,2017-02-15 07:02:57+00:00,"b'""May your choices reflect your hopes not your fears."" - Nelson Mandela'"
831760434059436032,2017-02-15 07:01:55+00:00,b'That eggs looks so yummmm https://t.co/tMZIGIk5AH'
831739316661604352,2017-02-15 05:38:00+00:00,"b'Hope for the best, for a better Jakarta!!'"
831509242695684097,2017-02-14 14:23:46+00:00,b'Happy valentine guys https://t.co/fRDFGMvh7x'
830708042085724160,2017-02-12 09:20:05+00:00,b'Happy sunday guys https://t.co/NgEqol7BMD'
830707928227209220,2017-02-12 09:19:38+00:00,b'RT @Official_MNCTV: Dan ketiga juri pun sangat menikmati &amp; enjoy banget dengan penampilan @NavisIdolJr sore ini! #IdolJrTOP5 https://t.co/F\xe2\x80\xa6'
830707905741479936,2017-02-12 09:19:33+00:00,b'RT @IndonesianIdol: Kak @vjdaniel aku bisa ngerasain bgt km nyanyinya dr hati dgn emosi yg pas @AlyciaIdolJr #IdolJrTOP5 @Official_MNCTV ht\xe2\x80\xa6'
830264951226785792,2017-02-11 03:59:24+00:00,b'Yang hujan yang masih ingin malas2an di kasur mana suaranya??? Have a great saturday guys'
830264352208941056,2017-02-11 03:57:01+00:00,b'@JaclynHalim hahaha gw juga\xf0\x9f\x98\x82'
830061499381018625,2017-02-10 14:30:57+00:00,b'Seru juga yah nontonnya #DebatFinalPilkadaJKT'
829321833925054464,2017-02-08 13:31:47+00:00,b'RT @tiketapasaja: JOGJA NIGHT RUN FEST 5 K with Daniel Mananta . 1 April 2017. Dapatkan discount 10% hanya di https://t.co/0VdBKzR43g https\xe2\x80\xa6'
829321677976657920,2017-02-08 13:31:10+00:00,b'Enakan yang mana menurut kalian'
828461209795956736,2017-02-06 04:31:59+00:00,"b'Selamat pagi menjelang siang, semangat senin!!!'"
828460118769487873,2017-02-06 04:27:39+00:00,b'RT @IndonesianIdol: Menurut @vjdaniel Ekspresi km msh blm tulus &amp; terlihat acting @NavisIdolJr #IdolJrDuetBattle @Official_MNCTV https://t.\xe2\x80\xa6'
828162648701145088,2017-02-05 08:45:36+00:00,b'Now @IndonesianIdol !! https://t.co/Im9ylupHM3'
828122591378313216,2017-02-05 06:06:26+00:00,b'I still remember the days I prayed for the thing I have now :) Have a blessed sunday guys'
827816050032996353,2017-02-04 09:48:21+00:00,b'Sukses untuk semua teman-teman yang berpartisipasi di #KonserGue2. #perjuanganbelumselesai'
827815721920892928,2017-02-04 09:47:02+00:00,b'Uber cool!! Sukses bro https://t.co/IoHKiRs5KZ'
827730430887550976,2017-02-04 04:08:07+00:00,b'+1 bro! https://t.co/wjG1vuuwCX'
827730314390761473,2017-02-04 04:07:40+00:00,"b'Dibuang sayang, sayang dibuang. Di acara kmrn malam ""Mandiri Gathering"" #imlek https://t.co/L3eohMltyf'"
827470333363916800,2017-02-03 10:54:35+00:00,"b'Bangettt mbak, gw suka banget https://t.co/3pewNmza2P'"
827470174760480768,2017-02-03 10:53:57+00:00,"b""Melanjutkan tweet gw sebelumnya, gw br nonton Dangal. It's a must!! Kalian harus nonton. Banyak banget pesan moral di dalamnya #Dangal"""
827010641424637952,2017-02-02 04:27:56+00:00,"b'Ada yang udh nonton ""Dangal"" blm?'"
826617758007775232,2017-02-01 02:26:45+00:00,"b'Had a great time, thannkssss man! https://t.co/H5S16g1bRU'"
826617146541084672,2017-02-01 02:24:20+00:00,b'RT @MNCupdate: Menurut kamu siapa nih Seleb Paling Macho? Dukung yuk di SON Awards!\n@AbimanA_A\n@vjdaniel\n@hamishdw\n@iko_uwais\n@RioDewanto28\xe2\x80\xa6'
826258563462893568,2017-01-31 02:39:27+00:00,"b""Steve Jordan, Pino Palladino, John Mayer, it's not a world tour if you aint coming to asia\xf0\x9f\x98\x8e https://t.co/9A7YvglNMg"""
825644728070787077,2017-01-29 10:00:17+00:00,b'Now @IndonesianIdol https://t.co/qYcwuSuCOj'
825585149819576321,2017-01-29 06:03:33+00:00,b'Word for myself!! Have a great sunday everyone https://t.co/A6Aed5Cq4W'
825335905569304577,2017-01-28 13:33:08+00:00,b'Selamat Tahun Baru Imlek untuk yang merayakan. Pada dapat angpao berapa taun ini? #imlek'
824913448827908097,2017-01-27 09:34:27+00:00,b'Seru bangeeettt @twitterid  punya emoji baru! #angpau #imlek'
824446087754768384,2017-01-26 02:37:19+00:00,"b'Morningggg, kamis rasa jumat ya\xf0\x9f\x95\xb6'"
823853457773711360,2017-01-24 11:22:25+00:00,"b'Udah pada nonton La La Land blm? Part mana yang menurut kalian bagus? Kl gw ""Mia\'s audition""'"
822986835181719554,2017-01-22 01:58:46+00:00,b'Fruits for breakie in the sunday morning feels lyke\xf0\x9f\x95\xb6'
822345829813919744,2017-01-20 07:31:38+00:00,"b""@Khunnie0624 words to remind myself for when I'm trying out to be the first 2PM member from Indonesia \xf0\x9f\x98\x85"""
822292149576155136,2017-01-20 03:58:20+00:00,"b'""Just because you took longer than others, doesn\'t mean you failed."" Have a powerful friday guys'"
822266835361886208,2017-01-20 02:17:45+00:00,b'tips @damniloveindo dalam membesarkan e-commerce! Cek out @Forbes interview with our head of online division! https://t.co/vPBmzwsoPw'
821158601574137856,2017-01-17 00:54:01+00:00,"b""It's not about how many ideas you have, it's about how much action you take. Have a great day guys!!"""
820921655790665728,2017-01-16 09:12:29+00:00,"b'Kembali ke hari senin, ada yang berbedakah dengan hari senin kalian?'"
820567446499135489,2017-01-15 09:44:59+00:00,b'@IndonesianIdol now!! https://t.co/VLJimgBlo6'
820098783933394944,2017-01-14 02:42:41+00:00,"b'Wawww survei membuktikan polling tweet kmrn adalah pasangan nomor 2!! Sedikit intermezo utk pagi ini, well have a great weekend guys\xe2\x9c\x8c'"
819929443615416320,2017-01-13 15:29:47+00:00,b'Pada pilih yang mana #Debat1PilkadaDKI Ini?'
819716182462763009,2017-01-13 01:22:22+00:00,b'Baru saja mendengar kabar duka. Selamat jalan mas Oon Project Pop. Semoga keluarga yang ditinggalkan diberi ketabahan dan kesabaran'
819144554653720577,2017-01-11 11:30:55+00:00,b'Kenapa bau popcorn itu menggoda banget ya? *sambilendus2'
819019009450475520,2017-01-11 03:12:03+00:00,"b""I'm so honored that my company @damniloveindo is chosen to be Most Valued Business. This\xe2\x80\xa6 https://t.co/WpocY4pwrY"""
818913527817605120,2017-01-10 20:12:54+00:00,b'Kalau kebangun tidur jam segini enaknya ngapain ya?'
818913425333989376,2017-01-10 20:12:29+00:00,b'+1 https://t.co/v1J7w3Uaam'
818083413840171009,2017-01-08 13:14:19+00:00,"b'RT @Official_MNCTV: Bak gayung bersambut, Kak @vjdaniel blg ""stage act"" @NavisIdolJr okee punya \xf0\x9f\x98\x89 #IdolJrDoubleElimination https://t.co/hGn\xe2\x80\xa6'"
818082794978963456,2017-01-08 13:11:52+00:00,b'Bersama Eyang Titiek Puspa di @IndonesianIdol https://t.co/5iwAfY2xfi'
817941754234048512,2017-01-08 03:51:25+00:00,"b'LoL. Typo angka banget gw, sorry guys..anyway have a great sunday..'"
817654876532445185,2017-01-07 08:51:28+00:00,b'Weekend pertama di 2016\xf0\x9f\x99\x82'
817166969635946496,2017-01-06 00:32:42+00:00,"b'Morning by morning new mercies I see, all I have needed Thy hand hath provided, great is thy faithfulness, Lord unto me. Have a great day :)'"
816909725891575809,2017-01-05 07:30:30+00:00,b'Jadi kepengen makan ini nih\xf0\x9f\x98\x82\xf0\x9f\x98\x82 https://t.co/nIz5KTq4eh'
816137158398394370,2017-01-03 04:20:36+00:00,"b'Seneng banget baca reply kalian ttg resolusi. Aminnnnn, semoga tahun ini tercapai semua dan yang pasti semakin lebih baik lg. Semangat guys'"
815880870833700864,2017-01-02 11:22:12+00:00,"b'Gw penasaran, resolusi 2016 kalian kemarin ada yang terealisasi kah?'"
815777728334991361,2017-01-02 04:32:21+00:00,"b'Semuanya aja serba ""pertama di 2017"" zzzz come on guyssss'"
815279368213696512,2016-12-31 19:32:03+00:00,b'HAPPY NEW YEAR INDONESIA!!! CHEERS FOR 2017'
813724231301152768,2016-12-27 12:32:29+00:00,b'Apa yang paling lo kangenin dengan suasana dan perayaan natal?'
812987973310394369,2016-12-25 11:46:52+00:00,b'SELAMAT NATAL TEMAN-TEMAN YANG MERAYAKAN. KIRANYA DAMAI DAN SUKACITA NATAL SELALU BESERTA KALIAN DAN KELUARGA\xe2\x98\x83\xe2\x98\x83\xf0\x9f\x8e\x84'
812486964104396800,2016-12-24 02:36:02+00:00,b'SELAMAT MALAM NATAL TEMAN-TEMAN SEMUA... MARI SIAPKAN HATI DAN PIKIRAN KITA'
811720471699783680,2016-12-21 23:50:16+00:00,b'Om telolet om zzzzzzzz'
811137091077804032,2016-12-20 09:12:07+00:00,b'Udara -1 Celcius aja.. handphone kedinginan sampe mati.. untung gak nyasar https://t.co/VgOmajzOe2'
810316712700612609,2016-12-18 02:52:13+00:00,b'Setiap pergumulan pasti ada campur tangan Tuhan di dalamnya. Selamat hari minggu orang-orang percaya'
810031298542637056,2016-12-17 07:58:05+00:00,b'Christmas is near wuhoooo\xf0\x9f\x8e\x84\xe2\x98\x83\xe2\x9d\x84'
808278212107059205,2016-12-12 11:51:57+00:00,"b'@pandji well, metaphor pelayan restoran is spot on! Gw sampai sedikit menitikkan air mata..'"
808141169246932992,2016-12-12 02:47:23+00:00,b'Selamat memperingati Maulidur Rasul untuk teman-teman yang merayakan'
807881953584160768,2016-12-11 09:37:22+00:00,b'SEKARANG @IndonesianIdol'
807331869662449664,2016-12-09 21:11:31+00:00,b'Pagi Manado. Tinutuan enak nih\xf0\x9f\x98\x8e'
807136199030620160,2016-12-09 08:14:00+00:00,b'Berduka sedalam-dalamnya mendengar kabar dari Aceh dan tragedi di Bandung :('
806034256480714753,2016-12-06 07:15:16+00:00,"b""When you know what you're doing, nothing will stop you. Have a great day, peeps!"""
805611151031554049,2016-12-05 03:14:00+00:00,"b'Pagiiii, kembali ke hari senin. Mari semangatttt guys!!'"
805335095670284288,2016-12-04 08:57:03+00:00,b'Stay tune guysssss https://t.co/wTKGImJtPG'
805271050162274304,2016-12-04 04:42:34+00:00,"b'Keinget lagu sekolah minggu gw sewaktu kecil ""Baca kitab suci doa tiap hari kalau mau tumbuh"" Selamat hari minggu orang-orang percaya'"
804538621768310784,2016-12-02 04:12:09+00:00,b'Tungguin kedatangan kita ya! DAMN! I love Manado! https://t.co/jNWb5qdvM6'
803894038550056960,2016-11-30 09:30:49+00:00,b'Thanks guys saran tempat beli siomay nya. Sekarang gw kepengen makan bakso *efekhujan *halahalesan'
803875444705595392,2016-11-30 08:16:55+00:00,"b'Okay, gw jiper... tapi @kellytandiono lagi simulasi jadi demonstran pagi ini di Training run\xe2\x80\xa6 https://t.co/yldplyOMb6'"
803832563253047296,2016-11-30 05:26:32+00:00,b'Somay yg enak di daerah jakarta selatan dimana ya guys?'
803792627195789312,2016-11-30 02:47:50+00:00,b'Akhirnya lari pagi lagi setelah beberapa hari absen. Udah pada olahraga apa pagi ini?  #pertemanansehat'
803561062171713536,2016-11-29 11:27:41+00:00,b'Kalau macet enaknya ngapain ya? Hemmmm laperrrrr'
803079777212973058,2016-11-28 03:35:14+00:00,"b'""If you spend your whole life waiting for the storm, you\'ll never enjoy the sunshine."" Happy monday guys'"
803078728930557952,2016-11-28 03:31:04+00:00,b'Eh wow! Di Google Indonesia image-nya Unyil mengenang  pak Raden.. baca artikel ini kalo lo kangen pak Raden! https://t.co/VeRjxuwF65'
802771516618260480,2016-11-27 07:10:18+00:00,b'Sunday. A gloomy sunday\xe2\x98\x95'
802115700135370752,2016-11-25 11:44:20+00:00,b'Ternyata guru favorit bukan berarti guru yang bagus dan berguna buat masa depan LOL. Ini cerita sedikit dr gw tentang #harigurunasional (6)'
802114727627235328,2016-11-25 11:40:28+00:00,"b""Karena semua pertanyaan ujian nya gak pernah di ajarin sama Mr. O'Meagher. Gw gabisa ngerjain dan ngejawab apapun (5)#harigurunasional"""
802114356255211521,2016-11-25 11:38:59+00:00,b'Pokoknya bebas dan seru banget!! SAMPAI PADA AKHIRNYA pas ujian akhir gw FAIL!! INI PECAHHH BANGET SIH KL GW INGET2 (4)#harigurunasional'
802113773829926912,2016-11-25 11:36:40+00:00,"b'Setiap pelajaran computer dia selalu ngebebasin kita ngelakuin apapun.Boleh santai cek internet dll, bebas mau ngapain (3)#harigurunasional'"
802113301949747201,2016-11-25 11:34:48+00:00,"b""Gw punya guru yg paling gw suka bgt namanya Mr O'Meagher, guru computer sewaktu gw sekolah di Perth, Australia (2) #harigurunasional"""
802112873447071744,2016-11-25 11:33:06+00:00,b'Hahaha seneng banget drtd bacain mention kalian ttg #harigurunasional kl gw punya pengalaman sendiri ttg guru favorit gw semasa sekolah (1)'
802016058358034432,2016-11-25 05:08:23+00:00,b'Successful people are Peacemakers... not peacekeepers. - https://t.co/H3sI8h0oQ7 https://t.co/1LpevvjP6l'
801979502968520704,2016-11-25 02:43:08+00:00,b'Selamat Hari Guru!! Siapa guru kesayangan kalian sewaktu sekolah?'
801616521613033473,2016-11-24 02:40:46+00:00,"b'""You can do anything but not everything."" Morning guys'"
800943273674035200,2016-11-22 06:05:31+00:00,b'Cuaca kayak gini enakan??'
800901024915431424,2016-11-22 03:17:39+00:00,b'Selamat pagiiii. Gimana kabar kalian semua pagi ini?'
800900867998158848,2016-11-22 03:17:01+00:00,b'RT @MeTubeID: 8 tahun menjadi host @IndonesianIdol dan kedekatannya dengan anak kecil membuat @VJDaniel dipercaya untuk jadi Juri di #IdolJ\xe2\x80\xa6'
800900710506213377,2016-11-22 03:16:24+00:00,b'RT @veedeea: Rejeki hari ini.. liat pak presiden @jokowi nge-PIM! Beliau berkunjung ke @DamnILoveYouIND :) cc: @vjdaniel https://t.co/VHykR\xe2\x80\xa6'
800271744460169216,2016-11-20 09:37:06+00:00,b'RT @IndonesianIdol: Whatt!! Kata kak @vjdaniel ini adl perfrom terburuk dr @IvanIdolJr ttep smgt ivan #IdolJrSpekta1 @Official_MNCTV https:\xe2\x80\xa6'
800270738909315072,2016-11-20 09:33:07+00:00,b'Now at @OfficialRCTI @IndonesianIdol https://t.co/YPsWR2uwVF'
800199174201352192,2016-11-20 04:48:44+00:00,"b'""Give God what you have and He\'ll give what you need. Need not you want!!"" Have a blessed sunday guys'"
799965768091770880,2016-11-19 13:21:16+00:00,b'Malam minggu gini enakan nonton yang mana ya?'
799569135105556480,2016-11-18 11:05:11+00:00,b'Photoshoot at Shinjuku Gyoen Park.. Thank you so much for the photo shoot dadakan by @sweet.escape and @diggy3625 https://t.co/63lBP5EpFj'
799376553779957760,2016-11-17 22:19:56+00:00,b'Selamat pagiiii. Kalau bangun pagi-pagi gini enaknya ngapain yaaa?'
799195807832379393,2016-11-17 10:21:43+00:00,b'Gilaaa jawabannya keren2 bangettt.. proud of you guys!! Respect!!'
799166173405323264,2016-11-17 08:23:58+00:00,b'Apa Toleransi menurut kalian?'
798861297420877824,2016-11-16 12:12:30+00:00,b'#sayatoleransi menurut gw &amp; @sandradewi88 https://t.co/jCw7bgoom8'
798745712309612544,2016-11-16 04:33:12+00:00,"b'Keep fighting, Pak!'"
798744503599255552,2016-11-16 04:28:24+00:00,b'KASIH itu melebihi semuanya!!'
798744261562757120,2016-11-16 04:27:26+00:00,b'Happy birthday! https://t.co/Ck5Hp8ZRrE'
797996412944252929,2016-11-14 02:55:45+00:00,b'Morning from Japan\xf0\x9f\x98\x8e'
797370016710545409,2016-11-12 09:26:41+00:00,b'RT @indonesiatatler: Funny face by @vjdaniel with our Tatler TV frame. Thank you for visiting our lounge! #IDTa\xe2\x80\xa6 https://t.co/70b7VFipT8 ht\xe2\x80\xa6'
797368416789110785,2016-11-12 09:20:19+00:00,b'RT @Official_MNCTV: Sore ini! Kamu harus liat perjuangan bintang-bintang cilik unjuk gigi dalam #IdolJrExtra sesaat lagi! @IdolJuniorID @vi\xe2\x80\xa6'
797289606332854272,2016-11-12 04:07:09+00:00,b'RT @Official_MNCTV: Sore ini! Kamu harus liat perjuangan bintang-bintang cilik unjuk gigi dalam #IdolJrExtra pkl 16:30 @IdolJuniorID @vidia\xe2\x80\xa6'
797289556231868416,2016-11-12 04:06:57+00:00,"b'RT @Official_MNCTV: Juniors! IdolJr sudah 16 besar, siapa ya yg akan memikat perhatian Mama @Nola_Be3 @vjdaniel &amp; @vidialdiano ? MINGGU pkl\xe2\x80\xa6'"
796546535219597312,2016-11-10 02:54:27+00:00,b'SELAMAT HARI PAHLAWAN!! Siapa pahlawan dalam hidup kalian dan kenapa mereka menjadi pahlawan?'
796288256220360705,2016-11-09 09:48:09+00:00,b'Masih berasa kegembiraan kemaren. Menghantarkan salah satu sahabat terbaik gw menuju altar pernikahan. Once again congratsss @SandraDewi88'
795967938217971716,2016-11-08 12:35:19+00:00,"b'Nah, ini contoh seleb dari bikin gosip dan aksen aneh, tapi berhasil jadiin sumbangan ke orang2 yang membutuhkan. https://t.co/QcAq9pTJXM https://t.co/vZpW9SjXKA'"
795964900946378752,2016-11-08 12:23:15+00:00,b'Congratulations Harvey &amp; Sandra!! #HarveySandraWedding @ Gereja Katolik Katedral Jakarta https://t.co/VQMkB7A6b9'
795853783360094209,2016-11-08 05:01:42+00:00,"b'Guys, Gw bakalan instastories buat #HarveySandraWedding nih seharian jnj. Cek Instagram Gw yak di @vjdaniel'"
795853710324662273,2016-11-08 05:01:25+00:00,b'The BestMen &amp; Bridesmaids #HarveySandraWedding https://t.co/eGnYCea0ol'
795852615846416384,2016-11-08 04:57:04+00:00,b'The BestMen &amp; Bridesmaids #HarveySandraWedding https://t.co/BVguBQmdxh'
795837443702304768,2016-11-08 03:56:47+00:00,"b'""Don\'t treat people as bad as they are. Treat them as good as you are!"" Have a great day guys'"
795610042061856768,2016-11-07 12:53:10+00:00,b'RT @Official_MNCTV: Bangga dengan diri sendiri adalah satu cara jalan untuk menuju kesuksesan! Siapa yang setuju sama Kak @vjdaniel ? #Iodl\xe2\x80\xa6'
795129412396064768,2016-11-06 05:03:19+00:00,b'Count your blessing not your problem :) Have a great sunday blessed people'
794763346478141440,2016-11-05 04:48:42+00:00,b'Oh well. Bagusan yang mana?'
794763164642471936,2016-11-05 04:47:59+00:00,b'Sabtu produktif. Enaknya ngapain ya? Ada saran?'
794762866553278464,2016-11-05 04:46:48+00:00,"b'RT @IdolJuniorID: Hahahha Ka @vidialdiano, Mama @Nola_Be3, itu Ka @vjdaniel mulai nyanyi lg doonk! @Official_MNCTV #IdolJrEliminasi https:/\xe2\x80\xa6'"
794755620654092288,2016-11-05 04:18:00+00:00,"b'RT @IndonesianIdol: Hahahha Ka @vidialdiano, Mama @Nola_Be3, itu Ka @vjdaniel mulai nyanyi lg doonk! @Official_MNCTV #IdolJrEliminasi https\xe2\x80\xa6'"
794732348583444484,2016-11-05 02:45:31+00:00,"b'Pas training pagi ini, ketemu sama orang orang yang berjasa menjaga #JakartakuDamai.. Thank you ya, Brimob Lampung https://t.co/YKQGpMHMp6'"
794566280019722241,2016-11-04 15:45:38+00:00,b'Hati2 yang masih di jalan ya. #JakartakuDamai'
794501142126333952,2016-11-04 11:26:48+00:00,"b'Ga kerasa besok dah masuk tahap eliminasi, n banyak yang punya penampilan keren-keren bgt! Really proud to all the Juniors! #IdolJrEliminasi https://t.co/bz889K2tBa'"
794463717417095168,2016-11-04 08:58:05+00:00,"b'RT @IndonesianIdol: Haaaai Ka @vidialdiano, Ka @vjdaniel &amp; Mama @Nola_Be3!! 72 Junior udh siap menyapa BESOK @Official_MNCTV! #IdolJrElimin\xe2\x80\xa6'"
794369352204095488,2016-11-04 02:43:06+00:00,b'1 minggu setelah Sumpah Pemuda. Mudah2an sumpah ini bukan hanya teori hapalan di sekolah. Karena kita satu Indonesia. #KitaIndonesia https://t.co/9pP3MEwo7e'
794363183217508353,2016-11-04 02:18:36+00:00,b'I speak blessing for today! Have a great friday everyone :)'
793994437659594753,2016-11-03 01:53:20+00:00,"b'Selamat pagi, selamat kembali beraktivitas guys!'"
793961993359212544,2016-11-02 23:44:24+00:00,b'Last night for BRI Prioritas. Feel so bleesed! https://t.co/PV0E39y6NK'
793679827408596992,2016-11-02 05:03:11+00:00,"b'""Anjing menggonggong, kafilah peluk sampai anjingnya jinak... dan pada akhirnya kita punya teman baru"" https://t.co/yUUupXlMXp'"
793663411276046336,2016-11-02 03:57:57+00:00,"b'""Good thing come to those who learn"" Happy wednesday everyone'"
793365598721875968,2016-11-01 08:14:33+00:00,b'HUJAN-MACET-BANYAK POHON TUMBANG! Sekian'
793133068840083456,2016-10-31 16:50:33+00:00,b'STAY TUNE GUYS!! https://t.co/NlcHCLre41'
792690780674461696,2016-10-30 11:33:04+00:00,b'RT @upranoto: tunggu besok Silet awards pkl 21.00 wib @officialrcti cc @dahSyatMusik @raffiah54713432 @vjdaniel https://t.co/LXZhA81T4C'
792567565910278144,2016-10-30 03:23:27+00:00,"b'""If you want to be great, learn to serve others"" Have a great sunday everyone!!'"
792299231503454209,2016-10-29 09:37:11+00:00,b'Bagian ini kocak parah sih. Kak Daniel sampe keluar urat2 di jidat karena ketawa https://t.co/cWoIXX6LZQ'
792284977706639361,2016-10-29 08:40:33+00:00,"b'RT @Official_MNCTV: Ini dia Allysha yg jd pembuka di #IdolJrAudisi3. Bukan main merdunya, suara Allysha bak seriosa! Sukses buat ketiga jur\xe2\x80\xa6'"
792254231600205824,2016-10-29 06:38:22+00:00,b'RT @Official_MNCTV: Ada yang bikin juri jatuh hati nih! Siapa ya? @vidialdiano @Nola_Be3 @vjdaniel Tonton #IdolJrAudisi3 pkl 15:30 https://\xe2\x80\xa6'
792254159089041409,2016-10-29 06:38:05+00:00,"b'RT @IndonesianIdol: Yes, yes, no, no! Liat nih keseruan @Nola_Be3 @vidialdiano @vjdaniel LALALA :D saksikan ya SORE INI #IdolJrAudisi3 di @\xe2\x80\xa6'"
